data_index,page,ad_type,ad_rank,organic_rank,asin,title,url,price_current,price_list,rating_stars,rating_count,is_prime,image_small,image_large,brand_name,scraped_at,inner_products_count
0,3,SB,3.0,,,Savory Beef Jerky Variety Pack,https://aax-us-east-retail-direct.amazon.com/x/c/JE2Z87gugKJzQ-QsCFAZ7IsAAAGduEmY1gEAAAH2AQBvbm9fdHhuX2JpZDMgICBvbm9fdHhuX2ltcDIgICBu-LZi/clv1c_ek-YBAvWbcbaXj1XZ_v_Sd5aokuZ0nDJMD3fZZpzPUPbIH4NBJ4Dlh2Bkym7dUBQY61fy9loeQP3muKa7AKy1xa0fzx9wwk3WYx9B-iCWtyyqxWSwkCK7Yf9_NNUxjC3hcWNcpGziBF9ZnWkeSY-l1f3It-0xhXpnJz1zhumrFae2W0AFKWG8mtIlcG0Baw7DJyHo9FpS7f49SeZ9UrWaCS_1023rOaEHeLk4S8dIRMa9Vjp6AMtB_kKKoVHcxur14rb77Ad6LCMQFzr102NabiJplqswqp_Jr9Y64N69cV8iAwVVbID_VbLjzQ587_9QHeqwOt8STFQY8HKhD91a2b1VYdwOaTUAp5KFoneXaP3CcY73f384lojKb1nTbBTk6cI_GzetUArp4X43QY48KMx3k_FF8vgztYn2pdbeulZFW5N-oZq_MQ8irezwo3JT6J1Z_BVceLBNEjnmk3S_S3VrJYXkbJeXXBXrbp5ca8dKg7bcN8dBuh9-_DGhXI0dOPxz6VXZDIptWF1s-lX0ow_J1MrCCXEHpQEOD_X3OQq_1a8xsnKMXH4n6TYbUZxV4-2C6l4j-xSXu8E7GZ9wew2OA6LZ1FS-4HZyswYHX8Jl2gfwYVWtUgV36vO4-hSrRUXGJSrw-aYu4vlvgp99svROBsy7icPYbayvScu-ZszqyYhEcNBrCDEA2ID7SXgWFoKH84yaXmrCKR0T-TgYFLjNb5c8hn0Fj-l5dgdf9s8lYgLavBRuLVdZiTIo0b-GvZ92cyq43Ra5ldHr3dOZs_y_s_zdAOYosnQAUC1oMk0DaVS_ePLoZKf96tmPfnPsS-RROKJsQg3vfAY7-aEE2z_Z0LuHDGW_VaadNHWsiTBYemzZx-vhrAtkfu_9QANue9sblVeTioDxJLmzCOYfKUD6SRxqTTOJjuCXKOatyIfCpuKuPcTjagZCoth_nU1zuyGI9mljMyMZtprWDWxssAOkb9k6PFGsvmU2yzFgEoIQzt9CmVfgPMNXY2ldhJ2TySdtbbFU4NHL_XBRMcl39tteWMrWysPEoo8jrhgH0FgmmEecPJB5Pwa2Pi2Zu86yXIBqP7BRZKfCiGu-YVz9dwqvPanxfIDdV2z4uVDMXMTVkoFNsij2ckK0jmgGEOVrkrpb7KidVlyRA-kpcaXgZ9ptr25vYi_TrGn2KQgY4YtJ_MKjdWC8RbZoFn-sPjSJFDaH58Ci9p73KLpRgRRoadvsvl1odbbCYPPFd9BSIymm29Bd8LgaZxXe-bo_pKc3EZlJS79K853rR_v5xS4OMnX-mNOTyQTPpxOzQ963VPykQkqMkVxlMz-4qJ_yONPDogyf5C9n-Wxs9tYeM7OXDRcv_vV2srpKBK_I5TIqbHg9DJD0fx-5wGCrPm8Yae3j68SU0DcsyMqwQ63p5g42uH_tYXgEqGM1P1NM1lI4MllrpwwzhWsdEi5aJWGxo65yrRAptK-Phk_UQf9TIv8jbKYt2BWGmhmlulz1ySG4Hk2lhUaYv0A2NQyxHcQYkcbROpqBZdpkYeBKStPd798pzvAOoAFM9NfHfxxKl6UAEkn3htsvzmhqdPuUy2spxmzegqrNm0WWAtO_rCNBItMN4Ti0JSj8lL7RAb6WMKo2IlBveLu77zvxoFCIsmFSBDVL5PzzrY7apB5DgixbQDVVchoZRQ/https://www.amazon.com/stores/page/6D52280F-FF76-417D-B139-523A16F610C6/?_encoding=UTF8&store_ref=SB_A05917692NEPEWG9IQR21-A01333083FMPR2YVX1GAD&pd_rd_plhdr=t&aaxitk=4d55b98dae65680d4d3c077ebb1c1cf0&hsa_cr_id=0&lp_asins=B07BN48LC1%2CB07FTZT8RK%2CB0B81151V6&lp_query=fathers%20day%20gifts&lp_slot=auto-sparkle-hsa-tetris&ref_=sbx_s_sparkle_sbtcd_bkgd&pd_rd_w=pARRu&content-id=amzn1.sym.cc961e39-6f5f-411e-8135-81c6c1187ac0%3Aamzn1.sym.cc961e39-6f5f-411e-8135-81c6c1187ac0&pf_rd_p=cc961e39-6f5f-411e-8135-81c6c1187ac0&pf_rd_r=JE1DKZPYZC5JSSH282NK&pd_rd_wg=YTV30&pd_rd_r=f050bc48-edf5-4ad4-8114-dc5799f9b897,,,,,False,"https://m.media-amazon.com/images/S/al-na-9d5791cf-3faf/e0288f93-c9db-43f8-aac4-9081c64c6c2a._CR0,0,600,408_AC_SX130_SY60_CB1169409_QL70_.jpeg",,Savory Beef Jerky Variety Pack,2026-04-23T11:02:08.830945,3.0
1,3,Title,,,,ResultsCheck each product page for other buying options. Price and other details may vary based on p,,,,,,False,,,,2026-04-23T11:02:08.831529,
3,3,Organic,,97.0,B0FT7NQZ1S,Golf Socks - Funny Annoyed Golfer Novelty Socks - Funny Golf Fathers Day Gift for Dad Husband Stepdad,N/A,$6.99,,4.9,16.0,False,https://m.media-amazon.com/images/I/61h68LkLV3L._AC_UL320_.jpg,https://m.media-amazon.com/images/I/61h68LkLV3L._AC_SL1500_.jpg,,2026-04-23T11:02:08.837313,
4,3,Organic,,98.0,1492675377,Dad Jokes: Over 600 of the Best (Worst) Jokes Around and Perfect Gift for All Ages!,N/A,$5.58,,4.7,9243.0,False,https://m.media-amazon.com/images/I/713toGwMnqL._AC_UL320_.jpg,https://m.media-amazon.com/images/I/713toGwMnqL._AC_SL1500_.jpg,,2026-04-23T11:02:08.843113,
5,3,Organic,,99.0,1728266181,How to Catch a Daddysaurus,N/A,$6.03,,4.8,1237.0,False,https://m.media-amazon.com/images/I/81ljCRq7UoL._AC_UL320_.jpg,https://m.media-amazon.com/images/I/81ljCRq7UoL._AC_SL1500_.jpg,,2026-04-23T11:02:08.849320,
6,3,Title,,,,"A special, fun gift for menSponsored|Shop Golden RainShop nowPrevious pageBirthday Gifts for Men, Da",,,,,,False,,,,2026-04-23T11:02:08.851923,
7,3,Title,,,,More results,,,,,,False,,,,2026-04-23T11:02:08.852228,
8,3,Organic,,100.0,B06XFY5NZW,"Carhartt Camping Cooler, Worksite Lunchbox, Soft Shell Lunch Bag for Construction Sites, Work and Everyday Use, Brown",N/A,$49.99,,4.8,47735.0,False,https://m.media-amazon.com/images/I/81QgQd4-9jL._AC_UL320_.jpg,https://m.media-amazon.com/images/I/81QgQd4-9jL._AC_SL1500_.jpg,,2026-04-23T11:02:08.859063,
9,3,Organic,,101.0,B0DBV415GJ,"BETHEGIFT Dad Gifts for Fathers Day from Daughter - Funny Hat for Fathers Day - Dad Birthday Gifts from Daughter - Adjustable Fit, Comfortable Cotton, Perfect Present for Awesome Father Trucker Hat",N/A,$15.95,,4.8,298.0,False,https://m.media-amazon.com/images/I/71qiB3q+0FL._AC_UL320_.jpg,https://m.media-amazon.com/images/I/71qiB3q+0FL._AC_SL1500_.jpg,,2026-04-23T11:02:08.863993,
10,3,Organic,,102.0,B0D3LMBJZP,"Gifts for Dad, Dad Birthday Gifts - Acrylic Heart Dad Plaque 3.9×3.7inch, Valentines Day Christmas Fathers Day Present for Dad from Daughter Son Wife, Memorial Gifts for Loss of Dad",N/A,$7.99,,4.7,511.0,False,https://m.media-amazon.com/images/I/71jG6WMZ52L._AC_UL320_.jpg,https://m.media-amazon.com/images/I/71jG6WMZ52L._AC_SL1500_.jpg,,2026-04-23T11:02:08.869079,
11,3,Organic,,103.0,B0D14CBGKT,"10"" Best Dad Ever Hands Down Sign DIY Dad Gifts from Kids Handprint Kit with Acrylic Paint, Toddler Craft Birthday Gift Father's Day for Daddy, Papa Family Plaque with Daughter, Son Names HF90-D",N/A,$16.99,,4.3,431.0,False,https://m.media-amazon.com/images/I/81PO4Mi7KQL._AC_UL320_.jpg,https://m.media-amazon.com/images/I/81PO4Mi7KQL._AC_SL1500_.jpg,,2026-04-23T11:02:08.878520,
12,3,Organic,,104.0,B07SCHPNSL,VNOX Masculine Watch Band Stainless Steel Link Bracelet Personalized Jewelry Gift for Men DAD Father Husband Boyfriend,N/A,$19.99,,4.6,8977.0,False,https://m.media-amazon.com/images/I/61xxu-UxETL._AC_UL320_.jpg,https://m.media-amazon.com/images/I/61xxu-UxETL._AC_SL1500_.jpg,,2026-04-23T11:02:08.882326,
13,3,Organic,,105.0,B0F43H3SKJ,"Funny Fathers Day Birthday Gifts for Him Men Boyfriend, Father's Day Father Gifts for Dad Grandpa Husband Anniversary, Cool Gag Gifts for Guys Valentines Leather Can Cooler Retirement Gifts 2026",N/A,$9.99,,4.8,232.0,False,https://m.media-amazon.com/images/I/81CoTAGDlOL._AC_UL320_.jpg,https://m.media-amazon.com/images/I/81CoTAGDlOL._AC_SL1500_.jpg,,2026-04-23T11:02:08.886026,
14,3,Title,,,,More results,,,,,,False,,,,2026-04-23T11:02:08.886517,
15,3,Organic,,106.0,B07GSVDSF5,"U2SKIIN Mens Hooded Robe, Plush Robes for Men Long Fleece Bathrobe",N/A,$24.99,,4.6,20299.0,False,https://m.media-amazon.com/images/I/61Q0syiJqZL._AC_UL320_.jpg,https://m.media-amazon.com/images/I/61Q0syiJqZL._AC_SL1500_.jpg,,2026-04-23T11:02:08.891937,
16,3,Organic,,107.0,B083C4TBT5,"Smokehouse by Thoughtfully Ultimate Grilling Spice Set, Grill Seasoning Gift Set Flavors Include Chili Garlic, Rosemary and Herb, Lime Chipotle, Cajun Seasoning and More, Pack of 20",N/A,$29.99,,4.7,9650.0,False,https://m.media-amazon.com/images/I/81uvSj8PkkL._AC_UL320_.jpg,https://m.media-amazon.com/images/I/81uvSj8PkkL._AC_SL1500_.jpg,,2026-04-23T11:02:08.896115,
17,3,Organic,,108.0,B0D2RH3NHK,"UUP Heavy Duty Tool Bag 15-Inch, 16-Pocket Portable Empty Tool Box Organizer, Big Storage Toolbox Organization, Soft Handle Large Zipper Carrying Toolbag, Father Day Gifts for Him Dad Men, Green",N/A,$36.99,,4.8,1352.0,False,https://m.media-amazon.com/images/I/81V3RIvLaHL._AC_UL320_.jpg,https://m.media-amazon.com/images/I/81V3RIvLaHL._AC_SL1500_.jpg,,2026-04-23T11:02:08.900263,
18,3,Organic,,109.0,B005M4D1KU,Fun Express Color Your Own World's Best Dad Mugs 12 Pack - DIY Mug Painting Kit for Kids with BPA-Free Plastic Mugs | Perfect Father's Day Craft Gift Set for Children to Make & Decorate,N/A,$19.68,,4.6,50.0,False,https://m.media-amazon.com/images/I/61VEJ5e1IlL._AC_UL320_.jpg,https://m.media-amazon.com/images/I/61VEJ5e1IlL._AC_SL1500_.jpg,,2026-04-23T11:02:08.903768,
19,3,Organic,,110.0,B0BFHXRG1F,"JoJowell Shower Steamers Aromatherapy - 18 Pack Birthday Gifts for Women Men, Mothers Day Gifts for Mom Wife Grandma from Daughter Son, Self Care with Natural Essential Oils Relaxation Home SPA",N/A,$18.98,,4.4,5099.0,False,https://m.media-amazon.com/images/I/71V0tlEYCNL._AC_UL320_.jpg,https://m.media-amazon.com/images/I/71V0tlEYCNL._AC_SL1500_.jpg,,2026-04-23T11:02:08.910820,
20,3,Organic,,111.0,B09SXKFNT3,"Spice Rack Co. BBQ Seasonings And Rubs - Smoking & Grilling Spices and Seasonings Sets, Grilling Accessories & Smoker Accessories, Unique Fathers Day Gift For Dad, Gifts For Father's Day (5 Pack)",N/A,$27.99,,4.7,2481.0,False,https://m.media-amazon.com/images/I/81pM2DzyYlL._AC_UL320_.jpg,https://m.media-amazon.com/images/I/81pM2DzyYlL._AC_SL1500_.jpg,,2026-04-23T11:02:08.914881,
21,3,Organic,,112.0,B0GQC36K75,"Funny Fathers Day Dad Gifts for Men - Humor Novelty Sloth Crew Sock, Birthday Present Christmas White Elephant Gift Exchange Stocking Stuffer for Grandpa Husband Brother Office Coworker",N/A,$2.99,,4.8,8.0,False,https://m.media-amazon.com/images/I/71PwmALt3XL._AC_UL320_.jpg,https://m.media-amazon.com/images/I/71PwmALt3XL._AC_SL1500_.jpg,,2026-04-23T11:02:08.918986,
22,3,Organic,,113.0,0307118398,Just Me and My Dad (Little Critter): An Inspirational Gift Book,N/A,$5.99,,4.8,14052.0,False,https://m.media-amazon.com/images/I/A1qjOPgWYXL._AC_UL320_.jpg,https://m.media-amazon.com/images/I/A1qjOPgWYXL._AC_SL1500_.jpg,,2026-04-23T11:02:08.923250,
23,3,Organic,,114.0,B0GDZKJ8DX,20 Set Man of God Christian Gifts Bulk Father Day Gifts Church Religious Bible Mini Screwdriver Keychain Gift Sets,N/A,$26.99,,3.0,1.0,False,https://m.media-amazon.com/images/I/81fmPx8EUxL._AC_UL320_.jpg,https://m.media-amazon.com/images/I/81fmPx8EUxL._AC_SL1500_.jpg,,2026-04-23T11:02:08.927377,
24,3,Organic,,115.0,B0CVWQT3ZN,"Fathers Day Dad Gifts from Daughter Son Wife, MAFEHAN 9-in-1 Multitool Pen with LED Light, Gifts for Husband Dad Grandpa, Cool Birthday Gadgets for Men",N/A,$8.99,,4.6,2130.0,False,https://m.media-amazon.com/images/I/71zOvmbbczL._AC_UL320_.jpg,https://m.media-amazon.com/images/I/71zOvmbbczL._AC_SL1500_.jpg,,2026-04-23T11:02:08.931495,
25,3,Organic,,116.0,B0DF1X5YSM,"Gifts for Dad Birthday Fathers Day Dad Gifts from Daughter Son, New Dad Daddy Father Presents Useful Stuff, Best Dad Ever Gift, Father in Law Gift, Genuine Leather Engraved 25 FT Tape Measure Tools",N/A,$16.98,,4.8,451.0,False,https://m.media-amazon.com/images/I/81AwmakfHbL._AC_UL320_.jpg,https://m.media-amazon.com/images/I/81AwmakfHbL._AC_SL1500_.jpg,,2026-04-23T11:02:08.936522,
26,3,Organic,,117.0,B0GKCYQ5B1,"18Pcs Happy Father's Day Can Cooler Sleeves, 12 oz Color Your Own Bottles Beverage Covers Blank Beer Soda Can Insulators DIY Craft Gifts for Dad from Son Daughter for Home Party Favors",N/A,$14.99,,4.7,208.0,False,https://m.media-amazon.com/images/I/81uDWFL5jeL._AC_UL320_.jpg,https://m.media-amazon.com/images/I/81uDWFL5jeL._AC_SL1500_.jpg,,2026-04-23T11:02:08.940141,
27,3,Organic,,118.0,B0F2HRCKBZ,SmoothNovelty Christian Men Handkerchief Bulk Bible Verse Gift Church Religious Inspirational Quote for Him Father Day Gift,N/A,$7.99,,4.6,147.0,False,https://m.media-amazon.com/images/I/814zYfh5IfL._AC_UL320_.jpg,https://m.media-amazon.com/images/I/814zYfh5IfL._AC_SL1500_.jpg,,2026-04-23T11:02:08.943896,
28,3,Organic,,119.0,0593709403,Grumpy Monkey Father's Day Fuss: Includes Fun Stickers!,N/A,$12.11,,4.8,8.0,False,https://m.media-amazon.com/images/I/81ci1Htv9WL._AC_UL320_.jpg,https://m.media-amazon.com/images/I/81ci1Htv9WL._AC_SL1500_.jpg,,2026-04-23T11:02:08.948184,
29,3,Organic,,120.0,B0F13SGSP2,24 Pcs Acrylic Father's Day Keychains Crafts Color Your Own Dad Keychains Bulk DIY Best Dad Ever Paper Crafts Gifts Kit for Happy Father's Day Party Gifts Activities,N/A,$25.99,,4.7,4.0,False,https://m.media-amazon.com/images/I/71LMRZCHNlL._AC_UL320_.jpg,https://m.media-amazon.com/images/I/71LMRZCHNlL._AC_SL1500_.jpg,,2026-04-23T11:02:08.954266,
30,3,Organic,,121.0,B0C1HKXK3D,"Tool Bag Roll Up, UUP Heavy Duty Portable Soft Tool Storage, Foldable Empty Rollup Organizer with Small Pockets, Official Rollable Toolbag, Father Day Gifts for Him Dad Men Mechanic Welding, Green",N/A,$26.99,,4.7,2060.0,False,https://m.media-amazon.com/images/I/81pmohPBjWL._AC_UL320_.jpg,https://m.media-amazon.com/images/I/81pmohPBjWL._AC_SL1500_.jpg,,2026-04-23T11:02:08.959340,
31,3,Organic,,122.0,B0B6BBB3V7,Amazon Physical Gift Card | Gift Box,N/A,$50.00,,4.9,127263.0,False,https://m.media-amazon.com/images/I/812j6a9SFfL._AC_UL320_.jpg,https://m.media-amazon.com/images/I/812j6a9SFfL._AC_SL1500_.jpg,,2026-04-23T11:02:08.962024,
32,3,Organic,,123.0,B07W8RXWMS,Dearfoams Men’s Brendan Indoor/Outdoor Breathable Memory Foam Clog House Shoe with Wide Widths Slipper,N/A,$24.99,,4.4,22914.0,False,https://m.media-amazon.com/images/I/81UaqcVtykL._AC_UL320_.jpg,https://m.media-amazon.com/images/I/81UaqcVtykL._AC_SL1500_.jpg,,2026-04-23T11:02:08.966980,
33,3,Organic,,124.0,B0CX1NDB2B,"Dad's Life Story Journal (Hardcover): A Meaningful Keepsake for Dad to Share His Journey and Memories, Book Includes 250+ Prompt Questions, Sentimental Gifts for Father's Day, Birthday & Christmas",N/A,$21.24,,4.8,1435.0,False,https://m.media-amazon.com/images/I/716PxIoqS3L._AC_UL320_.jpg,https://m.media-amazon.com/images/I/716PxIoqS3L._AC_SL1500_.jpg,,2026-04-23T11:02:08.971825,
34,3,Organic,,125.0,B0F66GL3Q1,"Dad Hats for Men, Vintage Two Tone Hat, New Dad Gifts for Husband, Fathers Day Birthday Gifts from Daughter Son Wife",N/A,$17.89,,4.6,100.0,False,https://m.media-amazon.com/images/I/61cnNX0IJUL._AC_UL320_.jpg,https://m.media-amazon.com/images/I/61cnNX0IJUL._AC_SL1500_.jpg,,2026-04-23T11:02:08.978828,
35,3,Organic,,126.0,B0F1CM95X2,"JWSCYSY 2PCS 12.6"" Happy Father's Day Gift Bag with Card and Tissue Paper（Black, Blue）",N/A,$6.99,,4.7,192.0,False,https://m.media-amazon.com/images/I/719fnOtsV-L._AC_UL320_.jpg,https://m.media-amazon.com/images/I/719fnOtsV-L._AC_SL1500_.jpg,,2026-04-23T11:02:08.982751,
36,3,Organic,,127.0,B0CMTCBBCX,Mothers Day Fathers Day For Mom Dad Birthday Gifts From Daughter Son Best Mom Dad Ever Valentines Gifts,N/A,$6.99,,4.7,138.0,False,https://m.media-amazon.com/images/I/71COdccNBbL._AC_UL320_.jpg,https://m.media-amazon.com/images/I/71COdccNBbL._AC_SL1500_.jpg,,2026-04-23T11:02:08.986148,
37,3,Organic,,128.0,B0D9Y5LTQH,"AMACOOL Portable Waist Fan Clip On, Father's Day Gifts for Dad Husband, 10000mAh Rechargeable Wearable Shirt Fan, Powerful Belt Fans, Birthday Gifts for Men Jobsite Travel Camping Essentials 2026",N/A,$32.39,,4.6,1329.0,False,https://m.media-amazon.com/images/I/71z8xUFnOEL._AC_UL320_.jpg,https://m.media-amazon.com/images/I/71z8xUFnOEL._AC_SL1500_.jpg,,2026-04-23T11:02:08.996631,
38,3,Organic,,129.0,B087G6TGJL,"Fathers Day Dad Gifts from Daughter Son Wife Super Universal Socket Tools Gifts for Men, Grip Set with Power Drill Adapter Cool Stuff Gadgets Present Ideas Gifts for Dad Husband Him Grandpa Step Dad",N/A,$9.49,,4.5,21702.0,False,https://m.media-amazon.com/images/I/61UaZeNXGeL._AC_UL320_.jpg,https://m.media-amazon.com/images/I/61UaZeNXGeL._AC_SL1500_.jpg,,2026-04-23T11:02:09.002208,
39,3,Organic,,130.0,B0GDXT49Y9,50 Pcs Father's Day Keychains Gift bulk Happy Father's Day Keychains Thank You the Best Dad Gifts for Man Dad Church Theme Party (Fresh),N/A,$16.99,,,,False,https://m.media-amazon.com/images/I/81ep-2W5d6L._AC_UL320_.jpg,https://m.media-amazon.com/images/I/81ep-2W5d6L._AC_SL1500_.jpg,,2026-04-23T11:02:09.007565,
40,3,Organic,,131.0,B0CXT7JC7N,"BeauGift Dad Gifts, Wooden Clock Gifts for Dad from Daughter Son Kids, Daddy Birthday Gift Idea for Papa Father Who Wants Nothing, Fathers Day Present from Child to My Dad",N/A,$19.99,,4.5,819.0,False,https://m.media-amazon.com/images/I/715me6vfzFL._AC_UL320_.jpg,https://m.media-amazon.com/images/I/715me6vfzFL._AC_SL1500_.jpg,,2026-04-23T11:02:09.014025,
41,3,Organic,,132.0,B0B82ND59N,"KEZKALS Father’s Day Gifts for Men Rechargeable Flashlight Gloves, Anniversary Birthday Easter Gifts for Men Dad Him, Gifts for Men Who Have Everything, LED Gloves for Hunting Fishing Repairing",N/A,$14.98,,4.5,1027.0,False,https://m.media-amazon.com/images/I/71SZkxOrmBL._AC_UL320_.jpg,https://m.media-amazon.com/images/I/71SZkxOrmBL._AC_SL1500_.jpg,,2026-04-23T11:02:09.018000,
42,3,Organic,,133.0,1939754682,We're Pregnant! The First Time Dad's Pregnancy Handbook,N/A,$8.04,,4.7,13651.0,False,https://m.media-amazon.com/images/I/71erNMM68rL._AC_UL320_.jpg,https://m.media-amazon.com/images/I/71erNMM68rL._AC_SL1500_.jpg,,2026-04-23T11:02:09.023021,
43,3,Organic,,134.0,B0FVKQH4KS,The Book For Men Who Have Everything: Unusual Knowledge and Boredom Busters for Intelligent Men,N/A,$13.79,,4.6,800.0,False,https://m.media-amazon.com/images/I/71IZyGPwrGL._AC_UL320_.jpg,https://m.media-amazon.com/images/I/71IZyGPwrGL._AC_SL1500_.jpg,,2026-04-23T11:02:09.030370,
44,3,Organic,,135.0,B0FTT5S17W,"Talking Donald Trump Pop Up Fathers Day Card with Light & Sound - Plays Trump's Real Voice, Funny 3D Pop Up Greeting Card, Presidential Podium Scene, Funny Trump Fathers Day Surprise for Dad",N/A,$13.95,,4.8,31.0,False,https://m.media-amazon.com/images/I/81TFI8CalaL._AC_UL320_.jpg,https://m.media-amazon.com/images/I/81TFI8CalaL._AC_SL1500_.jpg,,2026-04-23T11:02:09.037378,
45,3,Organic,,136.0,B0DF7VD7GX,"Dad Fathers Day Birthday Gift, from Daughter/Son, Fathers Day for Dad Daddy Grandpa Husband, Funny Dad's Ice Cream Shovel Daddy Father-in-Law Grandfather Valentines Stuffers Easter Basket Essentials",N/A,$8.79,,4.6,1614.0,False,https://m.media-amazon.com/images/I/61OcM2rp4hL._AC_UL320_.jpg,https://m.media-amazon.com/images/I/61OcM2rp4hL._AC_SL1500_.jpg,,2026-04-23T11:02:09.044139,
46,3,Organic,,137.0,B0C61K2QY5,"Gifts for Men Him, Cell Phone Stand with Bluetooth Speaker&Led Color Changing Light, Unique Gifts for Women Dad Her Husband, Cool Tech Gadget Wireless Speaker, Birthday Gifts for Men, Ideal Gifts",N/A,$23.79,,4.6,1709.0,False,https://m.media-amazon.com/images/I/71Y4by5cDbL._AC_UL320_.jpg,https://m.media-amazon.com/images/I/71Y4by5cDbL._AC_SL1500_.jpg,,2026-04-23T11:02:09.052944,
47,3,Organic,,138.0,B0D6XPZDRJ,Fathers Day Dad Gifts from Daughter Son Wife Dad Birthday Gifts for Him Her Women Men Girlfriend Boyfriend Couple Anniversary Steel Food Decision Dice Funny Present for Christmas Stocking Stuffers,N/A,$6.99,,4.7,1457.0,False,https://m.media-amazon.com/images/I/61lovZriBxL._AC_UL320_.jpg,https://m.media-amazon.com/images/I/61lovZriBxL._AC_SL1500_.jpg,,2026-04-23T11:02:09.058441,
48,3,Organic,,139.0,B00J9KOPK8,Mens Best Dad Ever T Shirt Funny Tee for Fathers Day Idea for Husband Novelty,N/A,$14.99,,4.6,1104.0,False,https://m.media-amazon.com/images/I/61eyyzrQZKL._AC_UL320_.jpg,https://m.media-amazon.com/images/I/61eyyzrQZKL._AC_SL1500_.jpg,,2026-04-23T11:02:09.066264,
49,3,Organic,,140.0,B0DYJTX9FC,Wavwavw Christian Gifts for Fathers Day Religious Members Keychain Bulk Bible Verse Tree Keychain Gift for Men Church,N/A,$15.99,,4.7,34.0,False,https://m.media-amazon.com/images/I/81zPnStWghL._AC_UL320_.jpg,https://m.media-amazon.com/images/I/81zPnStWghL._AC_SL1500_.jpg,,2026-04-23T11:02:09.072945,
50,3,Organic,,141.0,B0GD15XR42,Kigeli 24 Pcs Father's Day Bracelets Gifts Bulk Letter Initial Dad Bracelet Adjustable Handmade Rope Braided Bracelets for Men Father's Day Church Gifts,N/A,$14.99,,,,False,https://m.media-amazon.com/images/I/81DXbyEJ+GL._AC_UL320_.jpg,https://m.media-amazon.com/images/I/81DXbyEJ+GL._AC_SL1500_.jpg,,2026-04-23T11:02:09.076414,
51,3,Organic,,142.0,B0GHVFKKV1,"Rolling Grill Basket, Removable Wooden Handle, 304 Stainless Steel, Nesting BBQ Tools for Vegetable, Outdoor Smoker Camping Accessories, Father's Day Gifts Birthday Gift for Men Dad Husband",N/A,$21.99,,5.0,17.0,False,https://m.media-amazon.com/images/I/81d1zWJj-sL._AC_UL320_.jpg,https://m.media-amazon.com/images/I/81d1zWJj-sL._AC_SL1500_.jpg,,2026-04-23T11:02:09.080648,
52,3,Organic,,143.0,B0F8B9534K,"Gnamy Gifts for Dad New Dad Stepdad Men Husband, American Flag Cross Beads Bracelet Easter Birthday Jewelry Gifts for Him",N/A,$14.99,,4.5,163.0,False,https://m.media-amazon.com/images/I/819YYfZkPVL._AC_UL320_.jpg,https://m.media-amazon.com/images/I/819YYfZkPVL._AC_SL1500_.jpg,,2026-04-23T11:02:09.085282,
53,3,Organic,,144.0,1419729616,My Dad Is Amazing! (A Hello!Lucky Book),N/A,$4.92,,4.8,5645.0,False,https://m.media-amazon.com/images/I/718X0ehB7dL._AC_UL320_.jpg,https://m.media-amazon.com/images/I/718X0ehB7dL._AC_SL1500_.jpg,,2026-04-23T11:02:09.090378,
54,3,Title,,,,Related searchesfathers day gifts from daughterfathers dayfathers birthday giftsfathers day gifts fr,,,,,,False,,,,2026-04-23T11:02:09.091577,
55,3,Title,,,,Previous1234...7Next,,,,,,False,,,,2026-04-23T11:02:09.091935,
56,3,SB,4.0,,,N/A,https://aax-us-east-retail-direct.amazon.com/x/c/JNUS_hRew-34iusW-KIdVcIAAAGduEmZwgEAAAH2AQBvbm9fdHhuX2JpZDcgICBvbm9fdHhuX2ltcDEgICBDw22H/clv1c_ek-IxHfWVcbaTPWXb9oQpRu3EbyEEIfSAhoKRAm1NaEGuHCVTzEBpQ1B0VHcxmm8i3AqjQump32v5q0TUtJQYNkdYh6B45bWdGHtd7dgvcw2jSPkMFINtQq6Y_h8PqKRZGEkGOsC0Vs56594MeB__trnaF3flFfa0u-0R4cqjoENfwPNhVhrMNUB4Spzxqr7g2Hj08pPEATq-YxNLhhBdANSr_W_hMQchgZIMtstd9faNaQdmCH1p9o-fR1t2Bczpmv_lFdeJmWQmvkX_6CIayuAe4tqsiH2hzrKTph5RvS3NT8Kne_RTU_-0sgJN8lgwTZiXIjuD-O4PkvEBSqQJPTBZArDFey_xhD_45Wb6Ka2GiWn1Dx7-wT3qEEsx3Nxoi2m1suDxNW98gj1Dw60M_0-bA3FmAq4Pe4dMgKlFvejczsOuxS2NxYoNTsDSSZpcHRHfNzmi09Bxl_lYUKanDjSnTG0GO6EDhkXQ1F8XI6UOPGjM8MAJiPVH6jNuAvYsodW6K55bwV16yKmljijuTPSal3MdJn2zQIKjHMXcJni1hxttvHLWzdtVASyOGaJ0mTmGRAOfjpCK-m9gLKn_wpeTKIIPXGzvnX3MJxKOF-HTrQode8nVoI5Blsjl3bHpeWUsjiagBvAj1RtYDA9h-dAQ1j3_1bUUJsHBceS-UXmBD3m4d5vnpi9Ar161u6s6V6qM815ri5NRI5i-FqGaTMqrFaW7kLZg9-dIwotREeGD9n4Y95e1XUugAOR1r-u-8x-p5A0rupfPJeDWh_dGgDDilqHX7H-Nrs4BdfVZsT0kAbAsAWr5lhhHv-Icdt5hE9NTUhlfRlc7Y31SCmJ75ZCWh9DndiSqMtKiQ6JL31BzlW7drFBCZP2VeVRS7Jlb82jUduNLpkYmP_mMxKSo_bz_O8rQLPnPin-BdSv6ln4ifxrqS-zVCQZ1CYpC0aKQB2dPzPoLarQ0kNxmn8yptwpCSpdBF0-CQzVMPYxC69TKpBHYnLx5qeyge-3QQPXTdcplgV_izWMhMQpc-k7fyKkpsk6jQTn9P5vYJyUD8D-7ToRuF3yQD1saQS19pVmJkz0jR53gx8BB2FIU_QGKUvMdyld1op89GI0L3Kp2cFJcOABpPPBWtP-qGNFphzZaFb3O-xqGuSI15Ohvj3hXLzPnQsmZc24Lpnrz3jeTnd5_LE-7iADHby5DNYClsDoCTiMgoEvxJb5Bg4sRwY5iUMxz-bxIOKNWJbTTm2BX1FH3CohBgAUelXLdqu9pqn0MPYNvoooTCBGJi-qP7nYuc4S5KKOzoIkhxX-QxCSDUs9woWfD1wjZebG0BBOz0Q8z5UTqDJcUBstU7edNjbai5R49Arb7H03vxdL8yX_i9eDgLf4ZRrsCQRuFVKlbXd8icv5L4FsWZ2nQAi-CzKmCbxrwVO7sofkCg5WKHGRTcAcg5Ti4f2mdzSagpjc3MjbR3vGtyz2X1Zg1vxlg7opG_4b63zeg-6RzRixgSjI6CqwlWZUGAqCS9dghgRBRMx970W2V5gF4JkUcUa53xgam5nqxHw7_yOi15R-jDRfQLMW1LcvRIiZ_jdlJ4vNeLYz1jS8MHkC345wA9FPj0CgkhjeOVN-1MZ-yYZWbrGIWLQUfG5VQLR0yHgGutJYWZdRtRdEZQ/https://www.amazon.com/stores/page/BB355440-B1CF-41B6-898D-3942C9FBC282/?_encoding=UTF8&store_ref=SB_A0510571A8U2YFZBICZ7-A06836603VCAOOO4VNXUH&pd_rd_plhdr=t&aaxitk=17b4acd4b68956b7dca8839fff8dfa7a&hsa_cr_id=0&lp_asins=B016ZH8I28%2CB0BXZ2LLL3%2CB0CQN41QYT&lp_query=fathers%20day%20gifts&lp_slot=desktop-hsa-3psl&ref_=sbx_be_s_3psl_mbd_mb0_bkgd&pd_rd_w=uveK6&content-id=amzn1.sym.cd7c548b-a599-426f-9ffe-daa1aa803c87%3Aamzn1.sym.cd7c548b-a599-426f-9ffe-daa1aa803c87&pf_rd_p=cd7c548b-a599-426f-9ffe-daa1aa803c87&pf_rd_r=JE1DKZPYZC5JSSH282NK&pd_rd_wg=iPeRz&pd_rd_r=32a7757e-125a-464b-a887-8a68b2884c40,,,,,False,,,N/A,2026-04-23T11:02:09.097325,
57,3,Title,,,,Need help?Visit the help sectionorcontact us,,,,,,False,,,,2026-04-23T11:02:09.097815,
0,4,SB_Video,3.0,,,N/A,N/A,,,,,False,,,,2026-04-23T11:02:25.716611,6.0
1,4,Title,,,,ResultsCheck each product page for other buying options. Price and other details may vary based on p,,,,,,False,,,,2026-04-23T11:02:25.717611,
3,4,Organic,,145.0,B0GKFP5LHW,Junkin 24 Pcs Father's Day Dad Gift Bulk Retro PU Leather Keychains Best Dad Ever Gift for Men's Party Favors Husband,N/A,$22.99,,,,False,https://m.media-amazon.com/images/I/81TaoNONmQL._AC_UL320_.jpg,https://m.media-amazon.com/images/I/81TaoNONmQL._AC_SL1500_.jpg,,2026-04-23T11:02:25.721022,
4,4,Organic,,146.0,B09C8JJFL2,Fathers Day Dad Gifts from Daughter Son Wife: 11oz Funny Coffee Mug for Dad Unique Birthday Gifts for Father Husband Men Him Personalized Christmas Anniversary Retirement Presents for Daddy Stepfather,N/A,$11.99,,4.8,1015.0,False,https://m.media-amazon.com/images/I/61xYQ8M7l9L._AC_UL320_.jpg,https://m.media-amazon.com/images/I/61xYQ8M7l9L._AC_SL1500_.jpg,,2026-04-23T11:02:25.726626,
5,4,Organic,,147.0,B0DJZZC8Z4,"WORKPRO Father’s Day Gifts for Men, 9 Functions Multi-tool Pen Set, Birthday Gifts for Who Have Everything, Cool EDC Gadgets for Men, Stocking Stuffers, for Dad Grandpa Husband Him Adults Boyfriend",N/A,$9.49,,4.5,114.0,False,https://m.media-amazon.com/images/I/71eEm6Em+8L._AC_UL320_.jpg,https://m.media-amazon.com/images/I/71eEm6Em+8L._AC_SL1500_.jpg,,2026-04-23T11:02:25.729506,
6,4,Title,,,,"DADDY FACTORY Personalized Whiskey Glass, Engraved Monogram Rocks Cocktail Glass, 10.25 oz Custom Bo",,,,,,False,,,,2026-04-23T11:02:25.730402,
7,4,Title,,,,More results,,,,,,False,,,,2026-04-23T11:02:25.730545,
8,4,Organic,,148.0,B08XYPVTJF,"Massage Oil for Massage Therapy,Lymphatic Drainage-Ginger Oil Sore Muscle Arnica Oil &Lavender Oil Relaxing Massage Oils for Date Night,Massage Ball,Mothers Day Gifts for Wife,Women, Gifts for Him Her",N/A,$15.99,,4.5,4109.0,False,https://m.media-amazon.com/images/I/716TSzopc+L._AC_UL320_.jpg,https://m.media-amazon.com/images/I/716TSzopc+L._AC_SL1500_.jpg,,2026-04-23T11:02:25.733986,
9,4,Organic,,149.0,B0DMT2VPTJ,30 Sets Father's Day Church Keychains Gift Bulk Happy Father's Day Gift Thank You Keychain Inspiration Gifts with Man Scripture Keychain Tag White Organza Bag for Church Theme Party (Fresh),N/A,$16.99,,4.8,14.0,False,https://m.media-amazon.com/images/I/81-vzM+NLBL._AC_UL320_.jpg,https://m.media-amazon.com/images/I/81-vzM+NLBL._AC_SL1500_.jpg,,2026-04-23T11:02:25.738619,
