data_index,page,ad_type,ad_rank,organic_rank,asin,title,url,price_current,price_list,rating_stars,rating_count,is_prime,image_small,image_large,brand_name,scraped_at,inner_products_count
5,3,Organic,,99.0,B0F1F753B6,"Inflatable Pool Float Chair - 2 Pack Pool Floats Adult Heavy Duty, Water Floating Lounge Chairs, Blow up Floaties Adults for Summer Fun Party Lake Beach",N/A,$29.98,,4.4,213.0,False,https://m.media-amazon.com/images/I/81qpX4ejJrL._AC_UL320_.jpg,https://m.media-amazon.com/images/I/81qpX4ejJrL._AC_SL1500_.jpg,,2026-04-23T12:04:44.053984,
6,3,Title,,,,"Floating Pool LightsShopGodferyxinPrevious pageGodferyxin Floating Pool Lights for Night Party, 1 Pa",,,,,,False,,,,2026-04-23T12:04:44.055528,
7,3,Title,,,,VercanMonth 2 Pack American Inflatable Pool FloatSponsored|Shop VercanMonthShop nowPrevious pageVerc,,,,,,False,,,,2026-04-23T12:04:44.056608,
8,3,Title,,,,More results,,,,,,False,,,,2026-04-23T12:04:44.056745,
9,3,Organic,,100.0,B08R5GTZL5,FUNBOY & Malibu Barbie Luxury Inflatable Golf Cart Summer Pool Float - Land or Water Inflatable with Cup Holder,N/A,$118.15,,4.1,315.0,False,https://m.media-amazon.com/images/I/61C+32mwU3L._AC_UL320_.jpg,https://m.media-amazon.com/images/I/61C+32mwU3L._AC_SL1500_.jpg,,2026-04-23T12:04:44.060061,
10,3,Organic,,101.0,B0CQY8WY2G,"6 Pack Pool Floats Kids, 3 Pcs Inflatable Fruits Swim Tubes Rings & 3 Pcs Rainbow Beach Ball Bulk, Summer Pool Floaties for Kids Adults Swimming Float Toy Hawaiian Party Beach Water Fun Game",N/A,$13.49,,4.2,132.0,False,https://m.media-amazon.com/images/I/71SCUuCJ+FL._AC_UL320_.jpg,https://m.media-amazon.com/images/I/71SCUuCJ+FL._AC_SL1500_.jpg,,2026-04-23T12:04:44.064300,
11,3,Organic,,102.0,B07HKRMZ6P,Intex 56283EU Inflatable Mat 183 x 23 cm T.Única multicoloured,N/A,$17.32,,4.2,399.0,False,https://m.media-amazon.com/images/I/61cAAT1QLVL._AC_UL320_.jpg,https://m.media-amazon.com/images/I/61cAAT1QLVL._AC_SL1500_.jpg,,2026-04-23T12:04:44.068327,
12,3,Organic,,103.0,B0CYGYSV5N,"Thickened Inflatable Seashell Pool Float, Giant Pool Floating Raft Chair with Pearl Balls, for Birthday Party, Ocean Theme Decorations, Beach & Pool Party Decorations",N/A,$35.99,,4.5,180.0,False,https://m.media-amazon.com/images/I/71yGXKj73tL._AC_UL320_.jpg,https://m.media-amazon.com/images/I/71yGXKj73tL._AC_SL1500_.jpg,,2026-04-23T12:04:44.071632,
13,3,Organic,,104.0,B0GJ3WT1XD,"Pool Floats Adult Inflatable Hammock with Cooling Mesh, Portable Foldable Water Chair for Beach Vacation Essentials, Striped Floaties for Adults, Lightweight for Travel & Summer Relaxing",N/A,$19.99,,4.3,11.0,False,https://m.media-amazon.com/images/I/815Nj6vjkPL._AC_UL320_.jpg,https://m.media-amazon.com/images/I/815Nj6vjkPL._AC_SL1500_.jpg,,2026-04-23T12:04:44.075117,
14,3,Organic,,105.0,B0CR37P4NH,"Inflatable Pool Floats Adult, 4-in-1 Multi-Purpose Pool Float Rafts Water Hammock, Pool Floaties for Adults Swimming Pool Lake Beach",N/A,$23.99,,4.0,263.0,False,https://m.media-amazon.com/images/I/81KuI5zPDzL._AC_UL320_.jpg,https://m.media-amazon.com/images/I/81KuI5zPDzL._AC_SL1500_.jpg,,2026-04-23T12:04:44.078889,
15,3,Organic,,106.0,B0DLB488FD,"SLOOSH 2-Pack Unicorn Flamingo Pool Floats - Inflatable Pool Floaties Swimming Party Decorations, Fun Float Swim Rings Floating Tubes Beach Lake Summer Vacation Floaty with Headrest for Adults Kids",N/A,$22.99,,4.6,192.0,False,https://m.media-amazon.com/images/I/71q54IL6-5L._AC_UL320_.jpg,https://m.media-amazon.com/images/I/71q54IL6-5L._AC_SL1500_.jpg,,2026-04-23T12:04:44.081994,
16,3,Organic,,107.0,B0CRYWTNL5,"ZHUYNXIR Pool Float for Adult,Pool Floats,Pool Floating Chair for Adult, Great for Chilling in The Pool and Have held up with Kids Crawling on Them.",N/A,$49.99,,3.9,82.0,False,https://m.media-amazon.com/images/I/71+A0EyiPfL._AC_UL320_.jpg,https://m.media-amazon.com/images/I/71+A0EyiPfL._AC_SL1500_.jpg,,2026-04-23T12:04:44.085422,
17,3,Organic,,108.0,B0F47CBWCC,"FUNBOY Tanning Pool Lounger Float, XL 72'' x 48'' Pool Float with Custom Pillow and Large Cup Holder, Perfect for Pool or Backyard.",N/A,$41.65,,4.3,172.0,False,https://m.media-amazon.com/images/I/61tQsHtJLDL._AC_UL320_.jpg,https://m.media-amazon.com/images/I/61tQsHtJLDL._AC_SL1500_.jpg,,2026-04-23T12:04:44.089373,
18,3,Organic,,109.0,B09JWV79VT,"Triumpeek Inflatable Seashell Pool Float, Blow Up Giant Clam Floatie with 8"" Pearl Ball, Shell Pool Floating Ride On Raft Chair for Swimming Pool Summer Beach Party",N/A,$39.99,,3.9,432.0,False,https://m.media-amazon.com/images/I/71VMc76dCUL._AC_UL320_.jpg,https://m.media-amazon.com/images/I/71VMc76dCUL._AC_SL1500_.jpg,,2026-04-23T12:04:44.093174,
19,3,Organic,,110.0,B0FLPRKBVD,"Funscape Kids Fun Pool Floating Water Toys, Inflatable Tic-Tac-Toe Dart Board Game, Swimming Pool Floats Beach Outdoor Play, Summer Birthday Gift 3 4 5 6 7 8 9 10 12 Yrs Boy Girl Teen Adult Family-Red",N/A,$31.99,,3.2,10.0,False,https://m.media-amazon.com/images/I/81ssMtV-ACL._AC_UL320_.jpg,https://m.media-amazon.com/images/I/81ssMtV-ACL._AC_SL1500_.jpg,,2026-04-23T12:04:44.096018,
20,3,Organic,,111.0,B0C2HRKML4,"Zcaukya Inflatable Seashell Pool Float, Giant Clam Air-Filled Toys with Pearl Ball for Kids Birthday Party Swimming Pool Summer Beach Party Mermaid Ocean Theme Party Decor",N/A,$39.99,,4.6,317.0,False,https://m.media-amazon.com/images/I/71RMEUGyOSL._AC_UL320_.jpg,https://m.media-amazon.com/images/I/71RMEUGyOSL._AC_SL1500_.jpg,,2026-04-23T12:04:44.104265,
21,3,Organic,,112.0,B088T2WHGH,"FUNBOY Clear Inflatable Mesh Pool Lounger Mesh Water Hammock with Built-in Pillow 70"" Pool Hammock Float for Adults Swimming Pool Accessories & Tanning Pool Lounger Float for Pool Party & Summer",N/A,$35.00,,3.6,457.0,False,https://m.media-amazon.com/images/I/61w345D-nFL._AC_UL320_.jpg,https://m.media-amazon.com/images/I/61w345D-nFL._AC_SL1500_.jpg,,2026-04-23T12:04:44.107565,
22,3,Organic,,113.0,B0DZP1CXKD,"QPAU Inflatable Tank Pool Float for Adults & Kids – Ride-On Camouflage Floaty with Water Cannon, Swim Raft Toy for Boys Girls, Lake Beach Backyard Party Floaties",N/A,$33.99,,4.5,434.0,False,https://m.media-amazon.com/images/I/71fcZTS-+SL._AC_UL320_.jpg,https://m.media-amazon.com/images/I/71fcZTS-+SL._AC_SL1500_.jpg,,2026-04-23T12:04:44.112838,
23,3,Organic,,114.0,B073WMYP6M,"Aqua Original 4-in-1 Monterey Hammock Pool Float & Water Hammock – Multi-Purpose, Inflatable Pool Floats for Adults – Patented Thick, Non-Stick PVC Material – Navy",N/A,$14.99,,4.5,69349.0,False,https://m.media-amazon.com/images/I/81o1FlIFlPL._AC_UL320_.jpg,https://m.media-amazon.com/images/I/81o1FlIFlPL._AC_SL1500_.jpg,,2026-04-23T12:04:44.119549,
24,3,Organic,,115.0,B00166ES9G,SWIMLINE ORIGINAL 90621 Giant Inflatable Swan Pool Float Floatie Ride-On Lounge W/ Stable Legs Wings Large Rideable Blow Up Summer Beach Swimming Party Lounge Big Raft Tube Decoration Toys Kids Adults,N/A,$36.31,,4.1,7374.0,False,https://m.media-amazon.com/images/I/61481op9qSL._AC_UL320_.jpg,https://m.media-amazon.com/images/I/61481op9qSL._AC_SL1500_.jpg,,2026-04-23T12:04:44.124348,
25,3,Organic,,116.0,B0GGRNPK71,"Tic-Tac-Toe Pool Toys Game Set, Giant Inflatable Floating Board Set with 10 Balls, Pool Toys Party Game for Kids Adults Teens, Summer Water Party Backyard Beach Yard Field Day Outdoor Activities",N/A,$19.99,,4.2,4.0,False,https://m.media-amazon.com/images/I/81Ej6B9yf6L._AC_UL320_.jpg,https://m.media-amazon.com/images/I/81Ej6B9yf6L._AC_SL1500_.jpg,,2026-04-23T12:04:44.128010,
26,3,Organic,,117.0,B01N7KS80U,"Jasonwell Pineapple Pool Float Raft Summer Beach Swimming Large Pool Floatie Inflatable Lounge Lounger Party Water Toys Raft for Adults 76""",N/A,$23.99,,4.3,2036.0,False,https://m.media-amazon.com/images/I/713oQhc14+L._AC_UL320_.jpg,https://m.media-amazon.com/images/I/713oQhc14+L._AC_SL1500_.jpg,,2026-04-23T12:04:44.136125,
27,3,Organic,,118.0,B0CXBHQ8RW,"4E's Novelty 4 Pack Donut Pool Floats for Kids & Adults 30"" Swim Rings Tubes Floaties for Swimming Pool, Donut Inflatable for Party Decorations Beach Toy, Floating Blow Up Floaties Water Floaty Lake",N/A,$23.99,,4.6,263.0,False,https://m.media-amazon.com/images/I/71dmwLmPzPL._AC_UL320_.jpg,https://m.media-amazon.com/images/I/71dmwLmPzPL._AC_SL1500_.jpg,,2026-04-23T12:04:44.141469,
28,3,Organic,,119.0,B0FS1CGN38,"[Upgraded Log Rafts] 4 Pcs Jumbo Inflatable Battle Log Pool Game - 2 Players Inflatable Floating Toy for Kids Adults, Family Pool Fighting Float Row Toys for Pool Parties, Beach, Summer Outdoor Sports",N/A,$26.59,,3.5,13.0,False,https://m.media-amazon.com/images/I/81sTA58YwiL._AC_UL320_.jpg,https://m.media-amazon.com/images/I/81sTA58YwiL._AC_SL1500_.jpg,,2026-04-23T12:04:44.146662,
29,3,Organic,,120.0,B0FL7VLGB7,"Funscape Kids Hockey Pool Game Toys, Big Inflatable Water Play Floating Toy, Fun Swimming Pool Float, Outdoor Activities Yard Beach Sports, Cool Summer Family Party Gift 5 6 8 10 12 Yr Boys Teen Adult",N/A,$23.78,,4.0,19.0,False,https://m.media-amazon.com/images/I/81XrTTcFPpL._AC_UL320_.jpg,https://m.media-amazon.com/images/I/81XrTTcFPpL._AC_SL1500_.jpg,,2026-04-23T12:04:44.152093,
30,3,Organic,,121.0,B0CLMHMG1B,"SLOOSH 2 Packs Hammock Pool Floats Adults, 4-in-1 Multi-Purpose Inflatable Pool Floats PVC Water Hammock Lounge Floaties",N/A,$15.99,,4.5,2581.0,False,https://m.media-amazon.com/images/I/81IFXvRZtvL._AC_UL320_.jpg,https://m.media-amazon.com/images/I/81IFXvRZtvL._AC_SL1500_.jpg,,2026-04-23T12:04:44.155554,
31,3,Organic,,122.0,B0DLKQJFKW,"SLOOSH Pool Toys Games Set - Pong Toss Game Water Toys for Adults Kids Family Games, Inflatable Floats Lounge Raft Floating Swimming Pool Accessories 6x3 FT Table with 10 Pong Balls for Parties",N/A,$29.99,,4.5,148.0,False,https://m.media-amazon.com/images/I/71mgGTenznL._AC_UL320_.jpg,https://m.media-amazon.com/images/I/71mgGTenznL._AC_SL1500_.jpg,,2026-04-23T12:04:44.160835,
32,3,Organic,,123.0,B07ZL4JDKQ,"DIVEBLAST: Premium Floating Drink Holder for Pool, Hot Tub Accessories for Adults - Holds Up to 50 LBS - Fun Swimming Pool Accessories for Adults, Cool and Unique Drink Floaties",N/A,$22.97,,4.4,2702.0,False,https://m.media-amazon.com/images/I/61w2qxK2SaL._AC_UL320_.jpg,https://m.media-amazon.com/images/I/61w2qxK2SaL._AC_SL1500_.jpg,,2026-04-23T12:04:44.167321,
33,3,Organic,,124.0,B0BXKR76KK,"Inflatable Pool Floats Adult Size Water Hammock,Pool Rafts Lounge Chairs Floating,4-in-1 Multi-Purpose Pool Floaties Toys,Floats for Swimming Pool,for Adults Vacation Fun and Rest",N/A,$15.29,,4.2,2415.0,False,https://m.media-amazon.com/images/I/81T-Df9zkEL._AC_UL320_.jpg,https://m.media-amazon.com/images/I/81T-Df9zkEL._AC_SL1500_.jpg,,2026-04-23T12:04:44.172732,
34,3,Organic,,125.0,B0DSPV1H69,"3 Pack Pool Floats Adult, OKSUWATER Pool Floaties with Two Cup Holders & Handles, Inflatable Pool Floats Chairs, Lake Floats Applies to Swimming Pool Party Summer Lake Water Fun",N/A,$27.99,,4.5,473.0,False,https://m.media-amazon.com/images/I/91SE+vcyi3L._AC_UL320_.jpg,https://m.media-amazon.com/images/I/91SE+vcyi3L._AC_SL1500_.jpg,,2026-04-23T12:04:44.176018,
35,3,Organic,,126.0,B0CV73D1XF,"Giant Floating Yellow Cabana Stripe Drink Station, Removable Fabric Shade with Fringe, Perfect for Parties, Table-Top Decorations and in-Pool Refreshments.",N/A,$58.65,,4.4,297.0,False,https://m.media-amazon.com/images/I/61-n5hhQ-PL._AC_UL320_.jpg,https://m.media-amazon.com/images/I/61-n5hhQ-PL._AC_SL1500_.jpg,,2026-04-23T12:04:44.180134,
36,3,Organic,,127.0,B0D6SL27G6,"FUNBOY Country Club Golf Cart Pool Float, Two Cup Holders, Removable Fringe Shade, Float for Summer Pool Party and Entertainment",N/A,$118.15,,4.2,286.0,False,https://m.media-amazon.com/images/I/61mc33AE33L._AC_UL320_.jpg,https://m.media-amazon.com/images/I/61mc33AE33L._AC_SL1500_.jpg,,2026-04-23T12:04:44.183798,
37,3,Organic,,128.0,B0DSZRYXSZ,Jasonwell Pool Toys Diving Rings - 28PCS Swim Thru Rings Pool Game Diving Toys with Dive Ring Underwater Treasures Torpedo Bandits Fish Toy Fun Water Swimming Toy for Boys Girls Kids Teens Adults,N/A,$21.99,,4.5,535.0,False,https://m.media-amazon.com/images/I/81vuqb+LnGL._AC_UL320_.jpg,https://m.media-amazon.com/images/I/81vuqb+LnGL._AC_SL1500_.jpg,,2026-04-23T12:04:44.192058,
38,3,Organic,,129.0,B0GCHKXD7W,"Pool Floats Adult, 3Pack/4Pack Inflatable Pool Floats Chair, U-Shaped Floating Lounger with Comfortable Headrest, Cup Holders and Handles,Portable Pool Floaties for Adults Kids Beach Pool Lake",N/A,$29.99,,5.0,49.0,False,https://m.media-amazon.com/images/I/81hF0uNfn1L._AC_UL320_.jpg,https://m.media-amazon.com/images/I/81hF0uNfn1L._AC_SL1500_.jpg,,2026-04-23T12:04:44.196371,
39,3,Organic,,130.0,B0DSPVXCWL,"2 Pack Pool Floats Adult, OKSUWATER Pool Floaties with Two Cup Holders & Handles, Inflatable Pool Floats Chairs, Lake Floats Applies to Swimming Pool Party Summer Lake Water Fun-Multicolor",N/A,$21.99,,4.4,506.0,False,https://m.media-amazon.com/images/I/81Bz5Y4w18L._AC_UL320_.jpg,https://m.media-amazon.com/images/I/81Bz5Y4w18L._AC_SL1500_.jpg,,2026-04-23T12:04:44.200341,
40,3,Organic,,131.0,B07LG8NRQP,Jasonwell Inflatable Diamond Ring Pool Float - Engagement Ring Bachelorette Party Float Stagette Decorations Swimming Tube Floaty Outdoor Water Lounge Floats for Adults,N/A,$17.98,,4.8,5185.0,False,https://m.media-amazon.com/images/I/71vjKRzAOoL._AC_UL320_.jpg,https://m.media-amazon.com/images/I/71vjKRzAOoL._AC_SL1500_.jpg,,2026-04-23T12:04:44.209288,
41,3,Organic,,132.0,B0DRFTQYH8,"NIPLOOOW Pool Basketball Hoop, 2-in-1 Floating Pool Toys Ring Game with 4 Balls and Pump, Outdoor Swimming Pool Basketball Games Water Play Toy Family Party for Kids Adults Age 3-12 (Blue)",N/A,$34.19,,4.3,292.0,False,https://m.media-amazon.com/images/I/813DQJ3izZL._AC_UL320_.jpg,https://m.media-amazon.com/images/I/813DQJ3izZL._AC_SL1500_.jpg,,2026-04-23T12:04:44.214451,
42,3,Organic,,133.0,B09NLZ8V9L,"Pool Toys Games Set,Pool Basketball Hoop Inflatable Cross Ring Toss Game and Inflatable Cactus Kids for Teens Adults and Family (3 Set Water Toys)",N/A,$21.99,,4.0,1122.0,False,https://m.media-amazon.com/images/I/71StUBcpfXL._AC_UL320_.jpg,https://m.media-amazon.com/images/I/71StUBcpfXL._AC_SL1500_.jpg,,2026-04-23T12:04:44.217817,
43,3,Organic,,134.0,B0CTQL4WBT,JellyArch 4 Pcs Inflatable Surf Board 36 Inch Inflatable Pool Floats Luau Hawaiian Party Decorations Tropical Flower Blow up Surfboard for Wall Beach Party Decorations,N/A,$28.99,,4.2,115.0,False,https://m.media-amazon.com/images/I/71XtcaMqViL._AC_UL320_.jpg,https://m.media-amazon.com/images/I/71XtcaMqViL._AC_SL1500_.jpg,,2026-04-23T12:04:44.222706,
44,3,Organic,,135.0,B0G91731R9,"Inflatable Pool Floats for Adults, Heart Shape Pool Lounge Float Chair with Cup Holders and 50W Fast Electric Air Inflator, Blow up Floaties Pool Toys for Beach,Lakes, Pool Summer Singles Party",N/A,$29.99,,4.8,32.0,False,https://m.media-amazon.com/images/I/81qjaTO+RiL._AC_UL320_.jpg,https://m.media-amazon.com/images/I/81qjaTO+RiL._AC_SL1500_.jpg,,2026-04-23T12:04:44.226268,
45,3,Organic,,136.0,B08R5LF5MM,"FUNBOY Giant Inflatable Yellow Cabana Tube Float, Donut Style Pool Float, Luxury Raft for Summer Pool Parties and Entertainment Large",N/A,$23.20,,4.4,126.0,False,https://m.media-amazon.com/images/I/71dOdRbXYbL._AC_UL320_.jpg,https://m.media-amazon.com/images/I/71dOdRbXYbL._AC_SL1500_.jpg,,2026-04-23T12:04:44.230058,
46,3,Organic,,137.0,B0CQYKCSQ1,"iGeeKid 65"" Giant Inflatable Pool Toys Wheel Roller for Kids-Pool Floats Pool Games for Kids Age 6-8,8-12 Years Girls Boys Summer Party,Beach,Swimming Pool,Lake,Lawns Fun Water Rolling Wheel Toys",N/A,$41.95,,3.7,66.0,False,https://m.media-amazon.com/images/I/81+iaDiXS6L._AC_UL320_.jpg,https://m.media-amazon.com/images/I/81+iaDiXS6L._AC_SL1500_.jpg,,2026-04-23T12:04:44.233751,
47,3,Organic,,138.0,B0DYHJRG2X,"FUNBOY Giant Stripe Inflatable Pool Float with Cup Holder, 48"" Adult Inner Tube Swim Ring Pool Lounger",N/A,$23.20,,4.6,96.0,False,https://m.media-amazon.com/images/I/61dOSfLJA5L._AC_UL320_.jpg,https://m.media-amazon.com/images/I/61dOSfLJA5L._AC_SL1500_.jpg,,2026-04-23T12:04:44.239278,
48,3,Organic,,139.0,B0GF7ZFVJ6,"Skirfy Inflatable Swimming Pool Float for Kids with Sprinkler for Yards, 3-in-1 Summer Water Toys Large Pool Raft Outdoor Party Toys",N/A,$29.99,,4.7,19.0,False,https://m.media-amazon.com/images/I/71sUNfZjAtL._AC_UL320_.jpg,https://m.media-amazon.com/images/I/71sUNfZjAtL._AC_SL1500_.jpg,,2026-04-23T12:04:44.243210,
49,3,Organic,,140.0,B0DLGV7XKY,"ILEISURELY Giant Inflatable Alligator Pool Float,84 inch Animal Themed Pool Toy Ballons for Birthday Pool Halloween Party Decorations,Blow Up Photo Prop,Party Favors Supplies Gift for Kids and Adults",N/A,$34.99,,4.6,133.0,False,https://m.media-amazon.com/images/I/61sXMvMC+KL._AC_UL320_.jpg,https://m.media-amazon.com/images/I/61sXMvMC+KL._AC_SL1500_.jpg,,2026-04-23T12:04:44.248410,
50,3,Organic,,141.0,B0DLKTD7M6,"SLOOSH Inflatable Tank Pool Floats Kids, Pool Floaties Swimming Tank with Water Gun, Water Fight Toys, Inflatable Battle Fun for Summer",N/A,$19.99,,4.4,77.0,False,https://m.media-amazon.com/images/I/91+UmF5d8+L._AC_UL320_.jpg,https://m.media-amazon.com/images/I/91+UmF5d8+L._AC_SL1500_.jpg,,2026-04-23T12:04:44.251734,
51,3,Organic,,142.0,B0CCW542V5,"SwimWays Spring Float Premium Papasan Pool Lounger, Inflatable Pool Floats Adult with Fast Inflation for Ages 15 & Up",N/A,$16.99,,4.6,6926.0,False,https://m.media-amazon.com/images/I/81wafuO4gML._AC_UL320_.jpg,https://m.media-amazon.com/images/I/81wafuO4gML._AC_SL1500_.jpg,,2026-04-23T12:04:44.255809,
52,3,Organic,,143.0,B0BTLZRCX5,"HopeRock Kids Pool Float with Water Gun - Inflatable Ride-on Swimming Toy for Boys Aged 3-8, Summer Fun (Red)",N/A,$28.49,,4.7,462.0,False,https://m.media-amazon.com/images/I/81uBRBCSEhL._AC_UL320_.jpg,https://m.media-amazon.com/images/I/81uBRBCSEhL._AC_SL1500_.jpg,,2026-04-23T12:04:44.264620,
53,3,Organic,,144.0,B0DR8RKPYR,"AEOCOO Puddle Float Jumper 20-30-50-60-70 Pounds, Toddler Swim Vest for 1-3-5-6-9 Years Old, Pool Floats with Swimming Arm Floaties Swim Jacket & Water Wings for Kids Swimmies, Boys, Girls, Niños",N/A,$24.62,,4.7,697.0,False,https://m.media-amazon.com/images/I/71wA3SG+Y1L._AC_UL320_.jpg,https://m.media-amazon.com/images/I/71wA3SG+Y1L._AC_SL1500_.jpg,,2026-04-23T12:04:44.270928,
55,3,Title,,,,Debug info copied.Sponsored[Upgraded Log Rafts] 4 Pcs Jumbo Inflatable Battle Log Pool Game - 2 Play,,,,,,False,,,,2026-04-23T12:04:44.272062,
56,3,Title,,,,Related searchesfun pool floats for adultspool toysfun pool toyspool gamesfun pool floats for kidsfu,,,,,,False,,,,2026-04-23T12:04:44.273144,
57,3,Title,,,,Previous1234...7Next,,,,,,False,,,,2026-04-23T12:04:44.273655,
58,3,SB,4.0,,,N/A,https://aax-us-east-retail-direct.amazon.com/x/c/JPvD5g-m4dElflCIa4WCQjsAAAGduILlmwEAAAH2AQBvbm9fdHhuX2JpZDIgICBvbm9fdHhuX2ltcDIgICAH2dTM/clv1c_ek-IBIHXFcbWDn2nI5drJ16WtD5jqoAHrkc1MlbmHtXJMk6Bt0iMj00BoYLrZDuYpeSmv9XH9D7yZYfGrSSDMGjq4AHk8oa8PXtpTln3wO-6u1PnOd2VcVnYo_5gytrhxZ5_h_nZ6wQgI-xs6I_3kRJapvF8VlTryk34ziF6ZMbd2WKQkcgC_VoUHYZQmfPTNlm5wA7JEQbegTyRn4gAQg_CSB95RR8_sBnh0F1y1IwNjmqbgc9Mx0zQ25aiCy7mEynJ3vze5jrk0jzytDxwjBdrH4uCPxCZyRlKV2Isp78t1MAXGvxbjZadStAq4bekI8knvWcqc7FxrBBnlCna0hGcegCoQIrOJRdQnvkS6LiEBc-dCrpiOqjW6OC895ghcq8ku0KSZDhTS1LNDw-kk-gdhC3lmAjYkIfoSBKYzLnogSKtYgS6gzcCwx7eOp1B17yb1eXnSvMFNeW7E1FK3IkUk6e0XWiwgRRgcTxh_od1eyYShDVo5ov0ZKjRuAty0m2SISL52iLhOrhgS7IQPpY6k2YE9LehruO-fhyfELQUxz_iiZNFcmbQqiSBkh_5L2AuN1WBF2hDrLjw12v1NFw0g2MP18bOgdW5l7chnkULYRZA_alEX56zbSzSnD3x2TzbFYll0T-ybvz_jVv-iRbbMQrbOZBaT5gkkeVT95eYf3rEEV1Ej0FjQcit7RkoEKohtn6Sa08BjxmnUD4YOPZkl6u7NcQxOXOnMnBk2bq9rMdj7v1cZN0NqphwkdB7HMeMTOB0DCw_bzMD8eZmQ8eI3lmo9ytLxrNPck9R1VULtAqmRUjMFnEU6zkGdBoAadwkeg1UeYo6fD9zegFsf1B3Qorv6_WQTf4Rsxhre9PVgr4wuDGWymXUQxbmeDG7mU36VFofj9gYDY4w89lo8mcSN03D8M-D4ss6GjnLiR2KLq7do58CURs3XNKi7qGh0qrw_xZTQqVeKvoKzVbwlCjGbIHYcTF7LR7hzB5Ya_n4LfbDwWzXMynWLJ8agX97oHjhDA1WpUsP_sFxXwa4jQNs0Kj2QlqgqzG066uffEAD5G1dDogEsVzwt4uTFc7PSJbR1rPtyXOsYsu0mpbaCrPYsiUV1t5b7AhrvFlawtLH6vCL7tB9JxbozcGHJVCLk-LXGVYUNhgJUXGmYOmk8OeGcUNUoFeW3VgXwDTFgUTV7EoL6m_rXllNDDHwVzq1fP2cle7iMx7AXhpQs7H6gNBc-K7CSTySNFbeSBWFInAlTxEud7_A6-dPNTHs1enctkeu1wVdxZs2p0h6FUodivyFS3hXJqGG6IL24oNYRvch2y7B5ez9bJJqxOOXJ2nLj2FGxLpWV6COOIcS7b2To82pp2hoQWTu_LZLEtWdREk1ET_kKrQ0PxAyJMhnMRPHbJS_avfwZl5bvqnMCXBaSg-jtah7YeEWy2_cxy5uB4A5-ROJOMsc3nqmvCbbSheiYrlTMRrxDLkIZo5gwDwr96mw0BBOaQ0DlcCtr3t9LY0xyp3hYc1LF70BZQWmolYMXCbSW_2QxPalwYYlSrUBdN65eH4VxVzS3z3y46ljN2W8IV_TgXbd1ffrvN0xtpo7A-2WXOPOpgtgB5JtLIvZ8T0RpGJyU_MOBo5KIbEPyRpjvzbSrLUwXqk1aFj6xDpy9e41C_9FxB05YtuA40CCVbp4cY0LlBUPQXeK/https://www.amazon.com/stores/page/B68C4601-0BFE-4B30-94CE-7F42AE94FA8A/?_encoding=UTF8&store_ref=SB_A09075401KB9OXAV5ZNEC-A097298713YOAJMBXOOQZ&pd_rd_plhdr=t&aaxitk=7eaa7ad0b8773ab51da493023ead1acc&hsa_cr_id=0&lp_asins=B0DYGYPHR5%2CB0CXVB1ZTS%2CB0CXVFFDRQ&lp_query=fun%20pool%20floats&lp_slot=desktop-hsa-3psl&ref_=sbx_be_s_3psl_mbd_mb0_bkgd&pd_rd_w=zlAL6&content-id=amzn1.sym.cd7c548b-a599-426f-9ffe-daa1aa803c87%3Aamzn1.sym.cd7c548b-a599-426f-9ffe-daa1aa803c87&pf_rd_p=cd7c548b-a599-426f-9ffe-daa1aa803c87&pf_rd_r=F4K7EFA87J9G09C29GDZ&pd_rd_wg=ftJxo&pd_rd_r=2320c0b2-7894-4fcc-8575-222adeb8b17a,,,,,False,,,N/A,2026-04-23T12:04:44.279196,
59,3,Title,,,,Need help?Visit the help sectionorcontact us,,,,,,False,,,,2026-04-23T12:04:44.279810,
0,4,SB_Video,3.0,,,N/A,N/A,,,,,False,,,,2026-04-23T12:05:01.219630,6.0
1,4,Title,,,,ResultsCheck each product page for other buying options. Price and other details may vary based on p,,,,,,False,,,,2026-04-23T12:05:01.221803,
3,4,Organic,,145.0,B0GJ46TD34,"Kids Pool Floats with Water Gun, Mermaid Toddler Inflatable Pool Toys for Kids Age 3-8 Years Old, Summer Outdoor Water, Beach, Swimming Pool Toys Gift for Girls",N/A,$21.99,,4.9,36.0,False,https://m.media-amazon.com/images/I/71T9qMNYrlL._AC_UL320_.jpg,https://m.media-amazon.com/images/I/71T9qMNYrlL._AC_SL1500_.jpg,,2026-04-23T12:05:01.227589,
4,4,Organic,,146.0,B09T2QKS13,"FLAMDYNO Pool Toys - 4/8 Pack Light Up Beach Balls for Kids w/ 8 Light Modes, Pool Beach Games Balls for Outdoor or Indoor Activities, Glow in The Dark Pool Beach Decorations for Kids and Adults",N/A,$23.99,,4.2,1081.0,False,https://m.media-amazon.com/images/I/71yrSUa95NL._AC_UL320_.jpg,https://m.media-amazon.com/images/I/71yrSUa95NL._AC_SL1500_.jpg,,2026-04-23T12:05:01.230675,
5,4,Organic,,147.0,B078KC8WQ4,"Poolmaster Aqua Rocker Inflatable Swimming Pool Float Ride On, Outdoor Toy For 8 Years Old and Up Boys, Girls, and Adults Pool Blow-Up Floatie and Lounge",N/A,$93.99,,4.0,371.0,False,https://m.media-amazon.com/images/I/71i60EZqzhL._AC_UL320_.jpg,https://m.media-amazon.com/images/I/71i60EZqzhL._AC_SL1500_.jpg,,2026-04-23T12:05:01.234011,
6,4,Title,,,,Kids or Youth Swimming FinsSponsored|Top 10 best-selling brand in this category|Shop FoyinbetShop no,,,,,,False,,,,2026-04-23T12:05:01.235447,
7,4,Title,,,,"Tic Tac Toe Pool Toys GameShopSpeceTimePrevious pageSpaceTime Pool Toys Games Set,53.9 × 51.1 × 5.5 ",,,,,,False,,,,2026-04-23T12:05:01.236442,
8,4,Title,,,,More results,,,,,,False,,,,2026-04-23T12:05:01.236580,
9,4,Organic,,148.0,B07D96H4QV,"Giant Donkey Piñata Pool Float, Inflatable Swim Ring, Large Novelty Floatie for Pool Parties, Outdoor Summer Water Toy",N/A,$26.97,,4.6,175.0,False,https://m.media-amazon.com/images/I/71iIXRuHQYL._AC_UL320_.jpg,https://m.media-amazon.com/images/I/71iIXRuHQYL._AC_SL1500_.jpg,,2026-04-23T12:05:01.240317,
10,4,Organic,,149.0,B0GKNY289V,Lewtemi Goose Inflatable Pool Float Giant Inflatable Swan Pool Floats Beach Goose Luxury Float Summer Pools Parties Entertainment Poolside Summer Lounging Fun,N/A,$43.99,,3.3,3.0,False,https://m.media-amazon.com/images/I/91APuKa1ukL._AC_UL320_.jpg,https://m.media-amazon.com/images/I/91APuKa1ukL._AC_SL1500_.jpg,,2026-04-23T12:05:01.243900,
11,4,Organic,,150.0,B0FLPSN7K9,"Funscape Large Inflatable Pool Floats, Water Floating Hammock Tanning Pool Lounger for Adult, 76"" x 67"" Sun Bathing Tan Bed, Swimming Water Raft Floatie W/Mesh Mat, Summer Beach Lake Party Gift Blue",N/A,$33.99,,4.3,7.0,False,https://m.media-amazon.com/images/I/81ZpThqb+AL._AC_UL320_.jpg,https://m.media-amazon.com/images/I/81ZpThqb+AL._AC_SL1500_.jpg,,2026-04-23T12:05:01.247282,
12,4,Organic,,151.0,B0DSWBC74H,"3/5/8 Pack Pool Hammock Upgrated Water Pool Floats, 4-in-1 (Hammock, Saddle, Lounge Chair, Drifter) Multi-Purpose Water Pool Float, Non-Stick PVC Material",N/A,$24.99,,4.6,520.0,False,https://m.media-amazon.com/images/I/71-j1khx+sL._AC_UL320_.jpg,https://m.media-amazon.com/images/I/71-j1khx+sL._AC_SL1500_.jpg,,2026-04-23T12:05:01.257297,
13,4,Organic,,152.0,B0GCMFJNXH,"Mermaid Pool Float Bed for Adults - 63"" X 39"" Premium Inflatable Lounger with Backrest & Cup Holder, Glitter Interior, Comfortable Sunbathing Raft with Handles for Party Pool Beach Lake (Pink)",N/A,$32.99,,4.7,11.0,False,https://m.media-amazon.com/images/I/81m-tk66TxL._AC_UL320_.jpg,https://m.media-amazon.com/images/I/81m-tk66TxL._AC_SL1500_.jpg,,2026-04-23T12:05:01.261486,
14,4,Organic,,153.0,B0753FXZD1,"HeySplash Pool Floats, Pool Tubes for Adult, Inflatable Pool Floats Fun Pool Floaties for Swimming Pool Beach Lake River Party Decoration Toys",N/A,$13.19,,4.5,1342.0,False,https://m.media-amazon.com/images/I/41cn8+qRLpL._AC_UL320_.jpg,https://m.media-amazon.com/images/I/41cn8+qRLpL._AC_SL1500_.jpg,,2026-04-23T12:05:01.266918,
15,4,Organic,,154.0,B0C52PSRG3,"Inflatable Pool Floats, Solar Powered Large Swan Pool Float Adult, LED Color Changing",N/A,$31.34,,4.5,390.0,False,https://m.media-amazon.com/images/I/71B+bJAGf4L._AC_UL320_.jpg,https://m.media-amazon.com/images/I/71B+bJAGf4L._AC_SL1500_.jpg,,2026-04-23T12:05:01.271659,
16,4,Organic,,155.0,B0DLRHPNNK,"Pool Party Set - Parentswell Inflatable Pool Float Swimming Rings, Pool Tubes with Water Guns and Beach Ball, Pool Party Favors for Summer Pool and Beach Fun",N/A,$23.74,,4.3,100.0,False,https://m.media-amazon.com/images/I/81EEhxSCYCL._AC_UL320_.jpg,https://m.media-amazon.com/images/I/81EEhxSCYCL._AC_SL1500_.jpg,,2026-04-23T12:05:01.275604,
