data_index,page,ad_type,ad_rank,organic_rank,asin,title,url,price_current,price_list,rating_stars,rating_count,is_prime,image_small,image_large,brand_name,scraped_at,inner_products_count
17,4,Organic,,156.0,B07BHV6DHB,Intex French Fries Float,N/A,$18.99,,4.4,175.0,False,https://m.media-amazon.com/images/I/61nHuYYhtuL._AC_UL320_.jpg,https://m.media-amazon.com/images/I/61nHuYYhtuL._AC_SL1500_.jpg,,2026-04-23T12:05:01.280781,
18,4,Organic,,157.0,B0C2HKJRSY,"Uniqhia Pool Floats Games Toys, Inflatable Raft Pool Toys for Kids (Ages 8-12) & Adults, Joust Inflatable Logs Battle Game for Family, Swimming Pool Floaties Patented",N/A,$24.99,,3.7,171.0,False,https://m.media-amazon.com/images/I/81kTUw04+cL._AC_UL320_.jpg,https://m.media-amazon.com/images/I/81kTUw04+cL._AC_SL1500_.jpg,,2026-04-23T12:05:01.284256,
19,4,Organic,,158.0,B0BKTPNC4F,"Sloosh Inflatable Pool Floats Chairs Adults, 2 Packs Floating Noodle Chair with Stripes Design Soft Fabric Covered with Sling for Swimming Pool Water Chair Pool Lounger Party Floaties",N/A,$31.99,,4.4,729.0,False,https://m.media-amazon.com/images/I/713n4W3oW2L._AC_UL320_.jpg,https://m.media-amazon.com/images/I/713n4W3oW2L._AC_SL1500_.jpg,,2026-04-23T12:05:01.289617,
20,4,Organic,,159.0,B08R7Z55GK,"Inflatable Donuts - (Pack of 4) 24 Inch Donut Pool Float for Kids Ages 2-6 Pool Tube, Assorted Swim Rings with Sprinkles for Pool Floaties, Party Decorations",N/A,$14.99,,4.0,1207.0,False,https://m.media-amazon.com/images/I/91U6O2UiRFL._AC_UL320_.jpg,https://m.media-amazon.com/images/I/91U6O2UiRFL._AC_SL1500_.jpg,,2026-04-23T12:05:01.296868,
21,4,Organic,,160.0,B0BC9ZFSBQ,"FUNBOY Giant Super Clear Chaise Lounger Pool Float, 1-2 Person Size",N/A,$58.65,,3.9,225.0,False,https://m.media-amazon.com/images/I/51K5OWp48+L._AC_UL320_.jpg,https://m.media-amazon.com/images/I/51K5OWp48+L._AC_SL1500_.jpg,,2026-04-23T12:05:01.305841,
22,4,Organic,,161.0,B0CQYFBB8P,"HopeRock Pool Floats Toys for Kids with Water Gun - Inflatable Ride-on Pool Toys for Kids Ages 3-8, Toddler Pool Float, Summer Outdoor Water Pool Games Toys for Boys and Girls",N/A,$23.98,,4.3,356.0,False,https://m.media-amazon.com/images/I/91cPOxHocBL._AC_UL320_.jpg,https://m.media-amazon.com/images/I/91cPOxHocBL._AC_SL1500_.jpg,,2026-04-23T12:05:01.322600,
23,4,Organic,,162.0,B0006N0AQ0,Swimline Two Headed Curly Serpent Pool Float,N/A,$26.73,,3.4,234.0,False,https://m.media-amazon.com/images/I/8139fTwtj0L._AC_UL320_.jpg,https://m.media-amazon.com/images/I/8139fTwtj0L._AC_SL1500_.jpg,,2026-04-23T12:05:01.327617,
24,4,Organic,,163.0,B00005C9RS,1 Random Intex Animal Split Ring,N/A,$8.49,,3.7,935.0,False,https://m.media-amazon.com/images/I/71BkxfTufHL._AC_UL320_.jpg,https://m.media-amazon.com/images/I/71BkxfTufHL._AC_SL1500_.jpg,,2026-04-23T12:05:01.332576,
25,4,Organic,,164.0,B07WPS8C8D,HAPIKAY Solar Floating Pool Lights - Pack of 2 Solar Powered Color Changing 14-inch Balls - Float or Hang in Pool Garden Backyard Pond Party Decorations - Inflatable Wateproof,N/A,$31.99,,4.5,2537.0,False,https://m.media-amazon.com/images/I/71zG2hY25yL._AC_UL320_.jpg,https://m.media-amazon.com/images/I/71zG2hY25yL._AC_SL1500_.jpg,,2026-04-23T12:05:01.336560,
26,4,Organic,,165.0,B0CWRC7PX3,"Premium Thickened Mermaid Pool Float for Kids & Adults - Large Inflatable Mermaid Tail Lounge Raft with Cup Holders, Backrest, Mesh Bottom and Handles Summer Water Fun Beach Party Swimming Pool Toys",N/A,$25.99,,4.7,143.0,False,https://m.media-amazon.com/images/I/71RaSMl7KsL._AC_UL320_.jpg,https://m.media-amazon.com/images/I/71RaSMl7KsL._AC_SL1500_.jpg,,2026-04-23T12:05:01.340488,
27,4,Organic,,166.0,B0GHQN762M,"Kids Pool Floats with Water Gun, Shark Toddler Inflatable Pool Toys for Kids Age 3-8 Years Old, Summer Outdoor Water, Beach, Swimming Pool Toys Gift for Boys and Girls",N/A,$21.99,,4.8,17.0,False,https://m.media-amazon.com/images/I/71xQ0a2OR-L._AC_UL320_.jpg,https://m.media-amazon.com/images/I/71xQ0a2OR-L._AC_SL1500_.jpg,,2026-04-23T12:05:01.344286,
28,4,Organic,,167.0,B0BRN8WHJQ,Jasonwell Inflatable Pool Float Lounge - 2 Pack Floaties Rafts for Adults Floating Lounger Sun Tanning Floats Cool Water Floaty Swimming Lake Beach Party Toys,N/A,$23.99,,4.4,1486.0,False,https://m.media-amazon.com/images/I/81vk1ujoGhL._AC_UL320_.jpg,https://m.media-amazon.com/images/I/81vk1ujoGhL._AC_SL1500_.jpg,,2026-04-23T12:05:01.352723,
29,4,Organic,,168.0,B002V1H0W2,"Intex 56508EP Inflatable Floating Swimming Pool Toys Volleyball Game, Green",N/A,$10.99,,4.2,19725.0,False,https://m.media-amazon.com/images/I/61BD7zML5mL._AC_UL320_.jpg,https://m.media-amazon.com/images/I/61BD7zML5mL._AC_SL1500_.jpg,,2026-04-23T12:05:01.356637,
30,4,Organic,,169.0,B0GHMZY4HW,MGparty Pool Toys Games Set - Giant Tic Tac Toe Pool Toy Floating Board with 10 Balls - Summer Inflatable Outdoor Fun Field Day Beach Backyard Toys Floats for Kids Adults Teens (2-10 Players),N/A,$15.99,,4.3,19.0,False,https://m.media-amazon.com/images/I/81zfQNupHmL._AC_UL320_.jpg,https://m.media-amazon.com/images/I/81zfQNupHmL._AC_SL1500_.jpg,,2026-04-23T12:05:01.359419,
31,4,Organic,,170.0,B0BR6Y6QL9,Jasonwell Inflatable Pool Float Adult - Pool Floaties Lounger Floats Raft Floating Chair Water Floaties for Swimming Pool Lake Lounge Float with Cup Holders Beach Pool Party Toys for Adults,N/A,$19.98,,4.4,2106.0,False,https://m.media-amazon.com/images/I/71v1Lcvj94L._AC_UL320_.jpg,https://m.media-amazon.com/images/I/71v1Lcvj94L._AC_SL1500_.jpg,,2026-04-23T12:05:01.376093,
32,4,Organic,,171.0,B07L4R6R4D,Jasonwell Giant Inflatable Mermaid Tail Pool Float with Fast Valves Summer Beach Swimming Pool Party Lounge Raft Decorations Toys for Adults Kids (Pink),N/A,$21.97,,4.4,4914.0,False,https://m.media-amazon.com/images/I/712Z+1GbmiL._AC_UL320_.jpg,https://m.media-amazon.com/images/I/712Z+1GbmiL._AC_SL1500_.jpg,,2026-04-23T12:05:01.386071,
33,4,Organic,,172.0,B0DYDBK1ZG,"FUNBOY Giant Toile Inflatable Pool Float with Cup Holder 48"" |Pool Float for Adults|Inner Tube Swimming Pool Toys Swim Rings | Swimming Pool Accessories & Pool Lounger Float for Pool Party & Summer",N/A,$23.20,,4.4,219.0,False,https://m.media-amazon.com/images/I/812wUBASW5L._AC_UL320_.jpg,https://m.media-amazon.com/images/I/812wUBASW5L._AC_SL1500_.jpg,,2026-04-23T12:05:01.390083,
34,4,Organic,,173.0,B0CQYFBLM6,Inflatable Pirate Ship Pool Floats Kids 3-11 Years Toddler Pool Floaties with Water Cannon Gun Swimming Pool Toys Boys Girls Party Float Ride-on Floaty Rafts with Safety Seat Summer Outdoor Water Game,N/A,$18.69,,4.2,95.0,False,https://m.media-amazon.com/images/I/81USKqdrI9L._AC_UL320_.jpg,https://m.media-amazon.com/images/I/81USKqdrI9L._AC_SL1500_.jpg,,2026-04-23T12:05:01.394430,
35,4,Organic,,174.0,B09PKDWPBS,Jasonwell Inflatable Pool Hammock Float - 2 Pack Water Hammock Pool Floaties Multi-Purpose (Saddle Lounge Chair Drifter) 4 in 1 Lake Beach Floating Loungers Swimming Pool Floats Toys for Adults,N/A,$24.99,,4.5,1545.0,False,https://m.media-amazon.com/images/I/71oUHP8kM6L._AC_UL320_.jpg,https://m.media-amazon.com/images/I/71oUHP8kM6L._AC_SL1500_.jpg,,2026-04-23T12:05:01.402240,
36,4,Organic,,175.0,B078D7MHCD,"Swimline Margarita Pool Ring with Cupholder & Backrest – Inflatable Lounge Float with Fun Design for Adults & Teens – Durable Vinyl Ring for Pool, Lake, or Beach – Easy to Inflate and Store",N/A,$19.73,,4.0,2009.0,False,https://m.media-amazon.com/images/I/71ifGSyloSL._AC_UL320_.jpg,https://m.media-amazon.com/images/I/71ifGSyloSL._AC_SL1500_.jpg,,2026-04-23T12:05:01.407583,
37,4,Organic,,176.0,B0DYHRH8KN,"FUNBOY Giant Vintage Stripe Inflatable Pool Float with Cup Holder 48"" Pool Float for Adults Inner Tube Pool Toys Swim Rings Swimming Pool Accessories & Pool Lounger Float for Pool Party & Summer",N/A,$23.20,,4.1,97.0,False,https://m.media-amazon.com/images/I/61LoMBWwUnL._AC_UL320_.jpg,https://m.media-amazon.com/images/I/61LoMBWwUnL._AC_SL1500_.jpg,,2026-04-23T12:05:01.412071,
38,4,Organic,,177.0,B0CW6CK3FK,"72"" Inflatable American Flag Pool Floats Adults, Inflatable Tanning Pool Raft with Patriotic US Stars Cool Water Swimming Pool Floaties Lake Lounger Pool Float for Adults 250th Anniversary 4th of July",N/A,$19.99,,4.2,56.0,False,https://m.media-amazon.com/images/I/814PCgYiO7L._AC_UL320_.jpg,https://m.media-amazon.com/images/I/814PCgYiO7L._AC_SL1500_.jpg,,2026-04-23T12:05:01.415685,
39,4,Organic,,178.0,B082N8462N,"Poolmaster Swimming Pool Float Pirate Duck Tube, Multi Large",N/A,$13.98,,3.7,92.0,False,https://m.media-amazon.com/images/I/71nVqyqIbSL._AC_UL320_.jpg,https://m.media-amazon.com/images/I/71nVqyqIbSL._AC_SL1500_.jpg,,2026-04-23T12:05:01.419468,
40,4,Organic,,179.0,B0932ZFCT6,"Max Fun Pool Toys Games Set, Inflatable Cross Ring Toss Games, Floating Pool Basketball Hoop, Inflatable Cactus Pool Floats for Kids Teens Adults Swimming Water Toys (3-Piece Set)",N/A,$19.99,,3.8,1422.0,False,https://m.media-amazon.com/images/I/8101q+LPZ0L._AC_UL320_.jpg,https://m.media-amazon.com/images/I/8101q+LPZ0L._AC_SL1500_.jpg,,2026-04-23T12:05:01.424105,
41,4,Organic,,180.0,B083B76Q7Y,"JOYIN Unicorn Pool Float Kids - Inflatable Rainbow Unicorn Floaty with Glitters Fun Floats, Ride On Beach Lake Floaties Raft Lounge, Party in Summer Decorations Pool Toys for Kids",N/A,$19.99,,4.3,2537.0,False,https://m.media-amazon.com/images/I/71tyvHQQc-L._AC_UL320_.jpg,https://m.media-amazon.com/images/I/71tyvHQQc-L._AC_SL1500_.jpg,,2026-04-23T12:05:01.427266,
42,4,Organic,,181.0,B01MG2163Y,"Watermelon Ball – Cool Underwater Pool Toy for Teen Boys, Girls, Men & Women. Great Gifts for Swimming, Diving & Backyard Games. Best for Birthday Presents, Spring Vacation & Summer Family Fun.",N/A,$19.98,,4.6,10020.0,False,https://m.media-amazon.com/images/I/91GJfEEQffL._AC_UL320_.jpg,https://m.media-amazon.com/images/I/91GJfEEQffL._AC_SL1500_.jpg,,2026-04-23T12:05:01.431072,
43,4,Organic,,182.0,B083HTV2ZQ,"Swimline Inflatable Gummy Bear Pool Float Assortment, Blue, Green, Purple, 60"" x 37"" x 20"", Single Unit (Color May Vary)",N/A,$36.26,,3.6,108.0,False,https://m.media-amazon.com/images/I/81ufpQwdApL._AC_UL320_.jpg,https://m.media-amazon.com/images/I/81ufpQwdApL._AC_SL1500_.jpg,,2026-04-23T12:05:01.437357,
44,4,Organic,,183.0,B08JHC7621,"SWIMLINE Inflatable Ride-On Pool Float – Fun Raft for Pools, Beaches, and Summer Parties, Large 75"", Dolphin, Blue",N/A,$22.73,,4.1,695.0,False,https://m.media-amazon.com/images/I/61JXyoyqFuL._AC_UL320_.jpg,https://m.media-amazon.com/images/I/61JXyoyqFuL._AC_SL1500_.jpg,,2026-04-23T12:05:01.442213,
45,4,Organic,,184.0,B0C9GJNJXM,"3 Pack Inflatable Pool Floats Adult Size Water Hammock,Pool Floaties Toys,4-in-1 Multi-Purpose Floats for Swimming Pool,Pool Rafts Lounge Chairs Floating,for Adults Vacation Fun and Rest",N/A,$19.98,,4.3,1038.0,False,https://m.media-amazon.com/images/I/81+QedRXAWL._AC_UL320_.jpg,https://m.media-amazon.com/images/I/81+QedRXAWL._AC_SL1500_.jpg,,2026-04-23T12:05:01.446347,
46,4,Organic,,185.0,B0FL7VKN4C,"Funscape Pool Floats Chairs Adult, 2 Packs Heavy Duty Inflatable Swimming Pool Lounges, Fabric Floating Hammock Seat, Kid Blow Pool Noodle Lake Raft Floaties, Fun Summer Beach Water Party Game-Stripe",N/A,$28.98,,4.1,36.0,False,https://m.media-amazon.com/images/I/81LXWiK1qeL._AC_UL320_.jpg,https://m.media-amazon.com/images/I/81LXWiK1qeL._AC_SL1500_.jpg,,2026-04-23T12:05:01.450060,
47,4,Organic,,186.0,B0FM3ZBRF3,"Funscape Inflatable Pool Lounge Floats Adult, Large Swimming Pool Sofa Floaties, Beach Tanning Recliner Floating Mesh Chair Cup Holder, Blow Up Lake River Floaty Tube, Summer Water Party Toy-Green-L",N/A,$29.99,,4.0,17.0,False,https://m.media-amazon.com/images/I/81myhBZQ99L._AC_UL320_.jpg,https://m.media-amazon.com/images/I/81myhBZQ99L._AC_SL1500_.jpg,,2026-04-23T12:05:01.453630,
48,4,Organic,,187.0,B0GD1H871V,Jasonwell Tic-Tac-Toe Pool Toys Games - Giant Floating Tic Tac Toe Game Float with 10 Balls Pineapple Pool Game Party Toy Floats Yard Field Day Games Outdoor Beach Toys for Adults Teens Kids (Orange),N/A,$24.99,,4.2,60.0,False,https://m.media-amazon.com/images/I/81ptS9aComL._AC_UL320_.jpg,https://m.media-amazon.com/images/I/81ptS9aComL._AC_SL1500_.jpg,,2026-04-23T12:05:01.461643,
49,4,Organic,,188.0,B0FS1F74M6,"6 Pcs Jumbo Inflatable Battle Log Rafts Pool Toys for 3 Players Pool Games for Kids Adults,Inflatable Floating Row Pool Floats for Kids Ages 6-8,8-12,Adult and Family Summer Swimming Pool Party Beach",N/A,$29.99,,3.6,31.0,False,https://m.media-amazon.com/images/I/81KOAs+VKgL._AC_UL320_.jpg,https://m.media-amazon.com/images/I/81KOAs+VKgL._AC_SL1500_.jpg,,2026-04-23T12:05:01.465162,
50,4,Organic,,189.0,B093Q6L2RM,"BigMouth Inc. Giant Bull Rocker Pool Float, Inflatable Summer Party Water Toy",N/A,$54.99,,4.3,67.0,False,https://m.media-amazon.com/images/I/61YEdDqHMYL._AC_UL320_.jpg,https://m.media-amazon.com/images/I/61YEdDqHMYL._AC_SL1500_.jpg,,2026-04-23T12:05:01.468932,
51,4,Organic,,190.0,B0CSYXR67V,Jasonwell Inflatable Pool Party Cooler - Fiesta Cactus Ice Bucket Luau Hawaiian Tropical Beach Themed Birthday Easter Party Decorations Favors Outdoor Decor Pool Games Set for Kids Adult,N/A,$21.98,,4.6,3267.0,False,https://m.media-amazon.com/images/I/81yFzwjstTL._AC_UL320_.jpg,https://m.media-amazon.com/images/I/81yFzwjstTL._AC_SL1500_.jpg,,2026-04-23T12:05:01.478789,
52,4,Organic,,191.0,B0CQ3WLXSQ,"Pool Floats Adult, 2 Pack Inflatable Pool Floats, 4-in-1 Multi-Purpose Rafts Lounger Water Hammock for Swimming Pool, Thick PVC Pool Floaties for Adults Vacation",N/A,$16.99,,4.6,1337.0,False,https://m.media-amazon.com/images/I/91BHPOw9VeL._AC_UL320_.jpg,https://m.media-amazon.com/images/I/91BHPOw9VeL._AC_SL1500_.jpg,,2026-04-23T12:05:01.482676,
53,4,Organic,,192.0,B08W1P3XBC,"GiftExpress 48"" Inflatable Flamingo Pool Float, Swim Party Toys, Fun Beach Floaties, Summer Pool Lilo Lounger for Adults & Kids, Pool Party Favor",N/A,$24.99,,4.4,366.0,False,https://m.media-amazon.com/images/I/6126vh95FAL._AC_UL320_.jpg,https://m.media-amazon.com/images/I/6126vh95FAL._AC_SL1500_.jpg,,2026-04-23T12:05:01.487380,
55,4,Title,,,,"Debug info copied.SponsoredTOY Life 2 Sets Inflatable Pool Games Toys, Pool Cornhole Game Floating T",,,,,,False,,,,2026-04-23T12:05:01.488258,
56,4,Title,,,,Related searchesfun pool floats for adultspool toysfun pool toyspool gamesfun pool floats for kidsfu,,,,,,False,,,,2026-04-23T12:05:01.489137,
57,4,Title,,,,Previous1234567Next,,,,,,False,,,,2026-04-23T12:05:01.489522,
58,4,SB,5.0,,,N/A,https://aax-us-east-retail-direct.amazon.com/x/c/JF5r7ZPlU_iroDxoFavzf3sAAAGduIMoMQEAAAH2AQBvbm9fdHhuX2JpZDUgICBvbm9fdHhuX2ltcDEgICDMp40r/clv1c_ek-IBIHXFcbWDn2nI4trJ16WpAySuUaPTjy6c36ij2NYjUa3GCHWQNb5_z7V7AsufdIayb-L0lLqSLJIPYSVuwn3SOB670ZfM6NkBudkv0gnzZkqardsXWAw0vlxvWhFjZuU91QwNFuGTW0YJDrtdyL48NyblG3Kkw9h7_eoyps3wQtdwdrsGDP_QQsxIrz8F1sbnsQsVDfoFWb7LEXVqvINMcwrlJ5m3P6iZmqjR00dNZdQMi8STTAnYKhkRYV3EEpwvvWwXZDXkGnINqgRRML1Oez8kXc9hHy33bs13Z9aolrfKyR-T6CLcrrYuRSdESbBvtqnnWICrbkvP0aSoaCHqpQiehdqrPX79Ue56r9wNpU9AkApHWD34Nv6YKpw_I0CTuxuXVjRFFhFKFE8mKLhHoJ8mFbSZRhJVB-zrVyF2Pr4j0pZxRGZ9vuF0qscBNFP0HMzp33jy-elsJ3TfoXXTEhKa3dqTyqLYI7yUML1yJA_3O7MR9Hh30hPrQYVFvIW7sWSvg3-izeMFqobOrEx-OFQQWuxXsMwQfwHANoQ6VN6ih2hsCauDVs2B7MBMujeKM_1-_z-Ui10J2d4r_iTZeWw-UE-PE9PGy-OrDB4uA98X0JIaQFF588BRMNJ5ivtlbRi_gG-1DTYICryUIZK3Wo703p0IV5iWu5c3KczKNBrWsT-4oh7jgkzp9bKLTXRfllJ4TCQjNZkFG__6VtdOBQ0MBLIXf20ECLnsYmJNXKmEkXZFXFaTKDVtmiDXos_d78uWsx-uqPzcJOlhbuCbd9nqqAZ7dWKVJHucyqAso4F9hrKQtSM9iyeizf4zV9n4jWpxcIrnUZwqmFBZbWSA3dyCSGbQ-UoRanCWBlnBmzNlRfyFz0mWF50FCrOyQ17EpwxrRUMmiYBRPQvXMmxXmE0lgjsZI8aEG0HtVeb-7znBeaBLA6caSnA37iDzg6sT0IecgF-hnqwSH9eI7dFVJVR62hXzVAyo8K7_bU2YX1Ty1GX0hsj_ceUf9lOi6l62i6BKex7Ou2V-YiwmleWBYDJ2QTpg1fbaKlY7NwDeBFnJ-uGsWFOJtNA0YgoothQQHURbJBFUDWOwM_JJPvtpqP9cTSDkucGxdje77VINWiwZUL4jA4ycBHm0U09JAJI9aGE5kVdxNICpOG7zk4MFYCDmtyvQy_iFm059ObC5I7YGDNJI6NhogGfEGAhdXHAxpXi-a67ju2gJTCLmuJEl6iu6s5D31v8Szdni9bXMWO-3jSlY87YSS0efIxK3OSEp8nd3wQfAM_ocIK6V-fQS-eWdb288iMZjqOOD0VXE1MZsg7LIT8VzFI3-FDU4THlhKUhYNL59Wd-7oI0P5vJ0L2RNXQL1ToybS6Q46MpUXtmZb44Uxgw4cUO8fZ68LJAiLa2CveEAZlO1w6GlmInx3t1b-FhbC01jzJQT9NbZnkeSQjxVEjxODTDPgKGRLl0Z7SjteXlPDdK4P9BVXhuu36WiGT0v262vdhGsuB0xHME214PPxQdhSTXW0YockA9oa78bLz5SabSxzf6YJ5DG9OSRBDxdRjm9mY5xgS0I1nDA3bdcjYu7j4nbYT3UeWaU863myVApLgt0aqZ5dzqAXT8GKJ4dwvCchUNHQ0KlRlKuXjuYCCEremGcMHrZzdagbqG1NZJFUh3PBIA-xzsV9JsL_iHxhDenw/https://www.amazon.com/stores/page/B68C4601-0BFE-4B30-94CE-7F42AE94FA8A/?_encoding=UTF8&store_ref=SB_A09075401KB9OXAV5ZNEC-A097298713YOAJMBXOOQZ&pd_rd_plhdr=t&aaxitk=7eaa7ad0b8773ab51da493023ead1acc&hsa_cr_id=0&lp_asins=B0DYGYPHR5%2CB0CXVB1ZTS%2CB0CXVFFDRQ&lp_query=fun%20pool%20floats&lp_slot=desktop-hsa-3psl&ref_=sbx_be_s_3psl_mbd_mb0_bkgd&pd_rd_w=qMlrL&content-id=amzn1.sym.cd7c548b-a599-426f-9ffe-daa1aa803c87%3Aamzn1.sym.cd7c548b-a599-426f-9ffe-daa1aa803c87&pf_rd_p=cd7c548b-a599-426f-9ffe-daa1aa803c87&pf_rd_r=YSGFJBFFQKX09MTRVR3E&pd_rd_wg=ECPvV&pd_rd_r=888066c5-c33e-4d2a-9d64-cfa787d13891,,,,,False,,,N/A,2026-04-23T12:05:01.493772,
59,4,Title,,,,Need help?Visit the help sectionorcontact us,,,,,,False,,,,2026-04-23T12:05:01.494327,
0,5,SB_Video,4.0,,,N/A,N/A,,,,,False,,,,2026-04-23T12:05:14.589545,
1,5,Title,,,,ResultsCheck each product page for other buying options. Price and other details may vary based on p,,,,,,False,,,,2026-04-23T12:05:14.590780,
3,5,Organic,,193.0,B0FPM62KTX,"Funscape Kids Pool Toys, Inflatable Cactus Water Toss Game, Outdoor Backyard Play w/6 Rings 6 Discs, Swimming Floating Toy Summer Beach Yard Family Fun Party Gift 3 4 5 6 7 8 12 Year Old Boy Girl Teen",N/A,$29.99,,5.0,2.0,False,https://m.media-amazon.com/images/I/81lC858-orL._AC_UL320_.jpg,https://m.media-amazon.com/images/I/81lC858-orL._AC_SL1500_.jpg,,2026-04-23T12:05:14.594913,
4,5,Organic,,194.0,B0DPFXZ91Q,"TURNMEON Inflatable Tanning Pool Lounger Float with Sprinkler, 78""x50"" Pool Floats Adult with Pillow,6 in 1 Suntan Tub Raft Floatie with Cup & Food Holder Blow Up Pool for Summer Pool Beach Party",N/A,$29.99,,4.2,272.0,False,https://m.media-amazon.com/images/I/919zL08qQ4L._AC_UL320_.jpg,https://m.media-amazon.com/images/I/919zL08qQ4L._AC_SL1500_.jpg,,2026-04-23T12:05:14.598880,
5,5,Organic,,195.0,B0BXX8CJMV,"POPLAY 16 Inch Inflatable Beach Balls, 3 Pack Glitter Beach Balls Pool Toys with Confetti Sparkling Balls for Kids Toddlers Adults Summer Pool Party Favors",N/A,$8.99,,4.4,232.0,False,https://m.media-amazon.com/images/I/71qjJ0uwu3L._AC_UL320_.jpg,https://m.media-amazon.com/images/I/71qjJ0uwu3L._AC_SL1500_.jpg,,2026-04-23T12:05:14.602284,
6,5,Title,,,,"Floating Pool LightsShopGodferyxinPrevious pageGodferyxin Floating Pool Lights for Night Party, 1 Pa",,,,,,False,,,,2026-04-23T12:05:14.603749,
7,5,Title,,,,Start Your Summer Vacation With Sloosh FloatsSponsored|Top 10 best-selling brand in this category|Sh,,,,,,False,,,,2026-04-23T12:05:14.604837,
8,5,Title,,,,More results,,,,,,False,,,,2026-04-23T12:05:14.604963,
9,5,Organic,,196.0,B0G4MG7C7K,"JOSEN Inflatable Tank Pool Float, Swimming Pool Floaties Tank with Water Cannon Gun, Swim Raft Water Battle Fun for Lake, Pool Party, Beach & Backyard for Adults-Green",N/A,$41.99,,4.8,21.0,False,https://m.media-amazon.com/images/I/810ng5S70iL._AC_UL320_.jpg,https://m.media-amazon.com/images/I/810ng5S70iL._AC_SL1500_.jpg,,2026-04-23T12:05:14.608028,
10,5,Organic,,197.0,B0FT8M249C,"Tic-Tac-Toe Pool Toys Games Set, Inflatable Giant Pool Tic-Tac-Toe Game Float with 10 Balls, 2-10 Players Floating Pool Toys for Kids, Fun Pool Games Party Beach Toy for Teens Adults & Family",N/A,$29.99,,4.8,10.0,False,https://m.media-amazon.com/images/I/81eAbdFyVFL._AC_UL320_.jpg,https://m.media-amazon.com/images/I/81eAbdFyVFL._AC_SL1500_.jpg,,2026-04-23T12:05:14.613096,
11,5,Organic,,198.0,B083LGBVGW,"BigMouth Inc. Giant Retro Pool Float, Blow Up Pool Raft, Over 5 Feet Long, Durable Inflatable Summer Party Water Toy",N/A,$35.49,,4.5,192.0,False,https://m.media-amazon.com/images/I/71L-QMEhkzL._AC_UL320_.jpg,https://m.media-amazon.com/images/I/71L-QMEhkzL._AC_SL1500_.jpg,,2026-04-23T12:05:14.617215,
12,5,Organic,,199.0,B0DRP1DYD4,Jasonwell Pool Float with Canopy - Inflatable Pool Floaties Adult Floating Pool Chair Lounge Floats for Swimming Pool Water Chair Pool Lounger with Cup Holders Pool Toy Party Floaty for Adult,N/A,$21.99,,4.3,400.0,False,https://m.media-amazon.com/images/I/810Pe8BQIqL._AC_UL320_.jpg,https://m.media-amazon.com/images/I/810Pe8BQIqL._AC_SL1500_.jpg,,2026-04-23T12:05:14.625385,
13,5,Organic,,200.0,B0DFK9BDTJ,"Aqua Inflatable Tanning Pool Lounger, Premium Pool Float with Cupholders and Removeable Pillow for Relaxation and Fun",N/A,$35.97,,4.5,262.0,False,https://m.media-amazon.com/images/I/81MPqI0BGtL._AC_UL320_.jpg,https://m.media-amazon.com/images/I/81MPqI0BGtL._AC_SL1500_.jpg,,2026-04-23T12:05:14.630169,
14,5,Organic,,201.0,B0CYJ7FCLY,NPW Drinking Buddies Hunky Chad Inflatable Pool Ring – Lifeguard Pool Float for Summer Pool Parties & Bachelorette,N/A,$29.99,,4.1,37.0,False,https://m.media-amazon.com/images/I/71zOhNUlTVL._AC_UL320_.jpg,https://m.media-amazon.com/images/I/71zOhNUlTVL._AC_SL1500_.jpg,,2026-04-23T12:05:14.634968,
15,5,Organic,,202.0,B09MVTKMXZ,Jasonwell Inflatable Pool Float Chair - 2 Pack Pool Floaties Chair Floats Loungers for Swimming Pools Floating Lounger with Cup Holders Toy Party Floaties for Adults L,N/A,$24.97,,4.3,3764.0,False,https://m.media-amazon.com/images/I/71FOwmXGahL._AC_UL320_.jpg,https://m.media-amazon.com/images/I/71FOwmXGahL._AC_SL1500_.jpg,,2026-04-23T12:05:14.644037,
16,5,Organic,,203.0,B07NCZXTSN,"BigMouth Inc. Melting Ice Cream Pool Float, Thick Vinyl Swimming Tube, 4 feet Wide, Holds 200 Pounds and Includes Patch Kit",N/A,$24.99,,4.6,69.0,False,https://m.media-amazon.com/images/I/71SmWpFfv-L._AC_UL320_.jpg,https://m.media-amazon.com/images/I/71SmWpFfv-L._AC_SL1500_.jpg,,2026-04-23T12:05:14.647487,
17,5,Organic,,204.0,B00HIWWDGM,"INTEX Wave Rider Inflatable Pool Float: Pool Toy For Kids – Heavy-Duty Handle – 88lb Weight Capacity – 46"" x 30.5"" – For Ages 3+",N/A,$19.09,,4.5,3300.0,False,https://m.media-amazon.com/images/I/71DoHUA67ML._AC_UL320_.jpg,https://m.media-amazon.com/images/I/71DoHUA67ML._AC_SL1500_.jpg,,2026-04-23T12:05:14.651200,
18,5,Organic,,205.0,B0DSLD69BP,"PuppyuWill 2 Pack Pool Floats Adult, Inflatable Pool Lounger Float Heavy Duty with Cup Holder, Backrest & Footrest Pool Lounge Float Extra Large Pool Rafts for Adults Beach Lake Party",N/A,$29.99,,4.5,324.0,False,https://m.media-amazon.com/images/I/81hrJAPWRBL._AC_UL320_.jpg,https://m.media-amazon.com/images/I/81hrJAPWRBL._AC_SL1500_.jpg,,2026-04-23T12:05:14.654760,
19,5,Organic,,206.0,B0G582MQ45,"Inflatable Pool Float Chair - Pool Floats Adult Heavy Duty, Water Floating Lounge Chairs, Blow up Floaties Adults for Summer Fun Party Lake Beach",N/A,$19.99,,4.2,39.0,False,https://m.media-amazon.com/images/I/71yzlbkGR6L._AC_UL320_.jpg,https://m.media-amazon.com/images/I/71yzlbkGR6L._AC_SL1500_.jpg,,2026-04-23T12:05:14.659679,
20,5,Organic,,207.0,B081JF35Z9,"FindUWill 6 Pack Pool Floats Kids, Pool Swim Tubes Rings(4 Pack) - 4Pcs Inflatable Big Floaties Beach Swimming Toys with 2Pcs Beach Balls for Adults Raft Floaties Toddlers",N/A,$18.99,,4.3,3055.0,False,https://m.media-amazon.com/images/I/71c+qvQehmL._AC_UL320_.jpg,https://m.media-amazon.com/images/I/71c+qvQehmL._AC_SL1500_.jpg,,2026-04-23T12:05:14.662712,
21,5,Organic,,208.0,B0DQG6CC1N,"6 Pack Inflatable Pool Floats Adult Size Water Hammock,Water Floaties for Adults,4-in-1 Multi-Purpose Pool Floating Toys,Pool Rafts Lounge Chairs Floaties,for Adults Vacation Fun and Rest",N/A,$29.99,,4.4,209.0,False,https://m.media-amazon.com/images/I/813y80uZ2cL._AC_UL320_.jpg,https://m.media-amazon.com/images/I/813y80uZ2cL._AC_SL1500_.jpg,,2026-04-23T12:05:14.667222,
22,5,Organic,,209.0,B0GFKMD5RG,"Jasonwell Floating Island Pool Float - Giant Inflatable Multi Person Pool Party Floats Swimming Pool Lounger Raft with Cup Holders Lake Floaties Beach Relaxation Water Float for Adults (Blue, XL)",N/A,$49.98,,4.2,112.0,False,https://m.media-amazon.com/images/I/81SgT7WAtML._AC_UL320_.jpg,https://m.media-amazon.com/images/I/81SgT7WAtML._AC_SL1500_.jpg,,2026-04-23T12:05:14.676607,
23,5,Organic,,210.0,B0CP2BHXBM,"Moko Inflatable Swimming Rings, Pool Floats Swim Tubes Rings Round Shape Cute Cartoon Design Beach Water Lounge Inflatable Raft Party Supplies for Kids",N/A,$9.49,,4.4,258.0,False,https://m.media-amazon.com/images/I/71RqkBJyUhL._AC_UL320_.jpg,https://m.media-amazon.com/images/I/71RqkBJyUhL._AC_SL1500_.jpg,,2026-04-23T12:05:14.680676,
24,5,Organic,,211.0,B09JWZ2819,"Triumpeek Inflatable Cactus Cooler, 55"" Fiesta Cactus Ice Bucket Wearing Sombreros for Summer Swimming Pool Hawaiian Themed Party Supplies",N/A,$19.99,,4.6,829.0,False,https://m.media-amazon.com/images/I/71dXIIKJn5L._AC_UL320_.jpg,https://m.media-amazon.com/images/I/71dXIIKJn5L._AC_SL1500_.jpg,,2026-04-23T12:05:14.685517,
25,5,Organic,,212.0,B0BR5YS82C,"COOLCOOLDEE Pool Float with Canopy, Cup Holder - XL Pool Chair Lounge Float with Adjustable Sun Shade Cover, Drink Holder, Ergonomic Headrest,Inflatable Pool Float for Adults",N/A,$28.99,,4.3,1567.0,False,https://m.media-amazon.com/images/I/81P6H15P0OL._AC_UL320_.jpg,https://m.media-amazon.com/images/I/81P6H15P0OL._AC_SL1500_.jpg,,2026-04-23T12:05:14.689301,
26,5,Organic,,213.0,B0CPHSJWRW,"Inflatable Zebra Pool Float with Lights, FlyfreeU Solar Swimming Pool Floats, Large Lake Floats Beach Water Floaty with Fast Valves, Glow in the Dark Thick Pool Floaties for Adults",N/A,$28.99,,4.5,146.0,False,https://m.media-amazon.com/images/I/71W3ZgD4d5L._AC_UL320_.jpg,https://m.media-amazon.com/images/I/71W3ZgD4d5L._AC_SL1500_.jpg,,2026-04-23T12:05:14.692681,
27,5,Organic,,214.0,B0DLRNTP5F,"FindUWill Pool Floats with Water Guns Kids, Inflatable Pool Swim Tubes with Beach Ball, Pool Floaties Toys Inner Tube with Squirt Guns for Kids Ages 8-12, Beach Swimming Party Toys for Adults",N/A,$18.04,,4.2,151.0,False,https://m.media-amazon.com/images/I/81HMU3HXZvL._AC_UL320_.jpg,https://m.media-amazon.com/images/I/81HMU3HXZvL._AC_SL1500_.jpg,,2026-04-23T12:05:14.696106,
