data_index,page,ad_type,ad_rank,organic_rank,asin,title,url,price_current,price_list,rating_stars,rating_count,is_prime,image_small,image_large,brand_name,scraped_at,inner_products_count
0,1,SB_Video,1.0,,,N/A,N/A,,,,,False,,,,2026-04-23T12:04:07.957970,6.0
1,1,Title,,,,ResultsCheck each product page for other buying options. Price and other details may vary based on p,,,,,,False,,,,2026-04-23T12:04:07.959389,
3,1,SP,1.0,,B0DZP1CXKD,"QPAU Inflatable Tank Pool Float for Adults & Kids – Ride-On Camouflage Floaty with Water Cannon, Swim Raft Toy for Boys Girls, Lake Beach Backyard Party Floaties",N/A,$33.99,,4.5,434.0,False,https://m.media-amazon.com/images/I/71fcZTS-+SL._AC_UL320_.jpg,https://m.media-amazon.com/images/I/71fcZTS-+SL._AC_SL1500_.jpg,,2026-04-23T12:04:07.963592,
4,1,SP,2.0,,B0DSPWP99T,"5 Pack Inflatable Pool Floats, OKSUWATER 4-in-1 Water Hammock, Pool Floats Adult Size for Swimming Pool Party Summer Lake Water Fun (5 Pack-Multicolor)",N/A,$21.98,,4.7,421.0,False,https://m.media-amazon.com/images/I/819XdTCgKcL._AC_UL320_.jpg,https://m.media-amazon.com/images/I/819XdTCgKcL._AC_SL1500_.jpg,,2026-04-23T12:04:07.968327,
5,1,SP,3.0,,B07NX2V91X,"JOYIN 2-Pack Flamingo Unicorn Pool Float - Fun Floaties Inflatable Swimming Pool Tubes Toys Party Decorations, Summer Vacation Lake Beach Floaty Swim Rings Raft Lounger for Adults & Kids",N/A,$22.99,,4.4,3221.0,False,https://m.media-amazon.com/images/I/81U1c+sU5FL._AC_UL320_.jpg,https://m.media-amazon.com/images/I/81U1c+sU5FL._AC_SL1500_.jpg,,2026-04-23T12:04:07.971479,
6,1,SP,4.0,,B076H9CX6D,"JOYIN Giant Inflatable Pizza Slice Pool Float, Fun Pool Floaties, Swim Party Toy, Summer Pool Raft (1 Pack), Extra Large with Cup Holders",N/A,$29.99,,4.5,1875.0,False,https://m.media-amazon.com/images/I/81IKLCCWhOL._AC_UL320_.jpg,https://m.media-amazon.com/images/I/81IKLCCWhOL._AC_SL1500_.jpg,,2026-04-23T12:04:07.974548,
7,1,Organic,,1.0,B0CM6V3CPF,Sloosh Inflatable Banana Pool Float - Ride on Banana Pool Floats Funny Swimming Pool Party Decorations,N/A,$19.99,,3.9,101.0,False,https://m.media-amazon.com/images/I/51whRt5TgQL._AC_UL320_.jpg,https://m.media-amazon.com/images/I/51whRt5TgQL._AC_SL1500_.jpg,,2026-04-23T12:04:07.977942,
8,1,Organic,,2.0,B0BRB6XJQL,Inflatable Unicorn Flamingo Pool Floats - Jasonwell 2 Pack Pool Floaties Inflatables Rafts for Swimming Pool Tubes for Floating Lake Beach Floaty Swim Rings Pool Party Toys for Adults Kids,N/A,$24.97,,4.6,2353.0,False,https://m.media-amazon.com/images/I/61CCCFzdKAL._AC_UL320_.jpg,https://m.media-amazon.com/images/I/61CCCFzdKAL._AC_SL1500_.jpg,,2026-04-23T12:04:07.989066,
9,1,Organic,,3.0,B0DC13QBNZ,"Giant Pop-Tarts Extra Large Inflatable Pool Float for Pool Playing, Over 5.5 Feet Long, Lounging and Party",N/A,$14.96,,4.5,169.0,False,https://m.media-amazon.com/images/I/81lyoKLlb1L._AC_UL320_.jpg,https://m.media-amazon.com/images/I/81lyoKLlb1L._AC_SL1500_.jpg,,2026-04-23T12:04:07.992785,
11,1,Title,,,,Debug info copied.Sponsored[Upgraded Log Rafts] 4 Pcs Jumbo Inflatable Battle Log Pool Game - 2 Play,,,,,,False,,,,2026-04-23T12:04:07.993700,
12,1,Title,,,,Relax in Style with FUNBOY's Tube FloatSponsored|Top 10 best-selling brand in this category|Shop FUN,,,,,,False,,,,2026-04-23T12:04:07.995220,
13,1,Title,,,,More results,,,,,,False,,,,2026-04-23T12:04:07.995441,
14,1,Organic,,4.0,B0BWYM8LB5,"Jasonwell Inflatable Tank Swimming Pool Floaties with Water Cannon Gun Swim Floaty Rafts for Lake, Beach & Pool Party Toys for Boys, Girls, Kids & Adults- Green",N/A,$35.99,,4.3,1559.0,False,https://m.media-amazon.com/images/I/814lFySmUsL._AC_UL320_.jpg,https://m.media-amazon.com/images/I/814lFySmUsL._AC_SL1500_.jpg,,2026-04-23T12:04:08.005114,
15,1,Organic,,5.0,B07SGZNWB7,"RITONS 4 Pcs Set Inflatable Floating Row Toys, Adult 12 Year Above Pool Party Water Sports Games Log Rafts to Float Toys",N/A,$21.95,,3.6,1147.0,False,https://m.media-amazon.com/images/I/71kgLBCFWiL._AC_UL320_.jpg,https://m.media-amazon.com/images/I/71kgLBCFWiL._AC_SL1500_.jpg,,2026-04-23T12:04:08.009025,
16,1,Organic,,6.0,B07NX2V91X,"JOYIN 2-Pack Flamingo Unicorn Pool Float - Fun Floaties Inflatable Swimming Pool Tubes Toys Party Decorations, Summer Vacation Lake Beach Floaty Swim Rings Raft Lounger for Adults & Kids",N/A,$22.99,,4.4,3221.0,False,https://m.media-amazon.com/images/I/81U1c+sU5FL._AC_UL320_.jpg,https://m.media-amazon.com/images/I/81U1c+sU5FL._AC_SL1500_.jpg,,2026-04-23T12:04:08.012414,
17,1,SP,5.0,,B0GKQ5PP4G,"3 Pack Pool Floats Adult, SEETOHOME Inflatable Pool Float Chairs with Cup Holder, Pool Floaties for Adults, Lake Floats Perfect for Pool, Lake, River, Beach, Summer Vacation & Water Party",N/A,$29.99,,4.7,18.0,False,https://m.media-amazon.com/images/I/817TSmAn7fL._AC_UL320_.jpg,https://m.media-amazon.com/images/I/817TSmAn7fL._AC_SL1500_.jpg,,2026-04-23T12:04:08.016671,
18,1,SP,6.0,,B0G8ZT3S88,"Pool Basketball Hoop, Floating Pool Toy for 3 4 5 6 7 8 9 Years Old Kids Ring Game with 4 Balls 8 Rings & Pump Outdoor Swimming Pool Basketball Games Water Play Toy Family Party for Kids Adults",N/A,$37.99,,4.6,18.0,False,https://m.media-amazon.com/images/I/71IlmkfkLXL._AC_UL320_.jpg,https://m.media-amazon.com/images/I/71IlmkfkLXL._AC_SL1500_.jpg,,2026-04-23T12:04:08.020497,
19,1,SP,7.0,,B0GJNSYV12,3Pcs Large Inflatable Pool Float with Handles Fruit Swim Rings Swimming Pool Tubes for Teens Pool Rings Summer Beach Themed Party,N/A,$25.98,,5.0,1.0,False,https://m.media-amazon.com/images/I/71NZcPWtUVL._AC_UL320_.jpg,https://m.media-amazon.com/images/I/71NZcPWtUVL._AC_SL1500_.jpg,,2026-04-23T12:04:08.024186,
20,1,SP,8.0,,B0GDWN9W3C,2 PCS Large 35 inch Inflatable Pool Floats for Swimming Pool Party Lake Beach Adults -Striped Floaties Pool Tubes Swim Rings Tubes Floaties for Beach Pool Party Decorations,N/A,$22.98,,4.3,5.0,False,https://m.media-amazon.com/images/I/61zdqYAjIaL._AC_UL320_.jpg,https://m.media-amazon.com/images/I/61zdqYAjIaL._AC_SL1500_.jpg,,2026-04-23T12:04:08.029124,
21,1,Organic,,7.0,B0FMR9M4LC,Sloosh Inflatable Pool Float Battle Game Set for Kids Adults-Includes 2 Giant Ride On Pool Toy Kitten & Puppy for Outdoor Swimming Party Family Activities,N/A,$55.99,,4.7,11.0,False,https://m.media-amazon.com/images/I/91NIoxB9QuL._AC_UL320_.jpg,https://m.media-amazon.com/images/I/91NIoxB9QuL._AC_SL1500_.jpg,,2026-04-23T12:04:08.032928,
22,1,Organic,,8.0,B083J1CV1C,"MorTime Inflatable Roller Float, 40'' Colorful Water Wheel, Swimming Pool Roller Toy for Kids and Adults Outdoors",N/A,$24.99,,3.6,1185.0,False,https://m.media-amazon.com/images/I/81qB7RWnMgL._AC_UL320_.jpg,https://m.media-amazon.com/images/I/81qB7RWnMgL._AC_SL1500_.jpg,,2026-04-23T12:04:08.036854,
23,1,Organic,,9.0,B0832FP267,Jasonwell Inflatable Dinosaur Swimming Pool Float for Kids Boys Girls Adults 124'' Giant Tyrannosaurus Rex Floatie Summer Beach Ride on Party Pool Raft Lounge Toys,N/A,$29.98,,4.5,2930.0,False,https://m.media-amazon.com/images/I/61wjNn2rCRL._AC_UL320_.jpg,https://m.media-amazon.com/images/I/61wjNn2rCRL._AC_SL1500_.jpg,,2026-04-23T12:04:08.047282,
24,1,Organic,,10.0,B0BKTLNSLG,"SLOOSH Inflatable Pool Floats Adult,2 Packs Floating Lounge Chairs,Blow up Pool Noodles for Adult Heavy Duty,Floating Chair for Party Summer Water Beach Lake Fun",N/A,$29.98,,4.3,4694.0,False,https://m.media-amazon.com/images/I/91bpiQBEqyL._AC_UL320_.jpg,https://m.media-amazon.com/images/I/91bpiQBEqyL._AC_SL1500_.jpg,,2026-04-23T12:04:08.051779,
25,1,SP,9.0,,B0GKYJ2H4S,"Pool Toy Set for Kids, Tic-Tac-Toe Pool Floats Fun Toy Kit for Adults Teens, Water Fun Pool Game Accessories for Outdoor Party, Summer Pool Inflatables Stuff",N/A,$29.99,,5.0,8.0,False,https://m.media-amazon.com/images/I/91-RrqlBUeL._AC_UL320_.jpg,https://m.media-amazon.com/images/I/91-RrqlBUeL._AC_SL1500_.jpg,,2026-04-23T12:04:08.054844,
26,1,SP,10.0,,B0DP6ZZ86F,"2 Pack Inflatable Pool Floats Chair Adult, American Flag Pool Lounge Chairs with Cup Holders & Backrest,Blow Up Patriotic Pool Floaties for 4th of July Party,250th Anniversary,Summer Beach Lake Party",N/A,$28.15,,4.6,23.0,False,https://m.media-amazon.com/images/I/81aT8iqVjSL._AC_UL320_.jpg,https://m.media-amazon.com/images/I/81aT8iqVjSL._AC_SL1500_.jpg,,2026-04-23T12:04:08.058178,
27,1,SP,11.0,,B0DSPWPH4C,"4 Pack Inflatable Pool Floats, OKSUWATER 4-in-1 Water Hammock, Pool Floats Adult Size for Swimming Pool Party Summer Lake Water Fun",N/A,$19.99,,4.7,553.0,False,https://m.media-amazon.com/images/I/81Kk-xDIdeL._AC_UL320_.jpg,https://m.media-amazon.com/images/I/81Kk-xDIdeL._AC_SL1500_.jpg,,2026-04-23T12:04:08.062960,
28,1,SP,12.0,,B0GM7X8ZD7,4 Pack Pool Floats for Adults and Teens Large Donut Pool Float-36 inch Doughnut Pool Floaties Pool Tubes Swim Rings Tubes Floaties for Beach Pool Party Decorations,N/A,$24.98,,4.7,7.0,False,https://m.media-amazon.com/images/I/71QIsixnmaL._AC_UL320_.jpg,https://m.media-amazon.com/images/I/71QIsixnmaL._AC_SL1500_.jpg,,2026-04-23T12:04:08.066889,
29,1,Organic,,11.0,B0BR4YJN4P,Jasonwell Inflatable Avocado Pool Float Floatie with Ball Water Fun Large Blow Up Summer Beach Swimming Floaty Party Toys Lounge Raft for Adults (L),N/A,$19.99,,4.3,9115.0,False,https://m.media-amazon.com/images/I/61JqR5l2GaL._AC_UL320_.jpg,https://m.media-amazon.com/images/I/61JqR5l2GaL._AC_SL1500_.jpg,,2026-04-23T12:04:08.079181,
30,1,Organic,,12.0,B0BW83TD8Q,"Inflatable Swan Pool Floats with Colorful Lights, FlyfreeU Solar LED Color Changing Swan Swim Tube Rings, 42 Inch Large Pool Beach Floaties Lake Beach Floaty Summer Pool Raft Lounge for Adults",N/A,$31.99,,4.4,723.0,False,https://m.media-amazon.com/images/I/718CqHrM6vL._AC_UL320_.jpg,https://m.media-amazon.com/images/I/718CqHrM6vL._AC_SL1500_.jpg,,2026-04-23T12:04:08.083824,
31,1,Organic,,13.0,B083B6KZQB,"JOYIN Giant Boat Float with Cooler - Inflatable Boat Funny Pool Floats Raft with Reinforced Cooler, Lounge Floaties Beach Lake Toys Fun in Summer Swimming Pool Party Decorations for Kids & Adults",N/A,$37.99,,4.1,1779.0,False,https://m.media-amazon.com/images/I/91Or2PF1x+L._AC_UL320_.jpg,https://m.media-amazon.com/images/I/91Or2PF1x+L._AC_SL1500_.jpg,,2026-04-23T12:04:08.089379,
32,1,Title,,,,More results,,,,,,False,,,,2026-04-23T12:04:08.090382,
33,1,Organic,,14.0,B076H9CX6D,"JOYIN Giant Inflatable Pizza Slice Pool Float, Fun Pool Floaties, Swim Party Toy, Summer Pool Raft (1 Pack), Extra Large with Cup Holders",N/A,$29.99,,4.5,1875.0,False,https://m.media-amazon.com/images/I/81IKLCCWhOL._AC_UL320_.jpg,https://m.media-amazon.com/images/I/81IKLCCWhOL._AC_SL1500_.jpg,,2026-04-23T12:04:08.095567,
34,1,Organic,,15.0,B0DC12L24R,"Giant Cheez-It Pool Float – Extra Large Inflatable Snack Shaped Floatie for Pool, Beach & Lake, Durable Vinyl, Over 4.5 Feet, Perfect for Lounging, Summer Parties, 4th of July Pool Party",N/A,$23.49,,4.5,171.0,False,https://m.media-amazon.com/images/I/81XCL0bMkLL._AC_UL320_.jpg,https://m.media-amazon.com/images/I/81XCL0bMkLL._AC_SL1500_.jpg,,2026-04-23T12:04:08.101330,
35,1,Organic,,16.0,B0DC157CWM,"Uno™ Pool Float – Giant Inflatable Reverse Card, Floatie for Pool, Beach & Lake, Durable Vinyl Raft, 6 Feet Tall, Perfect for Lounging & Summer Fun",N/A,$23.49,,4.3,122.0,False,https://m.media-amazon.com/images/I/81A3y7YqEYL._AC_UL320_.jpg,https://m.media-amazon.com/images/I/81A3y7YqEYL._AC_SL1500_.jpg,,2026-04-23T12:04:08.106796,
36,1,Organic,,17.0,B000030000,INTEX Inflatable Pool Float: Pool Toy for Kids,N/A,$23.77,,4.5,23889.0,False,https://m.media-amazon.com/images/I/81cNOujV5nL._AC_UL320_.jpg,https://m.media-amazon.com/images/I/81cNOujV5nL._AC_SL1500_.jpg,,2026-04-23T12:04:08.110807,
37,1,Organic,,18.0,B091BLK8FB,"SLOOSH 60"" Inflatable Gummy Bear Pool Floats - Fun Floaties Swimming Pool Float Toys Party Decorations, Beach Vacation Essentials Lounge Water Raft Cute Birthday Party Decor",N/A,$22.99,,4.2,257.0,False,https://m.media-amazon.com/images/I/81gMQdQL2eL._AC_UL320_.jpg,https://m.media-amazon.com/images/I/81gMQdQL2eL._AC_SL1500_.jpg,,2026-04-23T12:04:08.114398,
38,1,Organic,,19.0,B0CL9Q7DBR,"POZA Inflatable Duck Pool Float Tube- Heavy Duty Vinyl UV Resistant Confetti Pool Duck Floatie, Animal Pool Float Swim Ring Pool Inflatables for Kids and Adults for Beach, Party, Vacation",N/A,$22.99,,4.5,160.0,False,https://m.media-amazon.com/images/I/71x2SvWU8dL._AC_UL320_.jpg,https://m.media-amazon.com/images/I/71x2SvWU8dL._AC_SL1500_.jpg,,2026-04-23T12:04:08.120388,
39,1,Organic,,20.0,B00HIWL37M,"GoPong Pool Lounge Beer Pong Inflatable with Social Floating, White",N/A,$31.99,,4.6,4920.0,False,https://m.media-amazon.com/images/I/71rmRKZuuCL._AC_UL320_.jpg,https://m.media-amazon.com/images/I/71rmRKZuuCL._AC_SL1500_.jpg,,2026-04-23T12:04:08.124734,
40,1,Organic,,21.0,B083B979JB,"JOYIN Donut Pool Float with Glitters 32.5” (3 Pack), Funny Tube Toys for Swimming Pool Party and Donut Party Supplies",N/A,$18.99,,4.6,8373.0,False,https://m.media-amazon.com/images/I/81FyoqB99pL._AC_UL320_.jpg,https://m.media-amazon.com/images/I/81FyoqB99pL._AC_SL1500_.jpg,,2026-04-23T12:04:08.128249,
41,1,Organic,,22.0,B0832KKKQX,Jasonwell Inflatable Shark Pool Float Shark Floaties Water Fun Summer Beach Swimming Pool Tube Inflatables Ride on Pool Party Raft Lounge Toys for Kids & Adults,N/A,$17.99,,4.5,3199.0,False,https://m.media-amazon.com/images/I/511luQEjI8L._AC_UL320_.jpg,https://m.media-amazon.com/images/I/511luQEjI8L._AC_SL1500_.jpg,,2026-04-23T12:04:08.138262,
42,1,Organic,,23.0,B07BMM7JY8,Jasonwell Giant Inflatable Unicorn Pool Float Floatie Ride On with Fast Valves Large Rideable Blow Up Summer Beach Swimming Pool Party Lounge Raft Decorations Toys for Kids Adults,N/A,$29.98,,4.4,10350.0,False,https://m.media-amazon.com/images/I/81ERroLL9HL._AC_UL320_.jpg,https://m.media-amazon.com/images/I/81ERroLL9HL._AC_SL1500_.jpg,,2026-04-23T12:04:08.146799,
43,1,Organic,,24.0,B072RCCHKL,"BigMouth Inc. Giant Balloon Animal Pool Float, Over 4' Wide, Fun Inflatable Floatie Tube, Blow Up Swim Ring, Outdoor Summer Pool Party Water Toy",N/A,$44.99,,4.2,643.0,False,https://m.media-amazon.com/images/I/71wQzczlnjL._AC_UL320_.jpg,https://m.media-amazon.com/images/I/71wQzczlnjL._AC_SL1500_.jpg,,2026-04-23T12:04:08.150716,
44,1,Organic,,25.0,B0721468V1,"JOYIN Inflatable Swim Tube Raft (3 pack) with Summer Fruits Painting, Pool Toys for Swimming Pool Party Decorations",N/A,$16.99,,4.6,8373.0,False,https://m.media-amazon.com/images/I/71cpqrIteIL._AC_UL320_.jpg,https://m.media-amazon.com/images/I/71cpqrIteIL._AC_SL1500_.jpg,,2026-04-23T12:04:08.156095,
45,1,Organic,,26.0,B0C946BBSW,"JUXIAO 5 Pack Upgrated XL Water Pool Floats, 4-in-1 (Hammock, Saddle, Lounge Chair, Drifter) Multi-Purpose Water Pool Float, Non-Stick PVC Material",N/A,$18.99,,4.4,1824.0,False,https://m.media-amazon.com/images/I/81yjIffjrOL._AC_UL320_.jpg,https://m.media-amazon.com/images/I/81yjIffjrOL._AC_SL1500_.jpg,,2026-04-23T12:04:08.160992,
46,1,Organic,,27.0,B0BR5NLF9P,"Jasonwell 4 in 1 Inflatable Tanning Pool Lounger Float - Sunbathing Lounge Floatie Raft Toys, Water Filled Tanning Bed Mat Pad Blow Up Kiddie Pool with Ball Pit for Adult, Kids (L)",N/A,$29.97,,4.3,8384.0,False,https://m.media-amazon.com/images/I/71goaDpLYxL._AC_UL320_.jpg,https://m.media-amazon.com/images/I/71goaDpLYxL._AC_SL1500_.jpg,,2026-04-23T12:04:08.177423,
47,1,Organic,,28.0,B08V52LJV1,"Sloosh 4 Pack Inflatable Pool Floats, Pool Tube Rings, Swim Tubes, Floaties Toys, Beach Swimming Party Toys for Kids and Adults",N/A,$21.99,,4.6,2477.0,False,https://m.media-amazon.com/images/I/91aIykErXJL._AC_UL320_.jpg,https://m.media-amazon.com/images/I/91aIykErXJL._AC_SL1500_.jpg,,2026-04-23T12:04:08.181732,
48,1,Organic,,29.0,B000OV0X4S,"INTEX 58859EP Sit 'N Float Inflatable Pool Float: Pool Lounge with Built-in Cup Holders – Heavy-Duty Handles – 220lb Weight Capacity – 58"" x 39"" – Colors May Vary",N/A,$15.98,,4.0,13609.0,False,https://m.media-amazon.com/images/I/710iUI8W+6L._AC_UL320_.jpg,https://m.media-amazon.com/images/I/710iUI8W+6L._AC_SL1500_.jpg,,2026-04-23T12:04:08.187544,
49,1,Organic,,30.0,B07D1BXF7K,"JOYIN Inflatable Peacock Pool Float - Giant Peacock Fun Beach Floaties, Pool Party Decorations Adult Size Inflatable Animal Summer Swim Pool Raft Lounge for Adults",N/A,$39.99,,4.2,2282.0,False,https://m.media-amazon.com/images/I/81qsCKH2STL._AC_UL320_.jpg,https://m.media-amazon.com/images/I/81qsCKH2STL._AC_SL1500_.jpg,,2026-04-23T12:04:08.192121,
50,1,Organic,,31.0,B08QCBFL3C,"TURNMEON Giant Flamingo Pool Float, Inflatable Summer Beach Swimming Raft Lounge Ride-on Water Pool Floatie for Adults Kids Lake Beach Float Pool Party Toys, Flamingo/Unicorn",N/A,$20.69,,4.3,942.0,False,https://m.media-amazon.com/images/I/71Bw8ZU9ptL._AC_UL320_.jpg,https://m.media-amazon.com/images/I/71Bw8ZU9ptL._AC_SL1500_.jpg,,2026-04-23T12:04:08.196928,
51,1,Organic,,32.0,B08QCF94X4,"TURNMEON 102"" Giant Flamingo Pool Float Inflatable Summer Beach Float Swimming Pool Party Toys Ride-on Lounge Raft Water Pool Floatie for 2-4 Multi Players Adults Lake Floats, Flamingo",N/A,$26.99,,4.0,829.0,False,https://m.media-amazon.com/images/I/71FArcVXpFL._AC_UL320_.jpg,https://m.media-amazon.com/images/I/71FArcVXpFL._AC_SL1500_.jpg,,2026-04-23T12:04:08.202088,
52,1,Organic,,33.0,B00BXVI1EM,"Swimline Giant Inflatable Baseball Glove Pool Float , Brown, 62""/50""/16""",N/A,$28.25,,4.0,4732.0,False,https://m.media-amazon.com/images/I/71W6Lqo-nLL._AC_UL320_.jpg,https://m.media-amazon.com/images/I/71W6Lqo-nLL._AC_SL1500_.jpg,,2026-04-23T12:04:08.208292,
53,1,Organic,,34.0,B0CCW6WLJ9,"SwimWays Spring Float Premium Recliner Pool Lounger, Inflatable Pool Floats Adult with Fast Inflation for Ages 15 & Up, Sky Blue",N/A,$39.99,,4.5,13262.0,False,https://m.media-amazon.com/images/I/81n68B7MJuL._AC_UL320_.jpg,https://m.media-amazon.com/images/I/81n68B7MJuL._AC_SL1500_.jpg,,2026-04-23T12:04:08.213333,
54,1,Organic,,35.0,B09S1D8Q7P,"Giant Inflatable Pickle - 36-Inch-Tall Funny Pickle Gifts, Durable and Fun Pickle Party Favors, Food Decor, Novelty Gag Prank, Joke Birthday Gifts or Beach and Pool Float Inflatable Toys",N/A,$9.99,,4.6,217.0,False,https://m.media-amazon.com/images/I/81yxRAdyOFL._AC_UL320_.jpg,https://m.media-amazon.com/images/I/81yxRAdyOFL._AC_SL1500_.jpg,,2026-04-23T12:04:08.221453,
55,1,Organic,,36.0,B08QCHZY21,"TURNMEON 102"" Giant Unicorn Pool Float Inflatable Summer Beach Float Swimming Pool Party Toys Ride-on Lounge Raft Water Pool Floatie for 2-4 Multi Players Adults Lake Floats, Flamingo/Unicorn",N/A,$25.59,,4.3,942.0,False,https://m.media-amazon.com/images/I/71XyfwB8VaL._AC_UL320_.jpg,https://m.media-amazon.com/images/I/71XyfwB8VaL._AC_SL1500_.jpg,,2026-04-23T12:04:08.227290,
56,1,Organic,,37.0,B07BCKDWX8,Intex Sprinkle Donut Tube,N/A,$12.90,,4.6,819.0,False,https://m.media-amazon.com/images/I/61gU6rj0DCL._AC_UL320_.jpg,https://m.media-amazon.com/images/I/61gU6rj0DCL._AC_SL1500_.jpg,,2026-04-23T12:04:08.231999,
57,1,Organic,,38.0,B0DSVHC33N,"Inflatable Tanning Pool Lounger Float with Sprinkler, 77"" x 48"" Pool Floats Adult with Pillow, 6 in 1 Suntan Tub Raft Floatie with Drink Holder Sunbathing Water Lounge",N/A,$29.99,,4.4,925.0,False,https://m.media-amazon.com/images/I/91PrsI9Qz7L._AC_UL320_.jpg,https://m.media-amazon.com/images/I/91PrsI9Qz7L._AC_SL1500_.jpg,,2026-04-23T12:04:08.237324,
58,1,Organic,,39.0,B09T9B3LDJ,"Sloosh 2-Pack Inflatable Dinosaur & Peacock Pool Floats Set, Fun Beach Floaties for Swim Party Decorations Toys, Inflatable Island, Summer Pool Raft Lounge Ride On for Adults Kids",N/A,$38.99,,4.4,147.0,False,https://m.media-amazon.com/images/I/71qqlLP1jYL._AC_UL320_.jpg,https://m.media-amazon.com/images/I/71qqlLP1jYL._AC_SL1500_.jpg,,2026-04-23T12:04:08.240861,
59,1,Organic,,40.0,B0BTY33KMY,"Zcaukya 65""/47"" Giant Inflatable Wheel Roller, Colorful Water Rolling Wheel Float for Kids Summer Swimming Pool Parties, Rolling on The Lawn, Indoor Outdoor Fun Toys for Games Supplies",N/A,$41.99,,4.1,260.0,False,https://m.media-amazon.com/images/I/917X7g018vL._AC_UL320_.jpg,https://m.media-amazon.com/images/I/917X7g018vL._AC_SL1500_.jpg,,2026-04-23T12:04:08.255783,
60,1,Organic,,41.0,B0006MY7FQ,"Swimline Sea-Saw Rocker , Yellow",N/A,$67.00,,3.0,612.0,False,https://m.media-amazon.com/images/I/616-pwxqQVL._AC_UL320_.jpg,https://m.media-amazon.com/images/I/616-pwxqQVL._AC_SL1500_.jpg,,2026-04-23T12:04:08.262450,
61,1,Organic,,42.0,B01N35V6VW,"BigMouth Inc. Pool Float, Large Lounge Raft, Durable Vinyl Floatie, Summer Pool Party Water Toy",N/A,$29.99,,4.4,452.0,False,https://m.media-amazon.com/images/I/712VDtWmqvL._AC_UL320_.jpg,https://m.media-amazon.com/images/I/712VDtWmqvL._AC_SL1500_.jpg,,2026-04-23T12:04:08.266636,
62,1,Title,,,,More results,,,,,,False,,,,2026-04-23T12:04:08.267226,
63,1,Organic,,43.0,B07L4N6KX5,Jasonwell Giant Inflatable Flamingo Pool Float with Fast Valves Summer Beach Swimming Pool Floatie Lounge Floating Raft Outdoor Party Decorations Toys for Adults (XL),N/A,$26.99,,4.2,3699.0,False,https://m.media-amazon.com/images/I/51KA8AE4S8L._AC_UL320_.jpg,https://m.media-amazon.com/images/I/51KA8AE4S8L._AC_SL1500_.jpg,,2026-04-23T12:04:08.278670,
64,1,Organic,,44.0,B0DP4JDZZH,"Inflatable Pool Games Volleyball Net Pool Float Set with 19"" Beach Ball, Lighthouse Design – Floating Swimming Water Sports Toys for Adults, Perfect for Summer Pool Party Supply (112""X26""X35"")",N/A,$18.61,,3.9,136.0,False,https://m.media-amazon.com/images/I/81ZVyeBYyCL._AC_UL320_.jpg,https://m.media-amazon.com/images/I/81ZVyeBYyCL._AC_SL1500_.jpg,,2026-04-23T12:04:08.284707,
65,1,Organic,,45.0,B0CLMHL64T,"SLOOSH Inflatable Tanning Pool Lounger Float, 70"" x 46"" Pool Floats Adult with Pillow, 4 in 1 Suntan Tub Raft Floatie,Sunbathing Bed Lounge for Water Blow Up Kids Ball Pit Party Gifts, L-Blue",N/A,$29.99,,4.5,5579.0,False,https://m.media-amazon.com/images/I/91kZZv8HV6L._AC_UL320_.jpg,https://m.media-amazon.com/images/I/91kZZv8HV6L._AC_SL1500_.jpg,,2026-04-23T12:04:08.291362,
66,1,Organic,,46.0,B0FL7V3KL6,"Funscape Kids Fun Pool Toys, Inflatable Dart Board Toss Water Game, Swimming Pool Floats, Beach Yard Outdoor Ball Play, Summer Party Birthday Gift 3 4 5 6 7 8 9 12 Yrs Boys Girls Teen Adult Family-Red",N/A,$29.99,,4.3,11.0,False,https://m.media-amazon.com/images/I/810YpenXbXL._AC_UL320_.jpg,https://m.media-amazon.com/images/I/810YpenXbXL._AC_SL1500_.jpg,,2026-04-23T12:04:08.294672,
67,1,Organic,,47.0,B0GGZCL9KX,"Pool Floats Adult, 3Pack/2Pack/1Pack Adjustable Heavy Duty Inflatable Pool Floats Chair, Portable Pool Float Lounger for Adults & Kids, Pool Floaties for Summer Pool Beach Lake Party Fun",N/A,$39.99,,4.8,11.0,False,https://m.media-amazon.com/images/I/81D41GeNV8L._AC_UL320_.jpg,https://m.media-amazon.com/images/I/81D41GeNV8L._AC_SL1500_.jpg,,2026-04-23T12:04:08.298109,
68,1,Organic,,48.0,B0F6N9STGQ,"DIMROM Floating Table for Pool with Cup Holders – Adult Pool Games with Waterproof Cards – Pool Float Games – Perfect for Party, Snacks, Drinks, Hot Tub & Summer Fun",N/A,$21.97,,4.4,78.0,False,https://m.media-amazon.com/images/I/81Ko75d5x3L._AC_UL320_.jpg,https://m.media-amazon.com/images/I/81Ko75d5x3L._AC_SL1500_.jpg,,2026-04-23T12:04:08.303368,
70,1,Title,,,,"Debug info copied.SponsoredInflatable Tic Tac Toe Pool Game Set – Pool Toys with 10 Balls, Fun for K",,,,,,False,,,,2026-04-23T12:04:08.304243,
71,1,Title,,,,Related searchesfun pool floats for adultspool toysfun pool toyspool gamesfun pool floats for kidsfu,,,,,,False,,,,2026-04-23T12:04:08.305631,
72,1,Title,,,,Previous123...7Next,,,,,,False,,,,2026-04-23T12:04:08.306189,
73,1,SB,1.0,,,N/A,https://aax-us-east-retail-direct.amazon.com/x/c/JHt-Tr2DL0NDu-4FvDTXPn8AAAGduIJX7gEAAAH2AQBvbm9fdHhuX2JpZDQgICBvbm9fdHhuX2ltcDEgICDba0DL/clv1c_ek-IBIHXFcbWDn2nI4trJ16WtD5jqoDmoFPTNlSj37Zb6z3_TsDD_8JvdXsztxOFveL6iwx6V19J-Qu3KSDoTaX0fTzJ7JSq6UtljFoGxK2ymnM7-u_CGW_q7rm1InSsv5J29unD7h-Rz_NOC6fcqED6oNid5pXYtrRAT3GtzqB3icaRXeUBRtq-8mwaLjxXKSUubnuL3oXO7mH3uwSTYCKpFfeXIDbE0x0rIts38VQdTJj-Zf4y7Qor6MaGc-fviScKmHF3-Dr9d_xKC15ScmloZ4oQTwyI20W3Zj6xOwVnQRdoIXgNlw5pmI1EEpmoeNvXLFayb_MuJFxs9gpsSdZnDb1p3iPQAD3VJNFNzmAZ5G4H_b1JKHJCGX7o7Mc28fGCxIUujU1jcU8fvQP3Ggzf11VSE2E3OeURXl9qIM-iFeHmMWQ0NWUiBtDumCaJL-MGvKT96LYvlR_yiFy8OUPOW5v0oph5U9Z3pA75rDrZGKJRY4QTTolRHrv3n-FWGRVrLpAEBLWvOq2YPassUOzqU2em4TpmOTU4482FNePdQPVdDqm1h61yy3ijeQqfQayP3U_627IzDwLEAtuIgWFPxnAGqwX6pfeev0NKuZ8W756IFvnNeic-fD8i4RfKT-VWDCZUX-SQAdsQYYC-aCl37LX7-r9-daNKGU97cj1Hau3DEqq6NE_XuCkNrP8I7lZVdTlQV4PYVm3mOCpznh9FVxCI5Q0BSZOkohmqKEaLMaGUwbtpoteMJnRowLUg24jqqeL-mQYWyCMBUwLqRGwrsm-MMBokr4WG21PiN6qx5fporO9M09IftBi3rUw1HR7dsjU1LJDz4_TyBiyUJ4rs9VP0iklLH9D0DGYMi0ji7IghYmduzxs4Bb5mB9p1reQTQ-USmaUmP_azQePUs01NeaHEIgj126jeDYiKnn19EzH_q6hDxc5rhVa1NrxZLgtq4EzVJUCl22w7TNRwgmgonvCF6c4M9c_aCRcbbwhdiYovcdnVbv5vNTEKWCXMvcZVSsmN88MRiJ09onQN8480NrBwJA_R0KMksIOMvfwhtaMXt9sEpTtLKzhmaO83CJA9nbv_X36z1Yt3UQ-HW47TuHCQph2SV1RNNroq4nSOLxMbU3iRLsAxT7QrUK1FZSg5i2Aaa9gtnoNtUu7rrbWw_JzHiiqie8InvuH6DRLkzS5n8ZlalB0c-HaQhqPCufnE6nmO5zBA1g-K7UvgE5z9sRo-4VHiUW3847jp98SetP1qBcY6ZgcQ80nnjg_57jpyYGDJS0PN9-Cl7uFjOL5m5ACNikPBDL6B54w8t5mhAxtkHLD8ibZkSKHS4Sr6KUnsBqCo-V_LQG8oimNl3sNf49Z0icT1JvgKb6mSgFK1zIngKhov9rZdHtNGZO5waN-lu7cF3jMLPDxStkYkzCnWLeztx3UCJyja2-7pCv8aCestk7p6XcWbQ8TvjhXGgInyLBRMNSafupWaXwg7_F68B1bvSqVvQ8hxOP9caohHZjKWh5mh2iBeDwdAmFQpo-hN-bhXv8AjvZ_AZ4vucAEoJx1irxyU-2cTtxdINjQI_DrHBfoSbS5aSIgJfMOOxAGO-mtXJAnC-MWRQ6UhWJfhRNmvlwvmCwd0rPRK_ItiWYL5hese1kDFo8T6pMiqGbPKKaPLaZfP24XBE5rMvqSBZTqW/https://www.amazon.com/stores/page/B68C4601-0BFE-4B30-94CE-7F42AE94FA8A/?_encoding=UTF8&store_ref=SB_A09075401KB9OXAV5ZNEC-A097298713YOAJMBXOOQZ&pd_rd_plhdr=t&aaxitk=7eaa7ad0b8773ab51da493023ead1acc&hsa_cr_id=0&lp_asins=B0DYGYPHR5%2CB0CXVB1ZTS%2CB0CXVFFDRQ&lp_query=fun%20pool%20floats&lp_slot=desktop-hsa-3psl&ref_=sbx_be_s_3psl_mbd_mb0_bkgd&pd_rd_w=FddTe&content-id=amzn1.sym.cd7c548b-a599-426f-9ffe-daa1aa803c87%3Aamzn1.sym.cd7c548b-a599-426f-9ffe-daa1aa803c87&pf_rd_p=cd7c548b-a599-426f-9ffe-daa1aa803c87&pf_rd_r=SGFRMD131HYANHMXRT1C&pd_rd_wg=9OXV0&pd_rd_r=157676aa-0fbb-4dbe-903b-68e0af56241a,,,,,False,,,N/A,2026-04-23T12:04:08.311371,
