data_index,page,ad_type,ad_rank,organic_rank,asin,title,url,price_current,price_list,rating_stars,rating_count,is_prime,image_small,image_large,brand_name,scraped_at,inner_products_count
49,4,Organic,,188.0,B0DK2G2R5K,CafePress LGBTQ Paint Splatter Euro Oval Car Bumper Magnet,N/A,$11.99,,,,False,https://m.media-amazon.com/images/I/71VIoUxn6kL._AC_UL320_.jpg,https://m.media-amazon.com/images/I/71VIoUxn6kL._AC_SL1500_.jpg,,2026-04-23T09:38:58.160015,
50,4,Organic,,189.0,B0F2J65TXW,"Magnet Resist Fascism Magnet Banned Books LGBTQ Rights Trans Equality Liberal Social Justice Pride Black for Bumper, Refrigerator, Cruise Door, Car, Truck 7.5x3.75in",N/A,$6.99,,4.6,54.0,False,https://m.media-amazon.com/images/I/51ml5sowWyL._AC_UL320_.jpg,https://m.media-amazon.com/images/I/51ml5sowWyL._AC_SL1500_.jpg,,2026-04-23T09:38:58.163956,
51,4,Organic,,190.0,B0GCVZLZVT,Magnet Don't Honk at Me I'll Cum Car Magnet Decal Rainbow Color Gifts Magnetic Bumper Decorations for Refrigerators Cars 7.5x3.75in,N/A,$8.90,,,,False,https://m.media-amazon.com/images/I/61tdMrnAKUL._AC_UL320_.jpg,https://m.media-amazon.com/images/I/61tdMrnAKUL._AC_SL1500_.jpg,,2026-04-23T09:38:58.168802,
52,4,Organic,,191.0,B0DZN7PXZ4,"Magnet Gay Pride Rocket Magnetic Bumper Sticker 5""",N/A,$4.95,,,,False,https://m.media-amazon.com/images/I/61vtItbseSL._AC_UL320_.jpg,https://m.media-amazon.com/images/I/61vtItbseSL._AC_SL1500_.jpg,,2026-04-23T09:38:58.173669,
53,4,Organic,,192.0,B0D9C6GZ4R,in A World Where You Can Be Anything Be Kind Magnet - LGBTQ Pride Ally Love Rainbow Flag Magnet - Car Truck Bumper Fridge Metal Surface Magnet - 5 Inches On Longest Side - Made in USA - AAMT0147,N/A,$7.95,,5.0,2.0,False,https://m.media-amazon.com/images/I/71OOd9tlCUL._AC_UL320_.jpg,https://m.media-amazon.com/images/I/71OOd9tlCUL._AC_SL1500_.jpg,,2026-04-23T09:38:58.181293,
55,4,Title,,,,Debug info copied.SponsoredCustom Duck Cruise Door Magnets Fun Duck Cruise Door Decorations Ducky Ma,,,,,,False,,,,2026-04-23T09:38:58.182616,
56,4,Title,,,,Previous1234567Next,,,,,,False,,,,2026-04-23T09:38:58.183433,
57,4,SB,5.0,,,N/A,https://aax-us-east-retail-direct.amazon.com/x/c/JLZw-g7fZju_IfJvZxhQmgcAAAGdt_11PwEAAAH2AQBvbm9fdHhuX2JpZDUgICBvbm9fdHhuX2ltcDIgICBHE8H3/clv1c_ek-wxHHWUsbSTAWEa8rTpBy2FkAqflwvQKJxVrrwtgF7ODZQqp3WTB4K-FMKyOPFW_CQVy9xyu048Fsseon23B9LLceDGE7DRQl7U_zsjGycYyE63WqWFn6MYrnxrF_VsZ5Xvec7dikMaOWSnr8F5dQrQNyamsXsg8bc7-erSYcMw0tOjunv-9kM4hUP8ElP339BpcxLFC2kz_Dd1qBC0uNbv_11dAql2ToOGvQ0YcU8aQhja05EpYDfaxAhfHzGCIzhytMV9m4pr03Mc5dp4omVicJmEPNvGComsLC19LzTqrSD0ozIkS19HSZ8rvjGv_hEIhFRb_NTOQc4CsQpAQLSZFuYBBeQ5qsZLfgsvelum9K-qlWp5bl29didmBzDHC4TcJolgU9mlmuF_Rqi3y6UhtXjzkDDuWy305ra35Loe0NK_D420E0Ijl2aURDEXrs7hFaE9BATa_EvsUz-L0NMKogsHfxVmgmMf9Aro-SO68bXbwYX9CpOIu_Gu8vVFYWNIrsAkrbDN-JizhlC79kdWn02fdXghzO5fXO0NMSSuAZIgUVUUBIN75ATPmXPsyqhCGaVAIqD0QgmCQc5e1L70B7Hs0OPVvhyiNiFLi5nsldE2oHw6Y9S01KyD5D0E2wunKabI0v_YcYZIZ_h-8OJSzn1PUxQsCbKW7ctHUtUNm7jdR67YMPZnp-ejcN78Ho6QXGOHXNIULAtriJIuSAZkf2-LXHynwdxkiTRg4Xc9cqTeYaswE3tqGnFWZwr1_XjOgOI12HyWTH8j-ZK2RortibYM6tYVZNr8rkmBwPLOItLu4qcwjiyhOXbJYi1qC_8B8JWf0h0u-oeGnwejcvb-cUSZQOiO1DdBcutPFjFhhcXhKDTuM3AP0c2aLEz6lc_8pJSvGghWuIiQMruI_pjIwPnDfhvm5muGVa9LWdk90SoPVdtDWBpZbjuL5tfyXDxZ36V4oJMERVLnDOTrSbFY7YNPSc1jn4WUp2vzp35Y_9SQWnsQ2IktwH75pUxZ_SCt9Mb2gZ2A3VfpVaVH2dP6kd8eofz6ix2KC8YVqT6VR2mQqzqV51OO9DjPTK-IeL6tX0nVWUeg2rPChLPXvd4urbegvE_H8HE2qV-sT2gxqSRquamMwz5ToFsz4RifSnBPdq2_QTbSVXix9ge5TLU2SaBlko6Nu6A1Zl69ooMGFPzueluBLslbxK2Dqm4JZdYESShrrPvpNW3jcTN5q0-VD_V35dliFniRExDrw7fYk04fkYodtg6P4fTGFyXtyIP4iKfl48elYAup0DVIomyCxye86TJGnc3Ojr_YUJItvXfmUVuGznQp8GMjYsOhJyZhiRy88F2YWDAORfDuPlWBSSHwOei-Xv07kUdiI2xG_6d43_fSa5xezTOep88vGDsngWK3LKuEWtkt4UOHl5W1fH353PA9sM4l5m_g3qWHkBDLsTFeSzN808Viv0fL8Cn46h8YFdFBixvHWTQyIRssDro-VxEEO1D-ac3gNrrO4TUoA9Nj5wWtEedN_qrX5vc25xk7kZ3O0KkmTMg1uad7DeOGsyt6Shxe7McylUWGoHgMjAWm9UnF3AEme9NEMZWIA4P10pdtDLYwoQYU2kAauTP3sTRweDfAZ5ECGhCSHV6i5aWrxEkpOwROLBqoThRuJpeq8yqY_VM4ke6dfRffAlDpUEHPysO/https://www.amazon.com/stores/page/43112043-78C1-45D4-92CC-1A723B72F4A4/?_encoding=UTF8&store_ref=SB_A070186719OGVT5Q50QX2-A0712219UCCL6EFV0GF1&pd_rd_plhdr=t&aaxitk=1bd08ea5c14c02d0f48c2715e16b33c4&hsa_cr_id=0&lp_asins=B0GDXV1C45%2CB0D96N4PXQ%2CB0GCL4WDX8&lp_query=gay%20bumper%20magnets&lp_slot=desktop-hsa-3psl&ref_=sbx_be_s_3psl_mbd_mb0_bkgd&pd_rd_w=U7vU7&content-id=amzn1.sym.cd7c548b-a599-426f-9ffe-daa1aa803c87%3Aamzn1.sym.cd7c548b-a599-426f-9ffe-daa1aa803c87&pf_rd_p=cd7c548b-a599-426f-9ffe-daa1aa803c87&pf_rd_r=JSH36JA42E5RAYSQ6QYZ&pd_rd_wg=HybMU&pd_rd_r=f05d7574-28d6-401e-bef1-94df8ed3d267,,,,,False,,,N/A,2026-04-23T09:38:58.190973,
58,4,Title,,,,Need help?Visit the help sectionorcontact us,,,,,,False,,,,2026-04-23T09:38:58.191556,
0,5,SB_Video,4.0,,,N/A,N/A,,,,,False,,,,2026-04-23T09:39:14.772640,1.0
1,5,Title,,,,ResultsCheck each product page for other buying options. Price and other details may vary based on p,,,,,,False,,,,2026-04-23T09:39:14.773218,
3,5,Organic,,193.0,B0D9C6GZ4R,in A World Where You Can Be Anything Be Kind Magnet - LGBTQ Pride Ally Love Rainbow Flag Magnet - Car Truck Bumper Fridge Metal Surface Magnet - 5 Inches On Longest Side - Made in USA - AAMT0147,N/A,$7.95,,5.0,2.0,False,https://m.media-amazon.com/images/I/71OOd9tlCUL._AC_UL320_.jpg,https://m.media-amazon.com/images/I/71OOd9tlCUL._AC_SL1500_.jpg,,2026-04-23T09:39:14.777406,
4,5,Organic,,194.0,B0G7LTSJCX,Straight Pride | Bumper Sticker or Car Magnet | Joke Humor Magnetic Sticker for Cars [7.5x3.75],N/A,,,,,False,https://m.media-amazon.com/images/I/61Gx2rhDN8L._AC_UL320_.jpg,https://m.media-amazon.com/images/I/61Gx2rhDN8L._AC_SL1500_.jpg,,2026-04-23T09:39:14.780981,
5,5,Organic,,195.0,B0FSQB1SH8,"(7.5x3.75 in) Magnet Sticker Please Be Careful I Am Gay Magnetic for Bumper, Car, Truck, Metal Surface - Waterproof, UV-Resistance",N/A,$8.99,,,,False,https://m.media-amazon.com/images/I/51VQo8T9z8L._AC_UL320_.jpg,https://m.media-amazon.com/images/I/51VQo8T9z8L._AC_SL1500_.jpg,,2026-04-23T09:39:14.785380,
6,5,Title,,,,16PCS Funny Pride Gay Car Bumper Magnets: Bulk Magnetic Rainbow Decals Decorations for LGBT Parade D,,,,,,False,,,,2026-04-23T09:39:14.786236,
7,5,Title,,,,Rainbow knitted socks for men and womenSponsored|Shop RoszwtitShop nowPrevious pageRoszwtit Holiday ,,,,,,False,,,,2026-04-23T09:39:14.787305,
8,5,Title,,,,More results,,,,,,False,,,,2026-04-23T09:39:14.787436,
9,5,Organic,,196.0,B0GNTBN1SD,"Human LGBTQ Heavy Duty Car Magnet Vehicle Bumper Sign Removable 5"" 2 Pack",N/A,$7.95,,,,False,https://m.media-amazon.com/images/I/51j+MKs9zSL._AC_UL320_.jpg,https://m.media-amazon.com/images/I/51j+MKs9zSL._AC_SL1500_.jpg,,2026-04-23T09:39:14.791219,
10,5,Organic,,197.0,B0GCWRW13W,Magnet ATF is Gay Car Magnet Decal Retro Funny Joke Magnetic Bumper Decorations for Refrigerators Cars 7.5x3.75in,N/A,$8.90,,,,False,https://m.media-amazon.com/images/I/61WuENeVFsL._AC_UL320_.jpg,https://m.media-amazon.com/images/I/61WuENeVFsL._AC_SL1500_.jpg,,2026-04-23T09:39:14.794196,
11,5,Organic,,198.0,B0D3M7BYB7,CafePress Pride Joy Euro Oval Car Bumper Magnet,N/A,$9.99,,,,False,https://m.media-amazon.com/images/I/61Ifyouj47L._AC_UL320_.jpg,https://m.media-amazon.com/images/I/61Ifyouj47L._AC_SL1500_.jpg,,2026-04-23T09:39:14.797211,
12,5,Organic,,199.0,B0GNTC8KHF,"Invisible Illness Invincible Warrior (Gray) Heavy Duty Car Magnet Vehicle Bumper Sign Removable 5"" 2 Pack",N/A,$7.95,,,,False,https://m.media-amazon.com/images/I/41+yOaDb7nL._AC_UL320_.jpg,https://m.media-amazon.com/images/I/41+yOaDb7nL._AC_SL1500_.jpg,,2026-04-23T09:39:14.800423,
13,5,Organic,,200.0,B0GNTM61CT,"My Disability is Invisible not Imaginary Heavy Duty Car Magnet Vehicle Bumper Sign Removable 5"" 2 Pack",N/A,$7.95,,,,False,https://m.media-amazon.com/images/I/51WhZbMTcfL._AC_UL320_.jpg,https://m.media-amazon.com/images/I/51WhZbMTcfL._AC_SL1500_.jpg,,2026-04-23T09:39:14.803498,
14,5,Organic,,201.0,B07NSQ9Z87,"Magnet Bisexual Pride Planet Magnetic Car Sticker Decal Bumper Magnet Vinyl 5""",N/A,$5.40,,4.2,62.0,False,https://m.media-amazon.com/images/I/31Yl2Rf+zRL._AC_UL320_.jpg,https://m.media-amazon.com/images/I/31Yl2Rf+zRL._AC_SL1500_.jpg,,2026-04-23T09:39:14.807282,
15,5,Organic,,202.0,B0DR337C3L,"Set of 2 Bumper Magnet Gay Pride LGTBQ Rainbow Flag 5""- High-Resolution UV-Resistant Decal Durable Magnetic Auto Stickers for Cars, Perfect for Drivers and Road Trip Lovers",N/A,$28.48,,,,False,https://m.media-amazon.com/images/I/31xhJl+u51L._AC_UL320_.jpg,https://m.media-amazon.com/images/I/31xhJl+u51L._AC_SL1500_.jpg,,2026-04-23T09:39:14.811252,
16,5,Organic,,203.0,B0C2YW4174,"Hying 2PCS Gay Pride Bumper Stickers, LGBTQ Love is Love Magnetic, Reusable Pride Month Decorations, Multicolor, Vinyl, Rectangular Stickers for Cars",N/A,$9.89,,4.7,16.0,False,https://m.media-amazon.com/images/I/51xiCuRKRfL._AC_UL320_.jpg,https://m.media-amazon.com/images/I/51xiCuRKRfL._AC_SL1500_.jpg,,2026-04-23T09:39:14.815589,
17,5,Organic,,204.0,B0CY3H942N,"CafePress Minimalist LGBT Drip Rainbow 5.5"" Round Car Magnet Magnetic Bumper Display",N/A,$6.99,,,,False,https://m.media-amazon.com/images/I/41g9E7cncDL._AC_UL320_.jpg,https://m.media-amazon.com/images/I/41g9E7cncDL._AC_SL1500_.jpg,,2026-04-23T09:39:14.818839,
18,5,Organic,,205.0,B0G2RMB398,"Magnet Warning Driver is Gay Magnetic Vinyl Sticker Decal 5""",N/A,$5.95,,,,False,https://m.media-amazon.com/images/I/51eWXnjgCUL._AC_UL320_.jpg,https://m.media-amazon.com/images/I/51eWXnjgCUL._AC_SL1500_.jpg,,2026-04-23T09:39:14.822179,
19,5,Organic,,206.0,B0C8KJK7D4,CafePress Rainbow Gay Pride Flag Rectangle Car Bumper Magnet,N/A,$7.99,,,,False,https://m.media-amazon.com/images/I/51bqpl9BZtL._AC_UL320_.jpg,https://m.media-amazon.com/images/I/51bqpl9BZtL._AC_SL1500_.jpg,,2026-04-23T09:39:14.825397,
20,5,Organic,,207.0,B0GFD7NMPQ,"Please Stay Back, Immunocompromised & High Risk Heavy Duty Car Magnet Vehicle Bumper Sign Removable 5""",N/A,$4.95,,,,False,https://m.media-amazon.com/images/I/618hIbMlI9L._AC_UL320_.jpg,https://m.media-amazon.com/images/I/618hIbMlI9L._AC_SL1500_.jpg,,2026-04-23T09:39:14.828387,
21,5,Organic,,208.0,B08ZW1VRKC,"Progress Pride Rainbow Flag Magnet | Show Your Love for The LGBT Family with This Magnetic Sign on Your Laptop, Car Bumper, or Hydro-Flask (3 X 5 Inch)",N/A,$9.95,,4.6,200.0,False,https://m.media-amazon.com/images/I/514mpkKxjlL._AC_UL320_.jpg,https://m.media-amazon.com/images/I/514mpkKxjlL._AC_SL1500_.jpg,,2026-04-23T09:39:14.832864,
22,5,Organic,,209.0,B0D9C5QW48,Be Careful Who You Hate It Could Be Someone You Love Magnet - LGBTQ Pride Ally Love Rainbow Flag - Car Truck Bumper Fridge Metal Surface Magnet - 5 Inches On Longest Side - Made in USA - AAMT0124,N/A,$6.95,,5.0,1.0,False,https://m.media-amazon.com/images/I/71xtuSswWdL._AC_UL320_.jpg,https://m.media-amazon.com/images/I/71xtuSswWdL._AC_SL1500_.jpg,,2026-04-23T09:39:14.836779,
23,5,Organic,,210.0,B0D3NYNXSR,"CafePress Free LGBT Square Car Magnet 3 X 3 Square Car Magnet, Magnetic Bumper Display",N/A,$6.99,,,,False,https://m.media-amazon.com/images/I/41RG0N-KLxL._AC_UL320_.jpg,https://m.media-amazon.com/images/I/41RG0N-KLxL._AC_SL1500_.jpg,,2026-04-23T09:39:14.839916,
24,5,Organic,,211.0,B0C8LSD9B7,"CafePress LGBTQ Life Goes by Too Square Car Magnet 3 X 3 Square Car Magnet, Magnetic Bumper Display",N/A,$6.99,,,,False,https://m.media-amazon.com/images/I/41znzx9YsIL._AC_UL320_.jpg,https://m.media-amazon.com/images/I/41znzx9YsIL._AC_SL1500_.jpg,,2026-04-23T09:39:14.843188,
25,5,Organic,,212.0,B0D3MB7YMD,CafePress Pride Joy Rectangle Car Bumper Magnet,N/A,$5.99,,,,False,https://m.media-amazon.com/images/I/31xoEHRiFWL._AC_UL320_.jpg,https://m.media-amazon.com/images/I/31xoEHRiFWL._AC_SL1500_.jpg,,2026-04-23T09:39:14.846337,
26,5,Organic,,213.0,B01DWC71PE,"CafePress LGBT Rainbow Heart Square Car Magnet 3 X 3 Square Car Magnet, Magnetic Bumper Display",N/A,$6.99,,4.0,1.0,False,https://m.media-amazon.com/images/I/31QILDlRA5L._AC_UL320_.jpg,https://m.media-amazon.com/images/I/31QILDlRA5L._AC_SL1500_.jpg,,2026-04-23T09:39:14.849716,
27,5,Organic,,214.0,B0D9C5MBYY,Sounds Gay I'm in Magnet - LGBTQ Pride Ally Love Rainbow Flag Magnet - Car Truck Bumper Fridge Metal Surface Magnet - 5 Inches On Longest Side - Made in USA - AAMT0123,N/A,$6.95,,5.0,1.0,False,https://m.media-amazon.com/images/I/61JKy1Dzw2L._AC_UL320_.jpg,https://m.media-amazon.com/images/I/61JKy1Dzw2L._AC_SL1500_.jpg,,2026-04-23T09:39:14.854088,
28,5,Organic,,215.0,B0D3M9LFQS,CafePress Pride Joy Rectangle Car Bumper Magnet,N/A,$7.99,,,,False,https://m.media-amazon.com/images/I/31D8LHmPATL._AC_UL320_.jpg,https://m.media-amazon.com/images/I/31D8LHmPATL._AC_SL1500_.jpg,,2026-04-23T09:39:14.857494,
29,5,Organic,,216.0,B0GF1RQQ5J,Magnet Be Careful Who You Hate It Could Be Someone You Love Magnet Decal LGBT Funny Quotes Reusable Magnetic Sign Sticker for Fridge Car Bumper Locker 5.5in,N/A,$8.95,,,,False,https://m.media-amazon.com/images/I/71NKmGkrmtL._AC_UL320_.jpg,https://m.media-amazon.com/images/I/71NKmGkrmtL._AC_SL1500_.jpg,,2026-04-23T09:39:14.860811,
30,5,Organic,,217.0,B0DK2FTVQS,CafePress Proud to Be Me TG Rectangle Car Bumper Magnet,N/A,$5.99,,,,False,https://m.media-amazon.com/images/I/41SBFVwMVmL._AC_UL320_.jpg,https://m.media-amazon.com/images/I/41SBFVwMVmL._AC_SL1500_.jpg,,2026-04-23T09:39:14.864274,
31,5,Organic,,218.0,B0D3M94QKF,CafePress Rainbow Love RealTr Euro Oval Car Bumper Magnet,N/A,$9.99,,,,False,https://m.media-amazon.com/images/I/61+V169QsHL._AC_UL320_.jpg,https://m.media-amazon.com/images/I/61+V169QsHL._AC_SL1500_.jpg,,2026-04-23T09:39:14.868193,
32,5,Organic,,219.0,B0FF3ZPFPP,"11x3 inches Funny Magnet - Nobody Knows I'm Gay Bumper Sticker - Nobody Knows I'm Gay Bumper Magnet - Vehicle, Refrigerator, Car, Truck,",N/A,$9.99,,,,False,https://m.media-amazon.com/images/I/51Ix0EgLMyL._AC_UL320_.jpg,https://m.media-amazon.com/images/I/51Ix0EgLMyL._AC_SL1500_.jpg,,2026-04-23T09:39:14.871405,
33,5,Organic,,220.0,B01BPN240O,"CafePress Gay Pride Dance Oval Car Magnet, Euro Oval Bumper Magnet",N/A,$9.99,,,,False,https://m.media-amazon.com/images/I/61LLTGy6jiL._AC_UL320_.jpg,https://m.media-amazon.com/images/I/61LLTGy6jiL._AC_SL1500_.jpg,,2026-04-23T09:39:14.874484,
34,5,Organic,,221.0,B0G2RSQBHG,"Magnet Here I Go in My Gay Little Car Magnetic Vinyl Sticker Decal 5""",N/A,$5.95,,,,False,https://m.media-amazon.com/images/I/41-o2azcujL._AC_UL320_.jpg,https://m.media-amazon.com/images/I/41-o2azcujL._AC_SL1500_.jpg,,2026-04-23T09:39:14.877514,
35,5,Organic,,222.0,B0D3M9NGWT,CafePress Rainbow Euro Oval Car Bumper Magnet,N/A,$9.99,,,,False,https://m.media-amazon.com/images/I/61xiHmtSiRL._AC_UL320_.jpg,https://m.media-amazon.com/images/I/61xiHmtSiRL._AC_SL1500_.jpg,,2026-04-23T09:39:14.881043,
36,5,Organic,,223.0,B09VNB86JW,Be Careful Who You Hate It Could Be Someone You Love | LGBT Magnet | Great Gift Idea|Single |5 Inch Magnet | Made in The USA | Car Auto Tool Box Refrigerator Magnet|S10340,N/A,$6.95,,4.8,145.0,False,https://m.media-amazon.com/images/I/619uIwKVLtL._AC_UL320_.jpg,https://m.media-amazon.com/images/I/619uIwKVLtL._AC_SL1500_.jpg,,2026-04-23T09:39:14.885183,
37,5,Organic,,224.0,B01BPNPOF6,CafePress Rainbow American Flag Rectangle Car Bumper Magnet,N/A,$5.99,,3.7,15.0,False,https://m.media-amazon.com/images/I/61BbHAoMTML._AC_UL320_.jpg,https://m.media-amazon.com/images/I/61BbHAoMTML._AC_SL1500_.jpg,,2026-04-23T09:39:14.888441,
38,5,Organic,,225.0,B0DPLJZ8TT,"Bumper Magnet LGBTQA LGBTQ Pride Rainbow Heart 5""- High-Resolution UV-Resistant Decal Durable Magnetic Auto Stickers for Cars, Perfect for Drivers and Road Trip Lovers",N/A,$20.48,,,,False,https://m.media-amazon.com/images/I/51oZLwMFk0L._AC_UL320_.jpg,https://m.media-amazon.com/images/I/51oZLwMFk0L._AC_SL1500_.jpg,,2026-04-23T09:39:14.891825,
39,5,Organic,,226.0,B0F2ZSDYYH,Magnets_(11x3inch) - Please be Patient I'm Gay Driver Bumper Sticker - Please be Patient I'm Gay Driver Bumper Magnet - Funny Magnet,N/A,$9.99,,,,False,https://m.media-amazon.com/images/I/61r082l83NL._AC_UL320_.jpg,https://m.media-amazon.com/images/I/61r082l83NL._AC_SL1500_.jpg,,2026-04-23T09:39:14.894991,
40,5,Organic,,227.0,B0DZNFLJ39,"Magnet Space Gays Magnetic Bumper Sticker 5""",N/A,$4.95,,,,False,https://m.media-amazon.com/images/I/51y1RfpsVNL._AC_UL320_.jpg,https://m.media-amazon.com/images/I/51y1RfpsVNL._AC_SL1500_.jpg,,2026-04-23T09:39:14.898376,
41,5,Organic,,228.0,B0FP5GHQZ6,"10 PCS Car Funny LGBT Stickers, Waterproof Pride Bumper Stickers, Rainbow Prank Decals with Humor Text, Universal Car Accessories for Vehicle Luggage Window Refrigerator",N/A,$5.99,,5.0,2.0,False,https://m.media-amazon.com/images/I/719Q-8-H8xL._AC_UL320_.jpg,https://m.media-amazon.com/images/I/719Q-8-H8xL._AC_SL1500_.jpg,,2026-04-23T09:39:14.901795,
42,5,Organic,,229.0,B093F1DLDJ,"Generic Magnet Pansexual Jellyfish Magnet Bumper Sticker Car Magnet Flexible Reuseable Magnetic Vinyl 5inch, LAB-CTMAGNETS-859",N/A,$5.95,,4.5,12.0,False,https://m.media-amazon.com/images/I/51DoT+kWBsL._AC_UL320_.jpg,https://m.media-amazon.com/images/I/51DoT+kWBsL._AC_SL1500_.jpg,,2026-04-23T09:39:14.905081,
43,5,Organic,,230.0,B0C791XN3Z,CafePress Retro QueerTR Rectangle Car Bumper Magnet,N/A,$5.99,,,,False,https://m.media-amazon.com/images/I/71u6UXoqUyL._AC_UL320_.jpg,https://m.media-amazon.com/images/I/71u6UXoqUyL._AC_SL1500_.jpg,,2026-04-23T09:39:14.908268,
44,5,Organic,,231.0,B0G49XB1VD,"Please Be Patient Gay Driver Car Bumper Magnet, Yellow Warning Sign with Pink Text, 9x3 Inch Heavy-Duty Magnetic Vinyl, Weatherproof UV-Safe, 2 Pack",N/A,$17.99,,5.0,1.0,False,https://m.media-amazon.com/images/I/81XrLdX28LL._AC_UL320_.jpg,https://m.media-amazon.com/images/I/81XrLdX28LL._AC_SL1500_.jpg,,2026-04-23T09:39:14.912378,
45,5,Organic,,232.0,B0FQ6MPPP7,"Sorry Girls I am Gay Car Magnet Sign by DC | Flexible Car Magnetic Sheets with Adhesive Backing | 12""x18"" Bumper Magnet Sticker for Vehicles, Trucks & Business Advertising Signs | 2 PC | Made in USA",N/A,$23.00,,,,False,https://m.media-amazon.com/images/I/71orM8uxw1L._AC_UL320_.jpg,https://m.media-amazon.com/images/I/71orM8uxw1L._AC_SL1500_.jpg,,2026-04-23T09:39:14.916986,
46,5,Organic,,233.0,B0FRWQ2J6R,"(7.5x3.75 in) Magnet Sticker I Can't Drive I'm Bisexual Magnetic for Bumper, Car, Truck, Metal Surface - Waterproof, UV-Resistance",N/A,$8.99,,,,False,https://m.media-amazon.com/images/I/51uxLprn9OL._AC_UL320_.jpg,https://m.media-amazon.com/images/I/51uxLprn9OL._AC_SL1500_.jpg,,2026-04-23T09:39:14.920288,
47,5,Organic,,234.0,B0D3M991QF,CafePress Rainbow Love RealTr Rectangle Car Bumper Magnet,N/A,$7.99,,,,False,https://m.media-amazon.com/images/I/41mDXMDJjLL._AC_UL320_.jpg,https://m.media-amazon.com/images/I/41mDXMDJjLL._AC_SL1500_.jpg,,2026-04-23T09:39:14.923422,
48,5,Organic,,235.0,B0D9CGC37H,I Love Gay Porn Magnet 3x10 Bumper Sticker Size Funny I Heart Porn Magnet - Rainbow,N/A,$11.99,,,,False,https://m.media-amazon.com/images/I/61Fx7m5GNpL._AC_UL320_.jpg,https://m.media-amazon.com/images/I/61Fx7m5GNpL._AC_SL1500_.jpg,,2026-04-23T09:39:14.927484,
49,5,Organic,,236.0,B0D3M9JP9V,CafePress Heart and Rainbow Rectangle Car Bumper Magnet,N/A,$7.99,,,,False,https://m.media-amazon.com/images/I/31c4F1Y2TSL._AC_UL320_.jpg,https://m.media-amazon.com/images/I/31c4F1Y2TSL._AC_SL1500_.jpg,,2026-04-23T09:39:14.931923,
50,5,Organic,,237.0,B0FF2XKQ46,"11x3 inches Funny Magnet - HONK IF You are Gay Bumper Sticker - HONK IF You are Gay Bumper Magnet - Vehicle, Refrigerator, Car, Truck,",N/A,$9.99,,,,False,https://m.media-amazon.com/images/I/51eDE0eAEjL._AC_UL320_.jpg,https://m.media-amazon.com/images/I/51eDE0eAEjL._AC_SL1500_.jpg,,2026-04-23T09:39:14.935033,
51,5,Organic,,238.0,B0DTJ3BCRT,"Bumper Magnet Funny Warning, Not Gay, But $20 is $20, Practical Jokes 6""- High-Resolution UV-Resistant Decal Durable Magnetic Auto Stickers for Cars, Perfect for Drivers and Road Trip Lovers",N/A,$15.48,,,,False,https://m.media-amazon.com/images/I/51SWefJ4haL._AC_UL320_.jpg,https://m.media-amazon.com/images/I/51SWefJ4haL._AC_SL1500_.jpg,,2026-04-23T09:39:14.938500,
52,5,Organic,,239.0,B07JPCM7NN,"Mosaic Rainbow Heart Gay Pride - Magnet - Car Fridge Locker - 5.5""",N/A,$8.99,,4.7,155.0,False,https://m.media-amazon.com/images/I/51HZIIRfrTL._AC_UL320_.jpg,https://m.media-amazon.com/images/I/51HZIIRfrTL._AC_SL1500_.jpg,,2026-04-23T09:39:14.942288,
53,5,Organic,,240.0,B0DK2FYXH2,"CafePress LGBTQ Paint Splatter Square Car Magnet 3 X 3 Square Car Magnet, Magnetic Bumper Display",N/A,$8.99,,,,False,https://m.media-amazon.com/images/I/51ibTC+HAbL._AC_UL320_.jpg,https://m.media-amazon.com/images/I/51ibTC+HAbL._AC_SL1500_.jpg,,2026-04-23T09:39:14.946498,
55,5,Title,,,,Debug info copied.Sponsored16PCS Funny Pride Gay Car Bumper Magnets: Bulk Magnetic Rainbow Decals De,,,,,,False,,,,2026-04-23T09:39:14.947834,
56,5,Title,,,,Previous1...4567Next,,,,,,False,,,,2026-04-23T09:39:14.948209,
57,5,SB,6.0,,,N/A,https://aax-us-east-retail-direct.amazon.com/x/c/JB7uZ6NUB4-zUaE4j3X9q8AAAAGdt_227wEAAAH2AQBvbm9fdHhuX2JpZDEgICBvbm9fdHhuX2ltcDEgICB6bt58/clv1c_ek-wxPPXFcbSDQHEK4vEpAy2FgAqPtwvCPP4fNj3v4M56nJ3Tbv9IFVgwoEKMwVmxpr3cBkkAQPhUXUvDO8qKC513RWEcPiBQK9qCr63ycki3wT2YkCK7_b95-8M9hPxkwu4gKn7RkqySwCVi9W8vBKYpsPUFpXpmLT1wjW2DFce2GYPUtITmkJl6trudLOmfLSmYtFrz2aJVef-mVX64tqWTMsaZB7n8YyX6qrTR12ZBZvW0y8OEGnKEgc_6tmJEblCpPG3c-YhDxhpec96vdjnaPSvivIV_OTElHE0zzZnSfHi7LQl18ZYGOCgV6Vow_X9jkERP6Ny5lA0F_ImNRjVFz5JkD0gutdQXyTV1HlFQ8-KM2d1rdC1tdyQ8DnQ3i5PNpKvg5MELy8v5nEBK6LycxuxWQ1Fv7KNpJrtkPaHOMTOHoT_1CYQjzlNHRn7VyK1AJ5YXJrEo229CgWQinZ90fj7XPl_kJGPhSubuWMfkk26NqD8dShiNP7A9oeAihc870nSFrpwBmIBUJ1Cb_1dbe9AYr3ryiPsBb3428vRU4lx4x5I8XMqvT8NvuWST91nQqgubK1Qo2YlDH41XqqNe6WfXcxmKNQYIIQJKbHQOWVUX4pfFXwdIN_JYvOIaZ5zU-4t_Grq6bH3x01PKZM4xvkV75Sk_vDnXPa2f8vi3OsW9tqd7Jt6VY-eo1kbPSCAlD6HUYAQev3FSY6qDKfR360TFTMSaentWN_yBY6LGJj8Mu0U40N2rnLxrmcba-PoMUVSYhsPtxanvJbwmJFLFFNALFtFjQGv2O9GyJkStwyGNWgqcQAZaGQxb2vhHIfR9ueQF_9FopR1wpWqrom6O1vVwKGbUvQQ-_vfeNP-nWEmDhF11uh-gLUeoQKZLiiyUbqqelOAcuth3JvXRzJ-2nyKPb5WEyg39b4VfRk4w2IZEXFOEYFoov4wMUduxwjd2S-6LlvNWlggozYeU6_y_cYD4EA9fRj_9EgTrYv1djiutAfxQkOMmnUaTXcQevhp5F6G-sQ2d7z3srZt7XZLTrqKF4hakXxShggQ9F9J_RbrzjI1H0DZ83Tk-7fhvsfZt5AYMkPCH5YeaQoHMEt3GrieUCnUobei0Cv-rHP6focXeEdkkXdDDi7YPhKluLh20Qm5K9_lv0C1ZL1buLpnaFr-BGnUed-x-jgUlO7JdO15Q1KNH1xA2mwWJQgfMNuceml1g9PmEY8E4NcTI51uT7khbn9IFnOzI9WD6Ipw-qLcgkmRgPYzojW_06HfvDJlwGrN53O4iPHB9cEupcDrPkL3mDeBnH6SMGk-mJTbeQSXFvTmF0Lpqd_VvN4EUwLp5_hTg4zazW20IayQY7inrCHenYYgLsMjhPQIyt6g9_7r91iBeDbTxwY4s_yM_Xog0-ESzmVscIJL86vcYkHm2zYntUh9WK812gKjrEAnAu1ezSkQMooWJYw_xvbItfnWuwXKCYY-SPBMjKEhMgbGuS_3XU_SqdiYbp-KJ8hKKRHdRvPzP09EzDwt86tPbQuMOrZ5hRS7dkZPot4y32rdlcKZlmZQhSrZ75BmrTgRdj3Edv1pjNzSfg6XtMroc5v0E0jiSLqkHCg0ZkXclrvBIkm5wM7jnZ4mJpFv_HOTcNrmAD9xL9CFb0-78EqqRDxWm-tQnFqAPOZ8ohSGDFd1S4BCQGifdgs66IpP/https://www.amazon.com/stores/page/43112043-78C1-45D4-92CC-1A723B72F4A4/?_encoding=UTF8&store_ref=SB_A070186719OGVT5Q50QX2-A0712219UCCL6EFV0GF1&pd_rd_plhdr=t&aaxitk=1bd08ea5c14c02d0f48c2715e16b33c4&hsa_cr_id=0&lp_asins=B0GDXV1C45%2CB0D96N4PXQ%2CB0GCL4WDX8&lp_query=gay%20bumper%20magnets&lp_slot=desktop-hsa-3psl&ref_=sbx_be_s_3psl_mbd_mb0_bkgd&pd_rd_w=nIFub&content-id=amzn1.sym.cd7c548b-a599-426f-9ffe-daa1aa803c87%3Aamzn1.sym.cd7c548b-a599-426f-9ffe-daa1aa803c87&pf_rd_p=cd7c548b-a599-426f-9ffe-daa1aa803c87&pf_rd_r=RC3FYAEMWXWA2PA5FCFH&pd_rd_wg=6p6lR&pd_rd_r=cb9894d1-2e5c-4bc8-a456-959b1d6fb363,,,,,False,,,N/A,2026-04-23T09:39:14.953575,
58,5,Title,,,,Need help?Visit the help sectionorcontact us,,,,,,False,,,,2026-04-23T09:39:14.954213,
