data_index,page,ad_type,ad_rank,organic_rank,asin,title,url,price_current,price_list,rating_stars,rating_count,is_prime,image_small,image_large,brand_name,scraped_at,inner_products_count
0,1,SB_Video,1.0,,,N/A,N/A,,,,,False,,,,2026-04-23T12:06:00.061458,1.0
1,1,Title,,,,ResultsCheck each product page for other buying options. Price and other details may vary based on p,,,,,,False,,,,2026-04-23T12:06:00.062450,
3,1,Organic,,1.0,B0CR6SG9NZ,Arrowom 24pcs Hawaiian Leis Bulk Luau Party Silk Flower Necklace Colorful Tropical Hawaiian Bulk Hula Dance Party Decor Flower Leis Summer Beach Pool Party Decorations Favors Supplies,N/A,$9.49,,4.5,2717.0,False,https://m.media-amazon.com/images/I/91Dw3St+MFL._AC_UL320_.jpg,https://m.media-amazon.com/images/I/91Dw3St+MFL._AC_SL1500_.jpg,,2026-04-23T12:06:00.067822,
4,1,Organic,,2.0,B0F2RXN18F,OHOME 2 Pack Luau Party Decorations - Plastic Tablecloth for Hawaiian Theme Party Decorations | Tropical Summer Beach Pool Birthday Backdrop Favors Supplies,N/A,$6.29,,4.6,906.0,False,https://m.media-amazon.com/images/I/91VMLJwCDvL._AC_UL320_.jpg,https://m.media-amazon.com/images/I/91VMLJwCDvL._AC_SL1500_.jpg,,2026-04-23T12:06:00.072313,
5,1,Organic,,3.0,B0GR3B5F7V,"Tropical Decor, Tropical Table Runner, Summer Table Runner - 6 Pack 70 Inch Artificial Monstera Leaf Garlands & Faux Palm Leaf Table Runners for Hawaiian Luau Parties & Beach Weddings",N/A,$22.99,,,,False,https://m.media-amazon.com/images/I/71nY6ILbG5L._AC_UL320_.jpg,https://m.media-amazon.com/images/I/71nY6ILbG5L._AC_SL1500_.jpg,,2026-04-23T12:06:00.076354,
7,1,Title,,,,Debug info copied.SponsoredAtonofun 72 Pack Hawaiian Luau Party Decorations Cups -14OZ Disposable Tr,,,,,,False,,,,2026-04-23T12:06:00.078366,
8,1,Title,,,,Hawaiian Party Favor BagsSponsored|10K+ bought from this brand in past month|Shop AlicesetShop nowPr,,,,,,False,,,,2026-04-23T12:06:00.080331,
9,1,Title,,,,More results,,,,,,False,,,,2026-04-23T12:06:00.080519,
10,1,Organic,,4.0,B073RBVTXT,"ALINK 50 Umbrella Parasol Drinking Straws, Hawaiian Beach Cocktail Luau Party Decorations Supplies",N/A,$6.99,,4.6,10353.0,False,https://m.media-amazon.com/images/I/81YbWfWBaPL._AC_UL320_.jpg,https://m.media-amazon.com/images/I/81YbWfWBaPL._AC_SL1500_.jpg,,2026-04-23T12:06:00.084306,
11,1,Organic,,5.0,B09NM2FPKX,"Fovths Luau Grass Table Skirt Natural 9 Feet x 29.5 Inch Hawaiian Table Skirt for Tropical Hawaiian Party Decorations Luau Costume Party, Straw Yellow",N/A,$8.49,,4.5,2421.0,False,https://m.media-amazon.com/images/I/81Hsj3wr27L._AC_UL320_.jpg,https://m.media-amazon.com/images/I/81Hsj3wr27L._AC_SL1500_.jpg,,2026-04-23T12:06:00.089879,
12,1,Organic,,6.0,B0BQJLQT9F,100 Counts Hawaiian Leis Flower for Luau Theme Party Decorations - Bulk Set of Silk Flower Necklace Leis Tropical Theme Party Favors Birthday Decorations Assortment,N/A,$29.99,,4.4,277.0,False,https://m.media-amazon.com/images/I/81Ixd4eCqJL._AC_UL320_.jpg,https://m.media-amazon.com/images/I/81Ixd4eCqJL._AC_SL1500_.jpg,,2026-04-23T12:06:00.093614,
13,1,Organic,,7.0,B01F6LRW30,"Joyin Toy 36 Counts Hawaiian Leis Bulk, Tropical Flower Lei Hawaiian Lei Beach Hawaii Luau Party Favors Decoration Birthday Party Supplies(3 Dozen)",N/A,$11.99,,4.6,10888.0,False,https://m.media-amazon.com/images/I/911aTPl1DwL._AC_UL320_.jpg,https://m.media-amazon.com/images/I/911aTPl1DwL._AC_SL1500_.jpg,,2026-04-23T12:06:00.097531,
14,1,Organic,,8.0,B0DP1M3KRL,"180 pc Premium Luau Party Decorations Set – Hawaiian Birthday Party Decor with Balloons, Backdrop, Table Skirt, Toppers & More – Tropical Aloha Themed Supplies for Indoor & Outdoor Celebrations",N/A,$37.99,,4.6,153.0,False,https://m.media-amazon.com/images/I/91nX76qPjAL._AC_UL320_.jpg,https://m.media-amazon.com/images/I/91nX76qPjAL._AC_SL1500_.jpg,,2026-04-23T12:06:00.101556,
15,1,Organic,,9.0,B071JR7GYP,"JOYIN 60"" Inflatable Palm Tree Cooler, Beach Theme Decor, Pool Party Decorations, Luau Hawaiian Birthday Party Supplies, Ocean Jungle Tropical Themed Summer Outdoor Drink Cooler",N/A,$19.99,,4.3,5372.0,False,https://m.media-amazon.com/images/I/815M9fW4pfL._AC_UL320_.jpg,https://m.media-amazon.com/images/I/815M9fW4pfL._AC_SL1500_.jpg,,2026-04-23T12:06:00.104343,
16,1,Organic,,10.0,B00OCGUG02,"Hefty Party On Disposable Plastic Cups, Assorted, 16 Ounce, 100 Count",N/A,$9.97,,4.8,35509.0,False,https://m.media-amazon.com/images/I/81uf-BZz2eL._AC_UL320_.jpg,https://m.media-amazon.com/images/I/81uf-BZz2eL._AC_SL1500_.jpg,,2026-04-23T12:06:00.110852,
17,1,Organic,,11.0,B0F1CZBKQZ,"Atonofun 80 PCS Leis for Luau Party Decorations- Hawaiian Leis Bulk, Luau Party Glasses, Colorful Bracelets, Flower Headbands for Adults Tropical Birthday Summer Beach Luau Party Favors Supplies",N/A,$21.99,,4.7,213.0,False,https://m.media-amazon.com/images/I/81wie7bpooL._AC_UL320_.jpg,https://m.media-amazon.com/images/I/81wie7bpooL._AC_SL1500_.jpg,,2026-04-23T12:06:00.114371,
18,1,Organic,,12.0,B07DLVSJ99,"FUTUREPLUSX 2 Pack Tropical Garland Party Decorations, 20ft Multicolored Tissue Paper Hibiscus Flower Summer Banner for Birthday Beach Theme Luau Hawaiian Party Supplies Jungle Decor",N/A,,,4.7,3377.0,False,https://m.media-amazon.com/images/I/71q9+TnamlL._AC_UL320_.jpg,https://m.media-amazon.com/images/I/71q9+TnamlL._AC_SL1500_.jpg,,2026-04-23T12:06:00.117189,
19,1,Organic,,13.0,B085GC3XF4,108 Pack Palm Leaves Artificial Tropical Monstera - 6 Kinds Large Small Green Fake Palm Leaf with Stems for Safari Jungle Hawaiian Luau Party Table Decoration Wedding Birthday Theme Party Decorations,N/A,$15.97,,4.5,5975.0,False,https://m.media-amazon.com/images/I/91GcpXJTi3L._AC_UL320_.jpg,https://m.media-amazon.com/images/I/91GcpXJTi3L._AC_SL1500_.jpg,,2026-04-23T12:06:00.121745,
20,1,Organic,,14.0,B075FPCFNR,60Pcs Tropical Party Decorations Supplies Tropical Palm Leaves Hibiscus Flower Simulation Artificial Leaf for Hawaiian Luau Safari Party Jungle Beach Theme BBQ Birthday Parties Decorations Table Decor,N/A,$11.99,,4.6,3141.0,False,https://m.media-amazon.com/images/I/81jZYriVXGL._AC_UL320_.jpg,https://m.media-amazon.com/images/I/81jZYriVXGL._AC_SL1500_.jpg,,2026-04-23T12:06:00.127044,
21,1,Organic,,15.0,B0CZMPXF8Q,"12 Pcs Luau Party Decorations Honeycomb Centerpieces, Hawaiian Party Decorations Luau Centerpieces for Tables, Hawaii Luau Table Decorations, Tropical Party Decorations Hawaiian Centerpiece",N/A,$9.99,,4.6,116.0,False,https://m.media-amazon.com/images/I/81IsYdNYFHL._AC_UL320_.jpg,https://m.media-amazon.com/images/I/81IsYdNYFHL._AC_SL1500_.jpg,,2026-04-23T12:06:00.131907,
22,1,Title,,,,More results,,,,,,False,,,,2026-04-23T12:06:00.132422,
23,1,Organic,,16.0,B09Z28TMY4,Vinsot 32 Pack Beach Pool Party Eyeglasses Decor Summer Luau Paper Glasses Bulk Hawaiian Sunglasses Frame Tropical Pool Props Photo Booth Props for Summer Beach Luau Party Favor Birthday Supply Decor,N/A,$12.99,,4.1,654.0,False,https://m.media-amazon.com/images/I/81bbJ2wNgCL._AC_UL320_.jpg,https://m.media-amazon.com/images/I/81bbJ2wNgCL._AC_SL1500_.jpg,,2026-04-23T12:06:00.136926,
24,1,Organic,,17.0,B0DC51MRZ4,"Freyalife Hawaiian Leis Decorations(24pcs),Leis for Luau Party Decor Flower,Tropical Hawaiian Bulk Hula Dance Party Decor",N/A,$6.99,,4.4,629.0,False,https://m.media-amazon.com/images/I/816+lI1lMEL._AC_UL320_.jpg,https://m.media-amazon.com/images/I/816+lI1lMEL._AC_SL1500_.jpg,,2026-04-23T12:06:00.140600,
25,1,Organic,,18.0,B07NWR7HKD,"JOYIN 12-Pack 12“ Beach Balls - Bulk Classic Beachball Inflatable Swimming Pool Toys for Games Adults Kids Birthday Party Supplies Combo Set, Rainbow Color Blow Up Luau Decorations Favors Gifts (12"")",N/A,$9.99,,4.5,3382.0,False,https://m.media-amazon.com/images/I/814LDy0nOPL._AC_UL320_.jpg,https://m.media-amazon.com/images/I/814LDy0nOPL._AC_SL1500_.jpg,,2026-04-23T12:06:00.144387,
26,1,Organic,,19.0,B0D7Q7Q7KS,"2 Pack Table Skirt Luau Party Decorations, Flower 53.2"" X 29.5"" Grass Table Skirts for Luau Party Summer Tropical Hawaiian Party Decorations (A-2 Pack)",N/A,$12.99,,4.2,133.0,False,https://m.media-amazon.com/images/I/81-X1OJU3uL._AC_UL320_.jpg,https://m.media-amazon.com/images/I/81-X1OJU3uL._AC_SL1500_.jpg,,2026-04-23T12:06:00.148143,
27,1,Organic,,20.0,B00N1QPNMA,"PartySticks Glow Sticks Party Supplies 100pk - 8 Inch Glow in the Dark Light Up Sticks Party Favors, Glow Party Decorations, Neon Party Glow Necklaces and Glow Bracelets with Connectors",N/A,$7.99,,4.6,28688.0,False,https://m.media-amazon.com/images/I/81JYNlch58L._AC_UL320_.jpg,https://m.media-amazon.com/images/I/81JYNlch58L._AC_SL1500_.jpg,,2026-04-23T12:06:00.155991,
28,1,Organic,,21.0,B0DTJ6WHHH,"Tiki Torch Bubbler - Summer Pool Party Bubble Machine with Lights and Music, Bubble Blower and Wand, Rechargeable Outdoor Toy for Kids Teens Birthday Party, 4 Feet Tall, Includes 4oz Bubble Solution",N/A,$14.99,,3.9,911.0,False,https://m.media-amazon.com/images/I/714oV45JnkL._AC_UL320_.jpg,https://m.media-amazon.com/images/I/714oV45JnkL._AC_SL1500_.jpg,,2026-04-23T12:06:00.159813,
29,1,Organic,,22.0,B0BKTQ9JLP,"JOYIN 120 Counts Hawaiian Leis Bulk, Colorful Tropical Flower Leis for Kids Adults Hawaiian Beach Luau Party Favors Decorations",N/A,$32.99,,4.6,10888.0,False,https://m.media-amazon.com/images/I/911aTPl1DwL._AC_UL320_.jpg,https://m.media-amazon.com/images/I/911aTPl1DwL._AC_SL1500_.jpg,,2026-04-23T12:06:00.163249,
30,1,Organic,,23.0,B0C3PQ9M8X,7x5ft Summer Hawaiian Beach Photography Backdrop Tropical Flower Palm Leaves Surfboard Background for Luau Aloha Party Decoration Banner Photo Booth,N/A,$13.99,,4.6,381.0,False,https://m.media-amazon.com/images/I/81BTSS8GBuL._AC_UL320_.jpg,https://m.media-amazon.com/images/I/81BTSS8GBuL._AC_SL1500_.jpg,,2026-04-23T12:06:00.166912,
31,1,Organic,,24.0,B0CZ8TGK8D,20 Pieces Luau Party Decorations Hawaiian Party Welcome Sign Summer Tropical Party Direction Signs for Fiesta Hawaiian Luau Tiki Themed Birthday Wedding Party Supplies with 2 Sheet Stickers,N/A,$7.97,,4.6,671.0,False,https://m.media-amazon.com/images/I/81Wy7W9RweL._AC_UL320_.jpg,https://m.media-amazon.com/images/I/81Wy7W9RweL._AC_SL1500_.jpg,,2026-04-23T12:06:00.170710,
32,1,Organic,,25.0,B0964DB59D,"JOYIN Set of 6 Small Pink Flamingo Yard Ornament Stakes, 17"" Plastic Flamingo Lawn Statues with Metal Legs for Sidewalks, Outdoor Garden Decor, Luau & Pool Party Decorations, 2 Styles",N/A,$15.99,,4.1,3744.0,False,https://m.media-amazon.com/images/I/713gAJWZu5L._AC_UL320_.jpg,https://m.media-amazon.com/images/I/713gAJWZu5L._AC_SL1500_.jpg,,2026-04-23T12:06:00.174506,
33,1,Organic,,26.0,B09NN5WTZ5,Spakon 9 Pieces Tropical Birds Honeycomb Paper Cutouts Rio Luau Party Hanging Decorations Rainforest Hanging Paper Birds Hawaiian Parrot Honeycomb Cutouts for Luau Party Decor,N/A,$11.99,,4.6,415.0,False,https://m.media-amazon.com/images/I/81DGOJ7+vDL._AC_UL320_.jpg,https://m.media-amazon.com/images/I/81DGOJ7+vDL._AC_SL1500_.jpg,,2026-04-23T12:06:00.178113,
34,1,Organic,,27.0,B0F2HZHWT5,HOMETITUTE Aloha Banner Luau Decorations 118 x 20 Inch Hawaiian Banner Tropical Hello Summer Backdrop Aloha Sign for Pool Party Backyard Summer Beach Tiki Bar Outdoor Photo Booth,N/A,$10.99,,4.8,73.0,False,https://m.media-amazon.com/images/I/81676Y3mYBL._AC_UL320_.jpg,https://m.media-amazon.com/images/I/81676Y3mYBL._AC_SL1500_.jpg,,2026-04-23T12:06:00.181777,
35,1,Organic,,28.0,B0946ZZ9BD,"Outus 30 Pieces Hawaiian Luau Birthday Party Hanging Swirl Decorations, Flower Tropical Palm Flamingo Sign Foil Ceiling Decor for Floral Tropical Party Summer Beach Pool Tiki Supplies(Summer)",N/A,$8.79,,4.6,1156.0,False,https://m.media-amazon.com/images/I/81cwoPntlvL._AC_UL320_.jpg,https://m.media-amazon.com/images/I/81cwoPntlvL._AC_SL1500_.jpg,,2026-04-23T12:06:00.184782,
36,1,Organic,,29.0,B0DHL149K2,Luau Birthday Party Decorations Hawaiian Party Decorations 169 Pcs Tropical Aloha Party Supplies for Summer Beach Holiday Including Balloon Arch Kit Backdrop Table Skirt Banner Cake Toppers Straws,N/A,$23.99,,4.6,151.0,False,https://m.media-amazon.com/images/I/91MolvwyNFL._AC_UL320_.jpg,https://m.media-amazon.com/images/I/91MolvwyNFL._AC_SL1500_.jpg,,2026-04-23T12:06:00.188429,
37,1,Organic,,30.0,B0B2RFGJL2,"Hawaiian Luau Party Decorations(161 Pcs), Tropical Summer Beach Pool Party Supplies Including Aloha Backdrop, Table Skirt, Tablecloth, Flamingo, Palm Leaves and Hibiscus, Balloons Arch, Straws,",N/A,$19.94,,4.6,583.0,False,https://m.media-amazon.com/images/I/81tA7Fa0I8L._AC_UL320_.jpg,https://m.media-amazon.com/images/I/81tA7Fa0I8L._AC_SL1500_.jpg,,2026-04-23T12:06:00.192043,
38,1,Organic,,31.0,B0B8G6PQ63,"200 Count Hawaiian Lei Bulk, Tropical Luau Hawaii Theme Silk Flower Necklace, Party Favors for Beach Holiday Wedding Birthday Party, Aloha Summer Party Decorations",N/A,$39.99,,4.4,338.0,False,https://m.media-amazon.com/images/I/A1JXqd95lrL._AC_UL320_.jpg,https://m.media-amazon.com/images/I/A1JXqd95lrL._AC_SL1500_.jpg,,2026-04-23T12:06:00.195275,
39,1,Organic,,32.0,B07CRL2KC9,"Hajoyful Grass Skirt Hawaiian Luau Hula Skirts Party Decorations Favors Supplies Grass Skirts for Adult Elastic Hibiscus Flowers Tropical Skirt, Party, Birthday, Celebration 60CM 12Pack Multicolored",N/A,$22.98,,4.5,1317.0,False,https://m.media-amazon.com/images/I/91bZU2w7XPL._AC_UL320_.jpg,https://m.media-amazon.com/images/I/91bZU2w7XPL._AC_SL1500_.jpg,,2026-04-23T12:06:00.198902,
40,1,Organic,,33.0,B07M5BGJFV,"Tropical Palm Leaf Garland Party Decorations, Length 2.6M, 8.5 FT, Green",N/A,$14.99,,4.6,975.0,False,https://m.media-amazon.com/images/I/81p2nI+iEYL._AC_UL320_.jpg,https://m.media-amazon.com/images/I/81p2nI+iEYL._AC_SL1500_.jpg,,2026-04-23T12:06:00.202611,
41,1,Organic,,34.0,B0932TV2WL,"KESOTE 3 Pack Tropical Paper Flower Garland Luau Party Decorations, 30FT Tissue Flower Banner for Hawaiian Summer Tiki Bar Tropical Party Decor",N/A,$13.99,,4.6,704.0,False,https://m.media-amazon.com/images/I/71ZAuD1IQBS._AC_UL320_.jpg,https://m.media-amazon.com/images/I/71ZAuD1IQBS._AC_SL1500_.jpg,,2026-04-23T12:06:00.207902,
42,1,Organic,,35.0,B0DS1SYB42,"Luau Party Decorations, 36PCS Hawaiian Themed Leis Necklace Costume Accessories, Colorful Hawaiian Leis Tropical Flower Clothing Bulk",N/A,$9.98,,4.6,246.0,False,https://m.media-amazon.com/images/I/8196+Nb-nrL._AC_UL320_.jpg,https://m.media-amazon.com/images/I/8196+Nb-nrL._AC_SL1500_.jpg,,2026-04-23T12:06:00.211664,
43,1,Organic,,36.0,B0GJDDJZV6,"169 PCS Luau Party Decorations, Hawaiian Party Supplies - ""ALOHA"" Balloons, Hawaiian Boxes, Balloon Arch Garland Kit, Fringe Curtains, Palm Leaf, Table Cloth and Skirt",N/A,$29.99,,4.9,16.0,False,https://m.media-amazon.com/images/I/81pPLIUMHHL._AC_UL320_.jpg,https://m.media-amazon.com/images/I/81pPLIUMHHL._AC_SL1500_.jpg,,2026-04-23T12:06:00.215212,
44,1,Organic,,37.0,B07YD4G1R9,WERNNSAI Hawaiian Aloha Party Banner Decorations - Flamingo Pineapple Tiki Tropical Luau Party Supplies Favors Large Gold Glittery Aloha Sign Flag for Birthday Wedding Summer Beach Pool,N/A,$11.99,,4.4,792.0,False,https://m.media-amazon.com/images/I/81d-Tg-P2-L._AC_UL320_.jpg,https://m.media-amazon.com/images/I/81d-Tg-P2-L._AC_SL1500_.jpg,,2026-04-23T12:06:00.221139,
45,1,Organic,,38.0,B0CFSLVSCF,"Giant Inflatable Palm Trees - 2 Pack - 6 Foot Super Sturdy Trees for Luau Parties, Beach Decor, Poolside Ambiance, Tropical Theme Decor & Outdoor Fun, Easy Inflation",N/A,$27.99,,4.2,482.0,False,https://m.media-amazon.com/images/I/71FudYlYhIL._AC_UL320_.jpg,https://m.media-amazon.com/images/I/71FudYlYhIL._AC_SL1500_.jpg,,2026-04-23T12:06:00.225677,
46,1,Organic,,39.0,B07NS7BG9L,"JOYIN 28” Inflatable Palm Tree Cooler, Luau Hawaiian Tropical Beach Themed Party Decorations, Blow Up Palm Trees Cooler Outdoor Party Supplies, Kids Adults Birthday Party Décor",N/A,$17.99,,4.4,4018.0,False,https://m.media-amazon.com/images/I/91NOjIPjumL._AC_UL320_.jpg,https://m.media-amazon.com/images/I/91NOjIPjumL._AC_SL1500_.jpg,,2026-04-23T12:06:00.229392,
47,1,Organic,,40.0,B095S5DPN5,"FUTUREPLUSX 48 PCS Leis for Luau Party decorations, Hawaiian Leis Tropical Hawaiian Bulk Including Colorful Flower Necklace Headbands and Wristbands for Hula Dance Party Tropical Summer Beach Theme",N/A,$11.99,,4.5,692.0,False,https://m.media-amazon.com/images/I/91F4LP+2-TL._AC_UL320_.jpg,https://m.media-amazon.com/images/I/91F4LP+2-TL._AC_SL1500_.jpg,,2026-04-23T12:06:00.233161,
48,1,Organic,,41.0,B088FJ4L7K,"YUNXUAN Flamingo Party Supplies, Hawaiian Party Decorations Flamingo and Pineapple Honeycomb Ball Paper Lanterns Paper Fans Pom poms Flowers for Birthday Luau Tropical Bachelorette Party",N/A,$16.99,,4.7,1696.0,False,https://m.media-amazon.com/images/I/71oYj8hh1KL._AC_UL320_.jpg,https://m.media-amazon.com/images/I/71oYj8hh1KL._AC_SL1500_.jpg,,2026-04-23T12:06:00.236360,
49,1,Organic,,42.0,B09NV8M82B,"Tropical Luau Party Decorations Set Hawaiian Beach Theme Party Favors Luau Party Supplies with 9ft Luau Grass Table Skirt, Palm Leaves, Hibiscus Flowers, 3D Fruit Straws, Flamingo and Pineapple Décors",N/A,$19.98,,4.6,519.0,False,https://m.media-amazon.com/images/I/81RxmR6D5gL._AC_UL320_.jpg,https://m.media-amazon.com/images/I/81RxmR6D5gL._AC_SL1500_.jpg,,2026-04-23T12:06:00.240754,
50,1,Organic,,43.0,B0BKTLGZN1,"JOYIN 4-Pack 20"" Beach Balls - Large Rainbow Beach Ball Inflatable Pool Toys for Party Supplies Decorations, Adults Kids Birthday Luau Summer Beach Water Games Beachball Party Favors",N/A,$8.99,,4.5,1487.0,False,https://m.media-amazon.com/images/I/71-+c9L29ML._AC_UL320_.jpg,https://m.media-amazon.com/images/I/71-+c9L29ML._AC_SL1500_.jpg,,2026-04-23T12:06:00.244436,
51,1,Organic,,44.0,B0DWFBYCCH,"DMIGHT 101PCS Hawaiian Themed Party Decorations Set, Tropical Beach Aloha Summer Party Supplies, Including Backdrop, Table Skirt, Honeycomb Centerpieces, Balloons for Luau, Tiki Birthday Party",N/A,$21.99,,4.8,80.0,False,https://m.media-amazon.com/images/I/91P+tcyxzkL._AC_UL320_.jpg,https://m.media-amazon.com/images/I/91P+tcyxzkL._AC_SL1500_.jpg,,2026-04-23T12:06:00.248384,
52,1,Title,,,,More results,,,,,,False,,,,2026-04-23T12:06:00.248969,
53,1,Organic,,45.0,B0BRXTH8YD,"Hawaiian Leis Luau Party Decorations Set, 54Pcs Hawaiian Luau Party Supplies Flower Leis Necklaces Headbands Wristbands Grass Hula Skirt Lays Tropical Summer Beach Birthday Holiday Party Favors",N/A,$14.99,,4.6,182.0,False,https://m.media-amazon.com/images/I/91gg2g1qE8L._AC_UL320_.jpg,https://m.media-amazon.com/images/I/91gg2g1qE8L._AC_SL1500_.jpg,,2026-04-23T12:06:00.257798,
54,1,Organic,,46.0,B0CTQL4WBT,JellyArch 4 Pcs Inflatable Surf Board 36 Inch Inflatable Pool Floats Luau Hawaiian Party Decorations Tropical Flower Blow up Surfboard for Wall Beach Party Decorations,N/A,$28.99,,4.2,115.0,False,https://m.media-amazon.com/images/I/71XtcaMqViL._AC_UL320_.jpg,https://m.media-amazon.com/images/I/71XtcaMqViL._AC_SL1500_.jpg,,2026-04-23T12:06:00.265002,
55,1,Organic,,47.0,B0C4GK8YHJ,"Auihiay 50PCS Tiki Bar Hut Kit, Tiki Hut Decoration Includes Tiki Bar, Banner, Roof, Palm Leaves, Flower Garland and Table Skirt, Great Hawaiian Pool Beach Luau Party Decor Supplies",N/A,$66.49,,4.5,152.0,False,https://m.media-amazon.com/images/I/81o1AXf6R9L._AC_UL320_.jpg,https://m.media-amazon.com/images/I/81o1AXf6R9L._AC_SL1500_.jpg,,2026-04-23T12:06:00.269534,
56,1,Organic,,48.0,B0GH5V3V66,Batiyeer 2 Pcs Tiki Bar Tablecloth Decorations 6ft Hawaii Tiki Stretch Tablecloth Summer Luau Party Spandex Table Cover for Tropical Luau Aloha Hawaii Party Beach Pool Carnival Decoration Supplies,N/A,$29.99,,5.0,2.0,False,https://m.media-amazon.com/images/I/71Ob7nnThkL._AC_UL320_.jpg,https://m.media-amazon.com/images/I/71Ob7nnThkL._AC_SL1500_.jpg,,2026-04-23T12:06:00.272957,
58,1,Title,,,,"Debug info copied.SponsoredJanlaugh 8 Pcs Tiki Totem Box Decor with Light, Luau Party Decorations fo",,,,,,False,,,,2026-04-23T12:06:00.273758,
59,1,Title,,,,Related searchesluau party suppliesluau party favorsleis for luau partyhawaiian themed party decorat,,,,,,False,,,,2026-04-23T12:06:00.274578,
60,1,Title,,,,Previous123...7Next,,,,,,False,,,,2026-04-23T12:06:00.274885,
61,1,SB,1.0,,,N/A,https://aax-us-east-retail-direct.amazon.com/x/c/JKXkSjSraArsdDc0WKUFQxEAAAGduIQb7QEAAAH2AQBvbm9fdHhuX2JpZDYgICBvbm9fdHhuX2ltcDIgICBrSQMt/clv1c_ek-YBAHWFbbezDI3YotcKUShqhZWsFzjT1eceAhCt-f2wXbhhrtpsQs4Y2HJAHm5LlL-cyaMsyjjDmKqnhOXEasFpl9kdXvVaC2NTmkJ3Nc2g8ztMdXvcV_ZIf1s0poBJ2wYNndACjnzqUzInVaHMvpAoc9MFlTvuuTF3TOSjCQcWGArEhUjbvYAlIE4tuB501qROeHHfkVI1vnTtFLwQkbCS0rfVR_jtkcH-2X32b-hK0mOK75wCug2fJ85CWvVPeM2lrgq-_5j1fYv0cynYyet8yS7aJUA_m6gLTlCarSZpEXUXVMYR-j6z-qtTXqyWlFc4bDAePy1GN-CCX3RMs1ByfnO0qToCsRNj_gkF7Bm8a3hpO17n19IcrK_rvFMjkR9jBmOEGnWvAx9imWF5KnjOfGrJ4e5V_4T55n-97-Ywc_tu4CeuyuufN5VBg_7etA1q_R6F3cPpMaQKzMoxzaBiJXXonQeDRsGTQFxddkv7YslxUxLXaturZlyPN6CRObealQ7xAJdRSp7RWnBfbD7TtW1TRutnhtSvs549Pr8NwxnnpGrZH6hB0lm1d9cc5LRyHjkBmFfhLkDL8c6IAwIkWljfOjYFEDcBj78u4g4ILLwsg4PH1P8PDngt_C-0dYNmBeMyWgWKLcjVEglv_xZojpn4Zc8TDpN6NuXljzkYotrNixZeqB07bI-pxTKO_eRNOPgIwBDLJuooiz9UqVwKPqVC6Yh30X82EYDGUjaNaAxWuAfp2Cd8DphLThvbdHeIptXM-sMHihGob_-zDQnzFcEO8Av1baSYm7mJHSjCwclOG9ACgetWQjdX8n5oS2zhaPqWUs4NXZDfSOFiRW5j6nm3QN56em1olVTrGsj72IR9SenA_O__kTp2IRV5oxkTpo0YSq1Ik-IBI9x-GowXGcV6Jysbw0rY1ivyl_YhPKZB4ozgdzr8Yk_APaFGOrZTK0t5AdwaqWKQjyR_Y-nQq-p1OVZwUtd9N4PK2Y1id82FFgiMEXtqGQg9oZbP6ZH_MQDTXBEap7mdpBPOiEkHM90iMGshcvw_Od9x-USwaZdJcGQH3RSf1rBbGSyjiRHynSFeIinPrIP5Gsgn_dYi-szI9HEYFn3CItIaAh3l7D_2v6D8UkKP87giiKuEs5IWWCDVMsv8Ap7ADZ0ENnNFjufX7mWtwPWeGrt4rJVoovqaUsCtl-5Lq4EIVR4lDHdSUIoMMYmnE2GCen38TirYNLMCPwwe0K4xbsVfkYoDP0Sn9OBYJjU9hiKogepv5Nwc7CgxqM2QH5PdfO5PF1ZpJlQbjHOjJW4z8UID06pqhzp0BXiqWtJt19of_O-SWKcVCgRPC6MnxVsw3IY1zdink-bcmgRXg6GlUXstXR8-7gcs9y1AnyOcZMdX1VK3Tz-yff4YvHuaSoaZhPXVTh4D5td0I8-TxJIW2eQ0XV-FfH0QhTDt8VIVUCRRyTVqV1ZLzO9mSmyZ_GwYdUJchoM-pUAOVWH4wq1m-BaFqFBugwez7ZJs-tzdhECpY0jSBphpa7jqwCTg9htUQCxG5ycNYCeXfVrmrp0Ya2tlEtrQmoeTffxViswlxMWl5bs82XaxSpnxSFYxXb5_aaYt7_RWElYFPe9vQEAy7bbCEPN_MTIo0-Vv0Wza-Us/https://www.amazon.com/stores/page/C2BD9D6C-9291-4DC0-A53D-F4D8A85AD55B/?_encoding=UTF8&store_ref=SB_A0999774353PCQ5Z5KWBD-A0564794FFF599S4ZH47&pd_rd_plhdr=t&aaxitk=58223d45b813006745ff0d9f14a9234c&hsa_cr_id=0&lp_asins=B07QS3Q5NQ%2CB0B2523KN7%2CB0C7KZ4K6V&lp_query=luau%20party%20decorations&lp_slot=desktop-hsa-3psl&ref_=sbx_be_s_3psl_mbd_mb0_bkgd&pd_rd_w=KZ8wR&content-id=amzn1.sym.cd7c548b-a599-426f-9ffe-daa1aa803c87%3Aamzn1.sym.cd7c548b-a599-426f-9ffe-daa1aa803c87&pf_rd_p=cd7c548b-a599-426f-9ffe-daa1aa803c87&pf_rd_r=G4F4VCXWGVH67F0FKN6A&pd_rd_wg=E8kgW&pd_rd_r=f50826f4-db01-4034-96b2-75091648f0a2,,,,,False,,,N/A,2026-04-23T12:06:00.278157,
62,1,Title,,,,Need help?Visit the help sectionorcontact us,,,,,,False,,,,2026-04-23T12:06:00.278928,
0,2,SB_Video,2.0,,,N/A,N/A,,,,,False,,,,2026-04-23T12:06:15.011922,1.0
1,2,Title,,,,ResultsCheck each product page for other buying options. Price and other details may vary based on p,,,,,,False,,,,2026-04-23T12:06:15.013181,
3,2,Organic,,49.0,B088NBDQWF,"3 Pack Hawaiian Luau Tablecloths for Party Decoration, Hawaii Disposable Plastic Rectangular Table Covers, Aloha Tropical Palm Leaves Table Cloth, Summer Beach Kids Birthday Cocktail Party Supplies",N/A,$6.78,,4.7,2827.0,False,https://m.media-amazon.com/images/I/713DQX5GfnL._AC_UL320_.jpg,https://m.media-amazon.com/images/I/713DQX5GfnL._AC_SL1500_.jpg,,2026-04-23T12:06:15.019847,
4,2,Organic,,50.0,B0F3XJFSKZ,Hawaiian Luau Party Decorations Set: Aloha Theme Table Decoration with Luau Honeycomb Centerpiece for Tiki and Luau Hawaiian Party Supplies,N/A,$9.98,,4.7,1151.0,False,https://m.media-amazon.com/images/I/81Zd6FMFEzL._AC_UL320_.jpg,https://m.media-amazon.com/images/I/81Zd6FMFEzL._AC_SL1500_.jpg,,2026-04-23T12:06:15.024265,
5,2,Organic,,51.0,B0GFSHXNYL,"72 Pcs Tropical Luau Party Tableware Supplies, 9&7 Inch Aloha Hawaiian Disposable Dinnerware Paper Plates with Napkins and Disposable Plastic Forks for Hawaiian Tropical Summer BBQs Birthday Supplies",N/A,$9.99,,,,False,https://m.media-amazon.com/images/I/816ZljyDArL._AC_UL320_.jpg,https://m.media-amazon.com/images/I/816ZljyDArL._AC_SL1500_.jpg,,2026-04-23T12:06:15.029965,
6,2,Title,,,,Fovths 2 Packs Luau Grass Table Skirt Fringe Straw Grass Skirt 108 x 30 Inch Hibiscus Hawaiian Table,,,,,,False,,,,2026-04-23T12:06:15.030872,
7,2,Title,,,,More results,,,,,,False,,,,2026-04-23T12:06:15.031028,
8,2,Organic,,52.0,B0DP4H4M21,"28 Pack 12 Inch Rainbow Beach Balls Bulk, Inflatable Swimming Pool Toys Beach Ball for Kids Birthday Party Favors Outdoor Summer Games Hawaiian Tropical Luau Themed Pool Party Decorations",N/A,$18.99,,4.2,37.0,False,https://m.media-amazon.com/images/I/71P91pSBUGL._AC_UL320_.jpg,https://m.media-amazon.com/images/I/71P91pSBUGL._AC_SL1500_.jpg,,2026-04-23T12:06:15.034254,
9,2,Organic,,53.0,B0C2YXSRJJ,Luau Birthday Party Decorations 321Pcs Hawaiian Tropical Aloha Party Supplies for Summer Beach Holiday Disposable Dinnerware Set (24 Guest) Table Skirt Straws Backdrop Banner Balloon Garland Kit,N/A,$29.99,,4.3,194.0,False,https://m.media-amazon.com/images/I/912koq4+I3L._AC_UL320_.jpg,https://m.media-amazon.com/images/I/912koq4+I3L._AC_SL1500_.jpg,,2026-04-23T12:06:15.038069,
10,2,Organic,,54.0,B000W0INYS,Luau Pig Centerpiece,N/A,$6.71,,4.5,1002.0,False,https://m.media-amazon.com/images/I/61O02+oStzL._AC_UL320_.jpg,https://m.media-amazon.com/images/I/61O02+oStzL._AC_SL1500_.jpg,,2026-04-23T12:06:15.043488,
11,2,Organic,,55.0,B0DLL3GNV9,CHARLENT Glitter Hibiscus Temporary Tattoos for Aloha Party Decoration - 74 Individually Sheets Glitter Hawaii Flower Tattoos for Kids Women Hawaiian Party Favors,N/A,$6.99,,4.7,241.0,False,https://m.media-amazon.com/images/I/81alKIVdmGL._AC_UL320_.jpg,https://m.media-amazon.com/images/I/81alKIVdmGL._AC_SL1500_.jpg,,2026-04-23T12:06:15.047993,
12,2,Organic,,56.0,B09BV5DH36,"QUANQIUFEI 74 Pcs 7 Kinds Artificial Palm Leaves Tropical Fake Leaves, Monstera Leaf for Safari Jungle Hawaiian Dinosaur Luau Party Table Decoration Wedding Birthday Theme Party",N/A,$12.59,,4.6,1116.0,False,https://m.media-amazon.com/images/I/91TjJ+TqKZL._AC_UL320_.jpg,https://m.media-amazon.com/images/I/91TjJ+TqKZL._AC_SL1500_.jpg,,2026-04-23T12:06:15.054204,
