data_index,page,ad_type,ad_rank,organic_rank,asin,title,url,price_current,price_list,rating_stars,rating_count,is_prime,image_small,image_large,brand_name,scraped_at,inner_products_count
13,2,Organic,,57.0,B0D4DQQ8SW,"Luau Party Decorations, Natural Hawaiian Grass Table Skirt, Flower 108 X 29.5"" Grass Skirts Tropical Luau Party Favors, Table Skirt for Luau Summer Tropical Indoor Outdoor Parties Decor Accessories",N/A,$8.98,,4.5,721.0,False,https://m.media-amazon.com/images/I/81-9j7gt+mL._AC_UL320_.jpg,https://m.media-amazon.com/images/I/81-9j7gt+mL._AC_SL1500_.jpg,,2026-04-23T12:06:15.059275,
14,2,Title,,,,Paper Jazz Toucan Tropical Party DecorationSponsored|Shop Paper JazzShop nowPrevious pageTropical Bi,,,,,,False,,,,2026-04-23T12:06:15.060782,
15,2,Title,,,,More results,,,,,,False,,,,2026-04-23T12:06:15.060922,
16,2,Organic,,58.0,B0DMW6C7XP,Affrolling 8 Pcs Hawaiian Luau Party Decoration Tiki Totem Hanging Decorations with Tassels for Aloha Hawaii Luau Tropical Birthday Party Supplies 3.3 ft Outdoor Summer Tiki Door Banner Sign Decor,N/A,$17.99,,4.6,80.0,False,https://m.media-amazon.com/images/I/91-A35Rtu8L._AC_UL320_.jpg,https://m.media-amazon.com/images/I/91-A35Rtu8L._AC_SL1500_.jpg,,2026-04-23T12:06:15.064291,
17,2,Organic,,59.0,B07S21149G,"JOYIN Toy 60 Counts Hawaiian Leis Bulk, Tropical Flower Lei Hawaiian Lei Beach Hawaii Luau Party Favors Decoration Birthday Party Supplies",N/A,$17.99,,4.6,10888.0,False,https://m.media-amazon.com/images/I/911aTPl1DwL._AC_UL320_.jpg,https://m.media-amazon.com/images/I/911aTPl1DwL._AC_SL1500_.jpg,,2026-04-23T12:06:15.068370,
18,2,Organic,,60.0,B0CR6SVS6X,"50pcs Hawaiian Leis Decorations, Hawaiian Leis Bulk Flower Necklaces Luau Party Decor, Colorful Hula Dance Celebration Tropical Summer Beach Pool Parties, Hawaiian Flower Leis for Party Favors Decor",N/A,$19.99,,4.5,2717.0,False,https://m.media-amazon.com/images/I/9146S2M6KEL._AC_UL320_.jpg,https://m.media-amazon.com/images/I/9146S2M6KEL._AC_SL1500_.jpg,,2026-04-23T12:06:15.073998,
19,2,Organic,,61.0,B09MNDW992,Sggvecsy 82 Pieces 8 Kinds Artificial Tropical Palm Leaves Tropical Leaves Monstera Leaves Safari Jungle Leaf with Stems for Hawaiian Luau Party Beach Table Wedding Shower Birthday Theme Decorations,N/A,$12.51,,4.7,1463.0,False,https://m.media-amazon.com/images/I/91YZQCQL+fL._AC_UL320_.jpg,https://m.media-amazon.com/images/I/91YZQCQL+fL._AC_SL1500_.jpg,,2026-04-23T12:06:15.079148,
20,2,Organic,,62.0,B0B2P18C1J,"Paxcoo 50pc Umbrella Straws for Cocktails, Tropical Hawaiian Luau Party Decorations (Assorted Colors)",N/A,$7.99,,4.6,1094.0,False,https://m.media-amazon.com/images/I/71PMm6c2CXL._AC_UL320_.jpg,https://m.media-amazon.com/images/I/71PMm6c2CXL._AC_SL1500_.jpg,,2026-04-23T12:06:15.083472,
21,2,Organic,,63.0,B0GJYSJZW1,"4Pcs Tiki Party Decorations Wooden Tiki Totem Table Sign Decor, Hawaiian Luau Party Decorations Tropical Aloha Wooden Table Centerpieces for Tables Summer Beach Party Decorations",N/A,$9.99,,5.0,1.0,False,https://m.media-amazon.com/images/I/716CDlQeceL._AC_UL320_.jpg,https://m.media-amazon.com/images/I/716CDlQeceL._AC_SL1500_.jpg,,2026-04-23T12:06:15.087060,
22,2,Organic,,64.0,B0B74GD77G,[200 Pcs] Cocktail Drink Umbrella Picks Toothpicks - Colorful Paper Toothpicks Cocktail Umbrellas for Luau Parasols Hawaiian Tiki Party Decorations,N/A,$9.99,,4.6,611.0,False,https://m.media-amazon.com/images/I/810EAn3uYAL._AC_UL320_.jpg,https://m.media-amazon.com/images/I/810EAn3uYAL._AC_SL1500_.jpg,,2026-04-23T12:06:15.090505,
23,2,Organic,,65.0,B005G7Z9P8,"Beistle Plastic Aloha Door Cover for Luau and Beach Parties, 30"" x 5', Multicolor, 1 Pkg",N/A,$8.17,,4.6,2702.0,False,https://m.media-amazon.com/images/I/717pRRpwtOL._AC_UL320_.jpg,https://m.media-amazon.com/images/I/717pRRpwtOL._AC_SL1500_.jpg,,2026-04-23T12:06:15.094395,
24,2,Organic,,66.0,B0924DP5F7,"JOPHMO Tropical Luau Party Decoration Pack Hawaiian Beach Theme Party Favors Luau Party Supplies (112 PCS) including Banner, Table Skirt, Straws, Flamingo, Pineapple Décors.",N/A,$18.99,,4.6,1532.0,False,https://m.media-amazon.com/images/I/81jpEhFG8+L._AC_UL320_.jpg,https://m.media-amazon.com/images/I/81jpEhFG8+L._AC_SL1500_.jpg,,2026-04-23T12:06:15.098238,
25,2,Organic,,67.0,B07F5G8MRN,"24 Pack Hawaiian Flower Hair Clips, 2.5 Inch Plumeria Foam Hair Accessories Clip for Women, Hawaii Tropical Party Decorations, Beach Pool Vacation Outfit, Luau Party Supplies favors, Bridal Wedding",N/A,$13.87,,4.6,1128.0,False,https://m.media-amazon.com/images/I/71XY-jJcMHL._AC_UL320_.jpg,https://m.media-amazon.com/images/I/71XY-jJcMHL._AC_SL1500_.jpg,,2026-04-23T12:06:15.103598,
26,2,Organic,,68.0,B0BRXV8GWZ,"153Pcs Hawaiian Aloha Luau Party Decorations, Tropical Summer Beach Birthday Supplies Grass Table Skirt Hanging Swirl Aloha Balloon Garland Honeycomb Centerpiece Hibiscus Palm Leaves Straws CakeTopper",N/A,$18.99,,4.6,203.0,False,https://m.media-amazon.com/images/I/9112rYW9iiL._AC_UL320_.jpg,https://m.media-amazon.com/images/I/9112rYW9iiL._AC_SL1500_.jpg,,2026-04-23T12:06:15.109547,
27,2,Organic,,69.0,B0GK78K2PG,4 Pcs Luau Party Decorations Wooden Table Decorations Tiki Bar Aloha Table Centerpieces Tropical Luau Welcome Wood Signs Hawaiian Party Decorations for Summer Beach Party Decor,N/A,$8.99,,5.0,2.0,False,https://m.media-amazon.com/images/I/81-K-trRRXL._AC_UL320_.jpg,https://m.media-amazon.com/images/I/81-K-trRRXL._AC_SL1500_.jpg,,2026-04-23T12:06:15.113445,
28,2,Organic,,70.0,B09G98NBM1,Tropical Luau Party Decoration Pack Hawaiian Beach Theme Party Flamingo Pineapple Décors Multi Scene Luau Party Supplies (135pcs) Happy Birthday & Aloha Felt Banner Table Skirt Disposable Tablecloth,N/A,$24.79,,4.6,982.0,False,https://m.media-amazon.com/images/I/81HD2FwDE8L._AC_UL320_.jpg,https://m.media-amazon.com/images/I/81HD2FwDE8L._AC_SL1500_.jpg,,2026-04-23T12:06:15.117631,
29,2,Organic,,71.0,B07DCNJDMK,"Inflatable Palm Tree Decoration, 2 Pack Jumbo Coconut Trees Beach Backdrop Favor Tropical Blow Up Hawaiian Summer Party Decor for Hawaiian Luau Party Decoration",N/A,$13.99,,3.8,1145.0,False,https://m.media-amazon.com/images/I/61dX1IbRPCL._AC_UL320_.jpg,https://m.media-amazon.com/images/I/61dX1IbRPCL._AC_SL1500_.jpg,,2026-04-23T12:06:15.122177,
30,2,Organic,,72.0,B0B31TR4QQ,"Hotop 9 Pcs Hawaii Luau Party Decorations Honeycomb Centerpieces, Aloha Tropical Theme Table Decorations Tiki Centerpieces for Hawaii Luau Table Decor Tiki Tropical Centerpiece Party Supplies",N/A,$8.49,,4.2,238.0,False,https://m.media-amazon.com/images/I/81Hy15ZKmUL._AC_UL320_.jpg,https://m.media-amazon.com/images/I/81Hy15ZKmUL._AC_SL1500_.jpg,,2026-04-23T12:06:15.125602,
31,2,Organic,,73.0,B0C249C6VB,"UJOYANT 323 Luau Party Decorations, Hawaiian Party Decorations Kit For Adults - ""ALOHA""&""HAPPY BIRTHDAY"" Banner, Balloons, Cake Topper, Straws, Table Skirt, Dinnerware Set For 25 Guests",N/A,$29.99,,4.6,1114.0,False,https://m.media-amazon.com/images/I/81DwNS6Nf2L._AC_UL320_.jpg,https://m.media-amazon.com/images/I/81DwNS6Nf2L._AC_SL1500_.jpg,,2026-04-23T12:06:15.129216,
32,2,Organic,,74.0,B0DXPQPDNC,"10 Pcs Hawaiian Flower Hair Clips for Women, Plumeria Hibiscus Hair Clips, Artificial Flower Clips 3.5 Inch Hair Accessories for Vacation Party Beach Seaside",N/A,$9.99,,4.5,350.0,False,https://m.media-amazon.com/images/I/716Rf59FJ6L._AC_UL320_.jpg,https://m.media-amazon.com/images/I/716Rf59FJ6L._AC_SL1500_.jpg,,2026-04-23T12:06:15.134374,
33,2,Organic,,75.0,B09CWZ5934,"American Greetings Tropical Luau Party Supplies for BBQs and All Summer Parties, Dinner Plates (36-Count)",N/A,$9.99,,4.7,602.0,False,https://m.media-amazon.com/images/I/81ZYE02QqKL._AC_UL320_.jpg,https://m.media-amazon.com/images/I/81ZYE02QqKL._AC_SL1500_.jpg,,2026-04-23T12:06:15.139243,
34,2,Organic,,76.0,B073DWVS5T,jollylife 12PCS Luau Hawaiian Grass Skirts + 12PCS Wristbands Party Decorations Hula Hibiscus Flowers Birthday Tropical Supplies,N/A,$23.99,,4.6,1575.0,False,https://m.media-amazon.com/images/I/A1k-7qllpbL._AC_UL320_.jpg,https://m.media-amazon.com/images/I/A1k-7qllpbL._AC_SL1500_.jpg,,2026-04-23T12:06:15.146396,
35,2,Organic,,77.0,B0B1V5SSMZ,Zopeal 3 Tier Hawaiian Cupcake Stand Tiki Torch Cupcake Holder Luau Theme Cake Holder Decorations Tropical Dessert Holder for Summer Pool Beach Birthday Party Supplies (1 Pack),N/A,$7.99,,4.5,798.0,False,https://m.media-amazon.com/images/I/7177p7-g+GL._AC_UL320_.jpg,https://m.media-amazon.com/images/I/7177p7-g+GL._AC_SL1500_.jpg,,2026-04-23T12:06:15.151459,
36,2,Organic,,78.0,B0F2H1SNRH,NatNarr 2 Pack Hawaiian Cupcake Stand Luau Party Decorations Luau Cupcake Stand Hawaiian Party Decorations 3 Tier Tiki Cake Holder Tropical Birthday Supplies for Summer Pool Beach Decoration,N/A,$9.99,,4.6,354.0,False,https://m.media-amazon.com/images/I/819UhRtpSKL._AC_UL320_.jpg,https://m.media-amazon.com/images/I/819UhRtpSKL._AC_SL1500_.jpg,,2026-04-23T12:06:15.155097,
37,2,Organic,,79.0,B0CTMDH9PS,Kochorie 120 Pieces Hawaii Plastic Dessert Cups 9oz Disposable Luau Party Cups with 200 Spoons Clear Appetizer Tropical Cups Shot Glasses Parfait Cups for Summer Luau Tiki Beach Pool Party Supplies,N/A,$23.99,,4.6,9.0,False,https://m.media-amazon.com/images/I/919Kb8Aj3uL._AC_UL320_.jpg,https://m.media-amazon.com/images/I/919Kb8Aj3uL._AC_SL1500_.jpg,,2026-04-23T12:06:15.158590,
38,2,Organic,,80.0,B0DYMYQLP8,Summer Hawaiian Beach Backdrop 7x5Ft Tropical Flower Luau Backdrops for Photoshoot Coconut Tree Blue Ocean Surfboard Background for Luau Aloha Hawaiian Beach Party Decoration Banner 84×60inch,N/A,$11.99,,4.8,11.0,False,https://m.media-amazon.com/images/I/81nzWQa+S5L._AC_UL320_.jpg,https://m.media-amazon.com/images/I/81nzWQa+S5L._AC_SL1500_.jpg,,2026-04-23T12:06:15.162638,
39,2,Organic,,81.0,B0CDLDXLND,Nitial 48 Pcs Hibiscus Party Paper Food Trays Disposable Luau Party Food Boats Hawaiian Themed Decorations 5 lb Hawaiian Tray for Hibiscus Tropical Theme Supplies,N/A,$17.99,,4.5,99.0,False,https://m.media-amazon.com/images/I/91pK4OOlDiL._AC_UL320_.jpg,https://m.media-amazon.com/images/I/91pK4OOlDiL._AC_SL1500_.jpg,,2026-04-23T12:06:15.166305,
40,2,Organic,,82.0,B08ZKM192M,"117Pcs Tropical Balloons Arch Garland Kit, Hot Pink Green Rose Gold Confetti Balloons Palm Leaves & 5Tools for Tropical Hawaii Aloha Luau Flamingo Theme Birthday Party Baby Shower Wedding Decorations",N/A,$12.99,,4.6,831.0,False,https://m.media-amazon.com/images/I/81Jn1U6b0bS._AC_UL320_.jpg,https://m.media-amazon.com/images/I/81Jn1U6b0bS._AC_SL1500_.jpg,,2026-04-23T12:06:15.169547,
41,2,Organic,,83.0,B0BRQ3RVW7,"Unittype 12 Pcs Hawaiian Raffia Skirts Bulk, Elastic Hibiscus Flowers Luau Hula Skirt for Beach Party Costume(Straw Color)",N/A,$28.99,,4.3,183.0,False,https://m.media-amazon.com/images/I/91hYJv8WGlL._AC_UL320_.jpg,https://m.media-amazon.com/images/I/91hYJv8WGlL._AC_SL1500_.jpg,,2026-04-23T12:06:15.173857,
42,2,Organic,,84.0,B0GKNL7PMH,"Flamingo Hawaiian Party Decorations, Luau Party Decor Flamingo and Pineapple Honeycomb Ball Paper Lanterns for Birthday Pool Summer Tropical Beach Party Supplies",N/A,$13.99,,4.8,22.0,False,https://m.media-amazon.com/images/I/81qvfkmXqHL._AC_UL320_.jpg,https://m.media-amazon.com/images/I/81qvfkmXqHL._AC_SL1500_.jpg,,2026-04-23T12:06:15.177551,
43,2,Organic,,85.0,B0DP7JDJPG,"2 Pack Inflatable Palm Trees with Exclusive Two Trunks, 5.5Ft Blow Up Palm Tree Luau Hawaiian Tropical Theme Birthday Indoor Party Decoration, Outdoor Summer Beach Pool Party Supplies Photo Prop Decor",N/A,$29.99,,3.5,40.0,False,https://m.media-amazon.com/images/I/715YSEGGkuL._AC_UL320_.jpg,https://m.media-amazon.com/images/I/715YSEGGkuL._AC_SL1500_.jpg,,2026-04-23T12:06:15.181024,
44,2,Organic,,86.0,B0DP6RSR73,"25"" Inflatable Luau Tiki Pool Toss Games, Tiki Pool Ring Toss Toys with 4 Rings for Adults Indoor Outdoor Tropical Summer Swimming Inflatable Bean Bags Toss Hawaiian Luau Party Supplie",N/A,$17.99,,4.1,383.0,False,https://m.media-amazon.com/images/I/71UwG-DbxfL._AC_UL320_.jpg,https://m.media-amazon.com/images/I/71UwG-DbxfL._AC_SL1500_.jpg,,2026-04-23T12:06:15.184300,
45,2,Organic,,87.0,B0D3TQF2TG,12Pcs Hawaiian Luau Party Table Decorations - Double sided Aloha Flamingo Honeycomb Centerpieces Table Decorations for Hawaiian Tiki Birthday Wedding Pool Party Supplies,N/A,$9.99,,4.4,272.0,False,https://m.media-amazon.com/images/I/81MDzrp5gcL._AC_UL320_.jpg,https://m.media-amazon.com/images/I/81MDzrp5gcL._AC_SL1500_.jpg,,2026-04-23T12:06:15.187532,
46,2,Organic,,88.0,B0GLGGZ6Y7,"Hawaiian Luau Party Decorations Supplies, Tropical Aloha Birthday Party Plates Beach Summer Holiday Flamingo Disposable Dinnerware Set, Paper Plates Cup Napkin Plastic Fork Knives Spoon, Serves 24",N/A,$16.99,,5.0,8.0,False,https://m.media-amazon.com/images/I/81YpPdreC7L._AC_UL320_.jpg,https://m.media-amazon.com/images/I/81YpPdreC7L._AC_SL1500_.jpg,,2026-04-23T12:06:15.191237,
47,2,Organic,,89.0,B0DP6NRZGV,"72"" Inflatable Palm Tree Cooler, 200+ Drinks Super Large Capacity, Pool Party Decoration, Luau Party Decor, Beach Hawaiian Birthday Party Supplies Tropical Themed Summer Outdoor Drink Cooler",N/A,$22.49,,4.3,449.0,False,https://m.media-amazon.com/images/I/71NsI-mdCGL._AC_UL320_.jpg,https://m.media-amazon.com/images/I/71NsI-mdCGL._AC_SL1500_.jpg,,2026-04-23T12:06:15.194765,
48,2,Organic,,90.0,B0FGD82PW8,"TOPCOMWW Raffia Grass Skits, 31.5 inch Luau Hula Skirt for Hawaiian Beach Party, Halloween Costume with Adjustable Waistband",N/A,$9.99,,4.2,64.0,False,https://m.media-amazon.com/images/I/81nV8WMpPBL._AC_UL320_.jpg,https://m.media-amazon.com/images/I/81nV8WMpPBL._AC_SL1500_.jpg,,2026-04-23T12:06:15.197953,
49,2,Organic,,91.0,B0DT3YY4MS,"Summer Tropical Beach Hawaiian String Lights - 30 LED 16Ft Battery Operated Tropical Flamingo Pineapple Palm Tree Lights for Luau Pool Decor, Hawaii Theme Summer Outdoor Indoor Party Decorations",N/A,$15.99,,4.5,84.0,False,https://m.media-amazon.com/images/I/81jSbSwsXXL._AC_UL320_.jpg,https://m.media-amazon.com/images/I/81jSbSwsXXL._AC_SL1500_.jpg,,2026-04-23T12:06:15.201798,
50,2,Organic,,92.0,B0CR6SRDHT,"200pcs Hawaiian Leis Bulk, Colorful Luau Party Decorations Silk Flower Leis Necklace, Tropical Hawaiian Bulk Hula Dance Party Decor, Hawaiian Flower Leis Summer Beach Pool Party Decorations Supplies",N/A,$49.99,,4.5,2717.0,False,https://m.media-amazon.com/images/I/91r3kbTPWnL._AC_UL320_.jpg,https://m.media-amazon.com/images/I/91r3kbTPWnL._AC_SL1500_.jpg,,2026-04-23T12:06:15.205592,
51,2,Organic,,93.0,B0D7XMRTYY,"Inflatable Palm Tree Cooler 60"" - 2 Pack Blow Up Palm Tree Party Cooler, Luau Hawaiian Tropical Beach Theme, Summer Swimming Pool Party Decorations - Outdoor Party Supplies - Kids Adults",N/A,$39.99,,4.1,66.0,False,https://m.media-amazon.com/images/I/61bWTgynVlL._AC_UL320_.jpg,https://m.media-amazon.com/images/I/61bWTgynVlL._AC_SL1500_.jpg,,2026-04-23T12:06:15.210523,
52,2,Organic,,94.0,B0DP21D9BL,"25pcs Hawaiian Leis Bulk,Colorful Lei Tropical Flower Necklace Hawaii Hula Dance Decor for Summer Beach Pool Luau Party Birthday Decoration Favors Supplies",N/A,$7.64,,4.2,378.0,False,https://m.media-amazon.com/images/I/812uJFjV7FL._AC_UL320_.jpg,https://m.media-amazon.com/images/I/812uJFjV7FL._AC_SL1500_.jpg,,2026-04-23T12:06:15.213594,
53,2,Organic,,95.0,B0F7HLD1S9,"12pcs Hawaiian Luau Party Decorations Set – 9.84"" x 7.08"" Tiki Totem Pole Boxes with String Lights for Aloha Signs, Bar Decor, Tropical Birthday Supplies",N/A,$23.99,,4.4,12.0,False,https://m.media-amazon.com/images/I/91bx0Jynh4L._AC_UL320_.jpg,https://m.media-amazon.com/images/I/91bx0Jynh4L._AC_SL1500_.jpg,,2026-04-23T12:06:15.217087,
54,2,Organic,,96.0,B07SPY2H5K,Elcoho 8 Pieces Grass Skirt Sunglasses Leis Necklace Bracelet Set Luau Decorations for Kids and Adults,N/A,$9.99,,4.4,1911.0,False,https://m.media-amazon.com/images/I/814mgChAUVL._AC_UL320_.jpg,https://m.media-amazon.com/images/I/814mgChAUVL._AC_SL1500_.jpg,,2026-04-23T12:06:15.220573,
56,2,Title,,,,Debug info copied.SponsoredAtonofun 72 Pack Hawaiian Luau Party Decorations Cups -14OZ Disposable Tr,,,,,,False,,,,2026-04-23T12:06:15.221597,
57,2,Title,,,,Related searchesluau party suppliesluau party favorsleis for luau partyhawaiian themed party decorat,,,,,,False,,,,2026-04-23T12:06:15.223007,
58,2,Title,,,,Previous123...7Next,,,,,,False,,,,2026-04-23T12:06:15.223514,
59,2,SB,2.0,,,N/A,https://aax-us-east-retail-direct.amazon.com/x/c/JFhyMtPFo8lu_d0q-HI_19sAAAGduIRYDwEAAAH2AQBvbm9fdHhuX2JpZDMgICBvbm9fdHhuX2ltcDIgICDLnuV-/clv1c_ek-YBPfXUrbe3DK2Z8p873dcuEa5bu-T8mcK6vOwykYRv1ycQJQ8Iz848YoC62-f6aZVDAo8CR31kKJoW_K3APFIgese9HvSaGyPzzvbXMg2j1zpOdvvT1_Zof5s0trhVRmSXtLxQHyim9t7LtcPpTAaI9mYdhXpmIx9wza8nB5fm-sU8xD_b48WHHgu_k7-1n-xILUz9xeolGEwM0rM_jkJCUZHcDoz0Dh3zD7-Nmk67YTiDqRQ6Ns2fZ5t2BPDxmv_w9NvLcAq95-BX6D4a1_y6iewqPuSneWViWF7jG876aFevRgyT06bytEJC0ljADa6BMrc8O3AMYFarMjvZLt6uo5Dt9oZ2aQEreu99br5KclbzfkozqY04cbXUYmC9rVQo6jWwem_l6NMR2Y3as0bTxJ2VX83NO6bsUcLZceLaFu6V_4thBEZ9vuF0PBvRdFP4H0zo32W5gfJdCzOeIVPnk5N4_pSghcgg15Cp7p3cEa-F6y-eytm1f8HCnz1QKUyYeek6KfyLaOOgeu8Um3kAyo5rzEcdAtQUwGo-dbM-FPSoVIoTRxKhYla1d_acJLR0PhlJmFfhIkMK7eip30Ik2njfObblcDsCD7iPIk0IrJwsu52H5H9ML2ht_TP0VKOpBlvyegW7FYDVEktz_xbIsVmwWs_TDpM6FuXll34YsprMu1ZctLjWjdy_SFRd8I0eFlx6XDarIw5qCD9UqVxKPiV5NM4ziTidW0UxhxDlG0MwtcFdHborJjDHpSM-yJsNlp_FjTEmdeGYkcD-WCL7J33Dnp2VZQZTAPwMWvxerptPYXzX9SFVcMcTZOcyJt7dSfCLQATm_BBEKPQ7Gz3_Jf7TAcawtKzK-6r4cfKVJ0NCsAWGYx6fby8c26jGdPFkmWt4aIIQKuGCqckyWyJi54kra66R9RZ2xHwIKO0o3IJAvEe93wfjDXCVcsPmF1WlqsE6FZrLZ-qGVVweqCa0nTGxzjgjFnmWCXTd8r1pfjTxk15HJzLoU389FRsmR4s_4zImlTTjrOYEJlqBCrunoLd6jpqKd6j6hA5gwrMJz37aUhEy6N8yLaJL8oV-SaupFCntDl846mXDtdLAs1toVmNX1Uh-Wdvyi_y6N8uGYyhjJx_P3OJaoZEld8CBdaEw4PG49pBZFCowAZeyDgIhMPOtNYPt_K0wR7aa6awfTJndTr9hrfcj3Jv-1nt_hnuofKGgKEyJ_51vT6QTt90kl-JpOGQs6YlKZaczUUm3qhC5eYDowP1JOqd35zOB6rXYEnrx3M09sAGF-uIMmEJWN8yOQt4wKIKz4QSAxnAjFyPxiyYBLfBcTfRZJTmdoBZbqwFjkq15vZdq7apj8cUvASq530bRBUGivBv5ZAxL2xDtQYCSgUVu-GHX66AwRd81ZfDNb5t4ITWrCxLCgyTjAz8eahVi-9XifrO9nAhMpG5-ei79uyi99XJeVLAqBI3ZTOhrEjC667VWhsiJZ3GIMaN9CKEtR2d9UeasH11U5yuyrbhknavjZ5-y3RB0MvOPz7URr91E0Npu22dy4TCo28XQAwKADQzcF9EsnV1YV8CUEAfzEgCWX6UnX3sRHzJJ3OfTwEYkALYlkZQxthE2jKAwBOVJYqm05v_XQ09O_R2nFn6EeuYYqU8R3k/https://www.amazon.com/stores/page/C2BD9D6C-9291-4DC0-A53D-F4D8A85AD55B/?_encoding=UTF8&store_ref=SB_A0999774353PCQ5Z5KWBD-A0564794FFF599S4ZH47&pd_rd_plhdr=t&aaxitk=58223d45b813006745ff0d9f14a9234c&hsa_cr_id=0&lp_asins=B07QS3Q5NQ%2CB0B2523KN7%2CB0C7KZ4K6V&lp_query=luau%20party%20decorations&lp_slot=desktop-hsa-3psl&ref_=sbx_be_s_3psl_mbd_mb0_bkgd&pd_rd_w=5kcoK&content-id=amzn1.sym.cd7c548b-a599-426f-9ffe-daa1aa803c87%3Aamzn1.sym.cd7c548b-a599-426f-9ffe-daa1aa803c87&pf_rd_p=cd7c548b-a599-426f-9ffe-daa1aa803c87&pf_rd_r=B2YBAVMJN2ECW23H0XFR&pd_rd_wg=h3wC5&pd_rd_r=30fdcb8c-0892-44d0-8b8a-0493f0d72126,,,,,False,,,N/A,2026-04-23T12:06:15.226391,
60,2,Title,,,,Need help?Visit the help sectionorcontact us,,,,,,False,,,,2026-04-23T12:06:15.226935,
0,3,SB_Video,3.0,,,N/A,N/A,,,,,False,,,,2026-04-23T12:06:33.119676,1.0
1,3,Title,,,,ResultsCheck each product page for other buying options. Price and other details may vary based on p,,,,,,False,,,,2026-04-23T12:06:33.120937,
3,3,Organic,,97.0,B07PP3ZFGP,"JOYIN 36 Packs Plastic Margarita Glasses Cups 12 oz Disposable Cinco De Mayo Fiesta Party Decoration for Fun Taco Party Supplies, Neon Cocktail Cups, Mexican Theme for Carnivals",N/A,$25.99,,4.6,1858.0,False,https://m.media-amazon.com/images/I/71hKfj1VHTL._AC_UL320_.jpg,https://m.media-amazon.com/images/I/71hKfj1VHTL._AC_SL1500_.jpg,,2026-04-23T12:06:33.124634,
4,3,Organic,,98.0,B0DQSNFTKS,"GoodUping 12 Counts Thickened Hawaiian Leis, Perfect Luau Party Supplies for Summer Beach Vacations, Essential Party Decorations for Birthday, Graduation, and Wedding Celebrations",N/A,$7.64,,4.6,159.0,False,https://m.media-amazon.com/images/I/81Aoac8gpaL._AC_UL320_.jpg,https://m.media-amazon.com/images/I/81Aoac8gpaL._AC_SL1500_.jpg,,2026-04-23T12:06:33.128544,
5,3,Organic,,99.0,B0DP6NRZGV,"72"" Inflatable Palm Tree Cooler, 200+ Drinks Super Large Capacity, Pool Party Decoration, Luau Party Decor, Beach Hawaiian Birthday Party Supplies Tropical Themed Summer Outdoor Drink Cooler",N/A,$22.49,,4.3,449.0,False,https://m.media-amazon.com/images/I/71NsI-mdCGL._AC_UL320_.jpg,https://m.media-amazon.com/images/I/71NsI-mdCGL._AC_SL1500_.jpg,,2026-04-23T12:06:33.132543,
7,3,Title,,,,Customers frequently viewedSponsoredJellyArch 4 Pcs Inflatable Surf Board 36 Inch Inflatable Pool Fl,,,,,,False,,,,2026-04-23T12:06:33.136273,
8,3,Title,,,,More results,,,,,,False,,,,2026-04-23T12:06:33.136449,
9,3,Organic,,100.0,B0CW9CMFPJ,"OHOME Luau Party Decorations - Plastic Tablecloth for Tropical Party Decorations | Hawaiian Themed Palm Leaves Summer Beach Favors Supplies,2 Pack",N/A,$5.93,,4.6,2372.0,False,https://m.media-amazon.com/images/I/81s8HD7CFCL._AC_UL320_.jpg,https://m.media-amazon.com/images/I/81s8HD7CFCL._AC_SL1500_.jpg,,2026-04-23T12:06:33.142237,
10,3,Organic,,101.0,B0DYTWX1RY,Atonofun 72 Pack Hawaiian Luau Party Decorations Cups -14OZ Disposable Tropical Party Cups for Hawaiian Luau Beach Theme Birthday Party Decorations,N/A,$19.99,,4.8,92.0,False,https://m.media-amazon.com/images/I/81WSUoKc6OL._AC_UL320_.jpg,https://m.media-amazon.com/images/I/81WSUoKc6OL._AC_SL1500_.jpg,,2026-04-23T12:06:33.145914,
11,3,Organic,,102.0,B0CB5BQXN7,Tropical Luau Balloons Arch Garland Kit Luau Party Decorations with Palm Leaves Flamingo Palm Tree Aloha Foil Balloon Coconut Balloons Set for Tropical Hawaiian Flamingo Party (Aloha-A),N/A,$21.99,,4.3,306.0,False,https://m.media-amazon.com/images/I/91C+gMfr0OL._AC_UL320_.jpg,https://m.media-amazon.com/images/I/91C+gMfr0OL._AC_SL1500_.jpg,,2026-04-23T12:06:33.149075,
12,3,Organic,,103.0,B0FDKCP34L,"Hawaiian Aloha Party Decorations,Luau Theme Party Supplies,Summer Beach Party,Tropical Birthday Party Decorations",N/A,$7.99,,5.0,7.0,False,https://m.media-amazon.com/images/I/61i2h9EpUgL._AC_UL320_.jpg,https://m.media-amazon.com/images/I/61i2h9EpUgL._AC_SL1500_.jpg,,2026-04-23T12:06:33.153046,
13,3,Organic,,104.0,B0GDDSB7HY,Tropical Luau Balloon Arch Kit 146Pcs Hot Pink Pearl Pink Green Blue Orange Gold Metallic Green Confetti Balloons with Palm Leaves for Summer Tropical Luau Hawaiian Theme Party Decorations,N/A,$9.99,,4.8,7.0,False,https://m.media-amazon.com/images/I/81qMrlT1sBL._AC_UL320_.jpg,https://m.media-amazon.com/images/I/81qMrlT1sBL._AC_SL1500_.jpg,,2026-04-23T12:06:33.156521,
14,3,Organic,,105.0,B09YRNFHV1,Luau Party Decorations Hawaiian Aloha Backdrop Banner Tropical Tiki Totem Photography Background Palm Leaf Hibiscus Flower Theme Party Supplies for Summer Hawaiian Theme Decorations,N/A,$6.74,,4.7,73.0,False,https://m.media-amazon.com/images/I/812siKChK-L._AC_UL320_.jpg,https://m.media-amazon.com/images/I/812siKChK-L._AC_SL1500_.jpg,,2026-04-23T12:06:33.159469,
15,3,Title,,,,"Janlaugh 8 Pcs Tiki Totem Box Decor with Light, Luau Party Decorations for Hawaiian Birthday Party T",,,,,,False,,,,2026-04-23T12:06:33.160719,
16,3,Title,,,,Tropical Luau Photo Prop Banner for Hawaiian PartySponsored|Shop FriendaShop nowPrevious pageFrienda,,,,,,False,,,,2026-04-23T12:06:33.162713,
17,3,Title,,,,More results,,,,,,False,,,,2026-04-23T12:06:33.162952,
18,3,Organic,,106.0,B0F1T6TJRW,"152PCS Hawaiian Luau Party Decoration, Tropical Beach Themed Party Supplies, Aloha Party Decorations, Hawaiian Leis for Summer Pool Party",N/A,$21.99,,4.6,106.0,False,https://m.media-amazon.com/images/I/91Y8lfOZf1L._AC_UL320_.jpg,https://m.media-amazon.com/images/I/91Y8lfOZf1L._AC_SL1500_.jpg,,2026-04-23T12:06:33.167489,
19,3,Organic,,107.0,B0GLGGZ6Y7,"Hawaiian Luau Party Decorations Supplies, Tropical Aloha Birthday Party Plates Beach Summer Holiday Flamingo Disposable Dinnerware Set, Paper Plates Cup Napkin Plastic Fork Knives Spoon, Serves 24",N/A,$16.99,,5.0,8.0,False,https://m.media-amazon.com/images/I/81YpPdreC7L._AC_UL320_.jpg,https://m.media-amazon.com/images/I/81YpPdreC7L._AC_SL1500_.jpg,,2026-04-23T12:06:33.170994,
20,3,Organic,,108.0,B0B2ZJGBVK,"Outus 30 Pieces Hawaiian Luau Birthday Party Hanging Swirl Decorations, Flower Tropical Palm Flamingo Sign Foil Ceiling Decor for Floral Tropical Party Summer Beach Pool Tiki Supplies(Flower)",N/A,$8.99,,4.6,1156.0,False,https://m.media-amazon.com/images/I/818L3N55TZL._AC_UL320_.jpg,https://m.media-amazon.com/images/I/818L3N55TZL._AC_SL1500_.jpg,,2026-04-23T12:06:33.173967,
21,3,Organic,,109.0,B0DT3YY4MS,"Summer Tropical Beach Hawaiian String Lights - 30 LED 16Ft Battery Operated Tropical Flamingo Pineapple Palm Tree Lights for Luau Pool Decor, Hawaii Theme Summer Outdoor Indoor Party Decorations",N/A,$15.99,,4.5,84.0,False,https://m.media-amazon.com/images/I/81jSbSwsXXL._AC_UL320_.jpg,https://m.media-amazon.com/images/I/81jSbSwsXXL._AC_SL1500_.jpg,,2026-04-23T12:06:33.177560,
22,3,Organic,,110.0,B0FGD82PW8,"TOPCOMWW Raffia Grass Skits, 31.5 inch Luau Hula Skirt for Hawaiian Beach Party, Halloween Costume with Adjustable Waistband",N/A,$9.99,,4.2,64.0,False,https://m.media-amazon.com/images/I/81nV8WMpPBL._AC_UL320_.jpg,https://m.media-amazon.com/images/I/81nV8WMpPBL._AC_SL1500_.jpg,,2026-04-23T12:06:33.180943,
23,3,Organic,,111.0,B0D1KMLLF9,Jingmore 200 Pcs Tropical Nights Hawaiian Aloha Party Supplies Serve 50 Guests Luau Paper Plates Cups Napkins for Summer Beach Tableware Pool Party,N/A,$26.99,,4.6,51.0,False,https://m.media-amazon.com/images/I/91i6-LmDHvL._AC_UL320_.jpg,https://m.media-amazon.com/images/I/91i6-LmDHvL._AC_SL1500_.jpg,,2026-04-23T12:06:33.185141,
24,3,Organic,,112.0,B0D7XMRTYY,"Inflatable Palm Tree Cooler 60"" - 2 Pack Blow Up Palm Tree Party Cooler, Luau Hawaiian Tropical Beach Theme, Summer Swimming Pool Party Decorations - Outdoor Party Supplies - Kids Adults",N/A,$39.99,,4.1,66.0,False,https://m.media-amazon.com/images/I/61bWTgynVlL._AC_UL320_.jpg,https://m.media-amazon.com/images/I/61bWTgynVlL._AC_SL1500_.jpg,,2026-04-23T12:06:33.189625,
