data_index,page,ad_type,ad_rank,organic_rank,asin,title,url,price_current,price_list,rating_stars,rating_count,is_prime,image_small,image_large,brand_name,scraped_at,inner_products_count
25,3,Organic,,113.0,B0DYVTCDCM,48 Pack 14 OZ Hawaiian Cups for Party Luau Plastic Cups Tropical Party Cups Hibiscus Hawaii Plastic Cup Disposable Hawaii Luau Decorations Aloha Party Supplies,N/A,$15.99,,4.6,30.0,False,https://m.media-amazon.com/images/I/81ZMsz0Fa6L._AC_UL320_.jpg,https://m.media-amazon.com/images/I/81ZMsz0Fa6L._AC_SL1500_.jpg,,2026-04-23T12:06:33.193396,
26,3,Organic,,114.0,B0GGZMJJJD,"Luau Party Decorations, 99Pcs Hawaiian Plates and Napkins-Serve 24 With Aloha Banner Tablecloth Disposable Luau Plates Set for Hawaiian Tropical Summer BBQ Party Decorations",N/A,$16.99,,4.7,95.0,False,https://m.media-amazon.com/images/I/81UaldmFR5L._AC_UL320_.jpg,https://m.media-amazon.com/images/I/81UaldmFR5L._AC_SL1500_.jpg,,2026-04-23T12:06:33.197163,
27,3,Organic,,115.0,B0DP21D9BL,"25pcs Hawaiian Leis Bulk,Colorful Lei Tropical Flower Necklace Hawaii Hula Dance Decor for Summer Beach Pool Luau Party Birthday Decoration Favors Supplies",N/A,$7.64,,4.2,378.0,False,https://m.media-amazon.com/images/I/812uJFjV7FL._AC_UL320_.jpg,https://m.media-amazon.com/images/I/812uJFjV7FL._AC_SL1500_.jpg,,2026-04-23T12:06:33.201181,
28,3,Organic,,116.0,B00489KLB2,Beistle Novelty Coconut Bikini Top,N/A,$8.95,,4.0,1083.0,False,https://m.media-amazon.com/images/I/617V1UUfH0L._AC_UL320_.jpg,https://m.media-amazon.com/images/I/617V1UUfH0L._AC_SL1500_.jpg,,2026-04-23T12:06:33.205895,
29,3,Organic,,117.0,B0GJD6FCKM,"Luau Party Decorations - Green Gold Rose Tropical Streamers Backdrop Banner | Hawaiian Party Decorations for Indoor Outdoor - Summer Beach Pool Birthday Favors Supplies for Home Wall,2 Pack",N/A,$3.99,,4.3,892.0,False,https://m.media-amazon.com/images/I/91rmenRZKTL._AC_UL320_.jpg,https://m.media-amazon.com/images/I/91rmenRZKTL._AC_SL1500_.jpg,,2026-04-23T12:06:33.212080,
30,3,Organic,,118.0,B0FNQHM8QP,Soulchen 8.2 ft Tropical Hawaiian Inflatable Arch Summer Luau Party Decoration Monstera Leaves Tropical Flowers Inflatable Archway Outdoor Large Hawaii Birthday Party Decor for Beach Luau Pool Patio,N/A,$71.24,,4.0,1.0,False,https://m.media-amazon.com/images/I/81b604mwdpL._AC_UL320_.jpg,https://m.media-amazon.com/images/I/81b604mwdpL._AC_SL1500_.jpg,,2026-04-23T12:06:33.215631,
31,3,Organic,,119.0,B07SPY2H5K,Elcoho 8 Pieces Grass Skirt Sunglasses Leis Necklace Bracelet Set Luau Decorations for Kids and Adults,N/A,$9.99,,4.4,1911.0,False,https://m.media-amazon.com/images/I/814mgChAUVL._AC_UL320_.jpg,https://m.media-amazon.com/images/I/814mgChAUVL._AC_SL1500_.jpg,,2026-04-23T12:06:33.219054,
32,3,Organic,,120.0,B089RYGB4F,72 Pieces 10 Kinds Artificial Palm Leaves Golden Tropical Leaves with Stems Jungle Leaves Decorations for Hawaiian Luau Party Beach Baby Shower Wedding Birthday,N/A,$11.99,,4.6,2112.0,False,https://m.media-amazon.com/images/I/71Fhy+cy6+L._AC_UL320_.jpg,https://m.media-amazon.com/images/I/71Fhy+cy6+L._AC_SL1500_.jpg,,2026-04-23T12:06:33.222564,
33,3,Organic,,121.0,B0CZLBBJR6,"42pcs Luau Party Decorations Photo Booth Props Kit, Hawaiian Themed Party Supplies Tropical Photo Booth Props for Summer Beach Pool",N/A,$11.98,,4.4,55.0,False,https://m.media-amazon.com/images/I/810tbz5Z2FL._AC_UL320_.jpg,https://m.media-amazon.com/images/I/810tbz5Z2FL._AC_SL1500_.jpg,,2026-04-23T12:06:33.225963,
34,3,Organic,,122.0,B0CR6SRDHT,"200pcs Hawaiian Leis Bulk, Colorful Luau Party Decorations Silk Flower Leis Necklace, Tropical Hawaiian Bulk Hula Dance Party Decor, Hawaiian Flower Leis Summer Beach Pool Party Decorations Supplies",N/A,$49.99,,4.5,2717.0,False,https://m.media-amazon.com/images/I/91r3kbTPWnL._AC_UL320_.jpg,https://m.media-amazon.com/images/I/91r3kbTPWnL._AC_SL1500_.jpg,,2026-04-23T12:06:33.230109,
35,3,Organic,,123.0,B0BTDHRYT8,"36 Count Hawaiian Lei Bulk, Tropical Luau Hawaii Theme Silk Flower Lei, Party Favors for Beach Holiday Wedding Birthday Party, Aloha Summer Party Decorations",N/A,$9.98,,4.4,1269.0,False,https://m.media-amazon.com/images/I/91dq-UYMKiL._AC_UL320_.jpg,https://m.media-amazon.com/images/I/91dq-UYMKiL._AC_SL1500_.jpg,,2026-04-23T12:06:33.233580,
36,3,Organic,,124.0,B097DQV2ST,"Inflatable Flamingo Cooler 130+ Cans Large Capacity, Bottom Quick-Drain, Luau Party Decor, Flamingo Pool Party Decorations, Beach Hawaiian Birthday Party Supplies Tropical Themed Summer Drink Cooler",N/A,$15.99,,4.3,449.0,False,https://m.media-amazon.com/images/I/71yt6voYyEL._AC_UL320_.jpg,https://m.media-amazon.com/images/I/71yt6voYyEL._AC_SL1500_.jpg,,2026-04-23T12:06:33.237164,
37,3,Organic,,125.0,B0F7HLD1S9,"12pcs Hawaiian Luau Party Decorations Set – 9.84"" x 7.08"" Tiki Totem Pole Boxes with String Lights for Aloha Signs, Bar Decor, Tropical Birthday Supplies",N/A,$23.99,,4.4,12.0,False,https://m.media-amazon.com/images/I/91bx0Jynh4L._AC_UL320_.jpg,https://m.media-amazon.com/images/I/91bx0Jynh4L._AC_SL1500_.jpg,,2026-04-23T12:06:33.240701,
38,3,Organic,,126.0,B071H6KNHV,60pcs Luau Photo Booth Props - Hawaiian/Tropical/Tiki/Summer Pool Party Decorations Supplies (Assembly Needed),N/A,$13.98,,4.4,1406.0,False,https://m.media-amazon.com/images/I/71jsAyjGTWL._AC_UL320_.jpg,https://m.media-amazon.com/images/I/71jsAyjGTWL._AC_SL1500_.jpg,,2026-04-23T12:06:33.244777,
39,3,Organic,,127.0,B0FX2TGN7V,"Jenaai Luau Party Decoration Hawaiian Tropical Beach Party Supplies Include 2 Blue Foil Fringe Curtains, 3 Large Surfboard Coconut Tree and Hibiscus Cardboard Decor, Banner for Aloha Hawaiian Summer",N/A,$36.99,,5.0,1.0,False,https://m.media-amazon.com/images/I/91Yjvq25xtL._AC_UL320_.jpg,https://m.media-amazon.com/images/I/91Yjvq25xtL._AC_SL1500_.jpg,,2026-04-23T12:06:33.248448,
40,3,Organic,,128.0,B07Q84Z49D,"PHOGARY 8 Pack Hula Skirt Costume Kit for Hawaii Luau Party - Dancing Hula with Flower Bikini Top, Hawaiian Lei",N/A,$9.99,,4.3,3336.0,False,https://m.media-amazon.com/images/I/8168AnksDBL._AC_UL320_.jpg,https://m.media-amazon.com/images/I/8168AnksDBL._AC_SL1500_.jpg,,2026-04-23T12:06:33.252598,
41,3,Organic,,129.0,B0CR6RXWT1,"100pcs Luau Party Decorations, Silk Hawaiian Leis Tropical Flower Necklaces, Colorful Hula Dance Bulk Leis Decor, Flower Hawaiian Leis for Summer Beach Pool Theme Party Decorations Favors Supplies",N/A,$35.99,,4.5,2717.0,False,https://m.media-amazon.com/images/I/91Qb2mxWFxL._AC_UL320_.jpg,https://m.media-amazon.com/images/I/91Qb2mxWFxL._AC_SL1500_.jpg,,2026-04-23T12:06:33.256663,
42,3,Organic,,130.0,B0C7N7XKZP,"GoodUping 18 Counts Hawaiian Leis, Flower Hair Clip, Headbands and Wristbands, Perfect Luau Party Supplies for Summer Beach Vacations, Essential Party Decorations for Birthday, Graduation, and Wedding",N/A,$7.62,,4.5,469.0,False,https://m.media-amazon.com/images/I/91pK50dq7AL._AC_UL320_.jpg,https://m.media-amazon.com/images/I/91pK50dq7AL._AC_SL1500_.jpg,,2026-04-23T12:06:33.261997,
43,3,Organic,,131.0,B0GLM9VN94,"16Pcs Hawaiian Luau Party Decorations, Tiki Totem Box Decor with Lights for Tropical Birthday, 7.9"" Lighted Tiki Bar Decor for Outdoor Patio Porch, Survivor Themed Party Supplies Aloha Party",N/A,$29.99,,4.0,1.0,False,https://m.media-amazon.com/images/I/81WQnuppc1L._AC_UL320_.jpg,https://m.media-amazon.com/images/I/81WQnuppc1L._AC_SL1500_.jpg,,2026-04-23T12:06:33.265872,
44,3,Organic,,132.0,B0GL2LWBF7,"HOFASON 24 Pcs Girls Grass Skirt Hawaiian Luau Hula Skirts Bulk for Party Decorations Favors Supplies, Girls Kids Tropical Hibiscus Flowers Grass Skirt for Beach Luau Party, Birthday, Celebration",N/A,$23.99,,,,False,https://m.media-amazon.com/images/I/81F+YbfyMBL._AC_UL320_.jpg,https://m.media-amazon.com/images/I/81F+YbfyMBL._AC_SL1500_.jpg,,2026-04-23T12:06:33.269139,
45,3,Organic,,133.0,B0DT1LH41Z,"Atonofun 60 Counts Leis for Luau Party, Hawaiian Leis Bulk Decorations Colorful Tropical Flower Necklace Hawaiian Garland for Kids Adults Hawaiian Beach Luau Party Favors Supplies",N/A,$21.99,,4.8,77.0,False,https://m.media-amazon.com/images/I/81p6bCYa3PL._AC_UL320_.jpg,https://m.media-amazon.com/images/I/81p6bCYa3PL._AC_SL1500_.jpg,,2026-04-23T12:06:33.272806,
46,3,Organic,,134.0,B094FWNW67,"30 Pieces Tropical Birds Decorations, Tropical Hawaiian Toucan Parrot Party Hanging Swirl Foil Ceiling Decor for Summer Luau Hawaiian Beach Pool Tiki Wedding Birthday Party Supplies",N/A,$9.49,,4.4,655.0,False,https://m.media-amazon.com/images/I/81Pz5cUv4tS._AC_UL320_.jpg,https://m.media-amazon.com/images/I/81Pz5cUv4tS._AC_SL1500_.jpg,,2026-04-23T12:06:33.276680,
47,3,Organic,,135.0,B0FT8TRL9V,"RainMeadow Premium Luau Birthday Party Decorations Set for 25 guests - Hawaiian Theme with Aloha Banner, Balloons, Flamingo, Tableware - Tropical Luau Party Supplies",N/A,$30.99,,4.7,178.0,False,https://m.media-amazon.com/images/I/91dcWz5xPZL._AC_UL320_.jpg,https://m.media-amazon.com/images/I/91dcWz5xPZL._AC_SL1500_.jpg,,2026-04-23T12:06:33.281816,
48,3,Organic,,136.0,B0D2TQF1SQ,"JCFIRE Summer Pool Beach Party Favors Kids Tattoos, 102 Styles Larger Tropical Hawaiian Luau Themed Temporary Tattoos for Kids Teens Adult, Waterproof Summer Stickers Party Decorations Supplies",N/A,$5.99,,4.7,953.0,False,https://m.media-amazon.com/images/I/71KUi4pTJkL._AC_UL320_.jpg,https://m.media-amazon.com/images/I/71KUi4pTJkL._AC_SL1500_.jpg,,2026-04-23T12:06:33.286269,
49,3,Organic,,137.0,B0DRJKZJZH,Hawaiian Leis Flower Crown - Artificial Tropical Flower Headpiece Hawaii Floral Headband with Ribbon Lei Luau Dress Up Hair Accessories for Luau Party Costume Beach Pool Vacation Decorations,N/A,$13.99,,4.4,137.0,False,https://m.media-amazon.com/images/I/81zSbZrq8kL._AC_UL320_.jpg,https://m.media-amazon.com/images/I/81zSbZrq8kL._AC_SL1500_.jpg,,2026-04-23T12:06:33.290156,
50,3,Organic,,138.0,B07TPM16SN,"100Pcs Palm Leaves Artificial Tropical Monstera Plant Fake Leaves Safari Birthday Decorations,Jungle Theme Party Supplies,Faux Green Leaf for Hawaiian Luau Tiki Aloha Beach BBQ Table Decoration 3 Size",N/A,$14.99,,4.8,1754.0,False,https://m.media-amazon.com/images/I/71DhBZx+OZL._AC_UL320_.jpg,https://m.media-amazon.com/images/I/71DhBZx+OZL._AC_SL1500_.jpg,,2026-04-23T12:06:33.294475,
51,3,Organic,,139.0,B0G9LMDG2C,"63'' Inflatable Palm Tree Cooler, Pool Party Decorations, Inflatable Cooler for Hawaiian Luau Tropical Summer Party Supplies, Beach Theme Party Decoration",N/A,$19.99,,4.6,8.0,False,https://m.media-amazon.com/images/I/81RVsKnqx8L._AC_UL320_.jpg,https://m.media-amazon.com/images/I/81RVsKnqx8L._AC_SL1500_.jpg,,2026-04-23T12:06:33.297481,
52,3,Organic,,140.0,B0BY4BHXVZ,"60 Pcs Hawaiian Luau Hula Skirts Decorations, Hawaiian Grass Skirts Leis Necklaces Bracelets for Tropical Beach Holiday Decorations Tropical Themed Dance",N/A,$23.86,,4.5,185.0,False,https://m.media-amazon.com/images/I/91bZUuPj29L._AC_UL320_.jpg,https://m.media-amazon.com/images/I/91bZUuPj29L._AC_SL1500_.jpg,,2026-04-23T12:06:33.301136,
53,3,Organic,,141.0,B0BX2MXBH1,Giegxin Natural Raffia Grass Skirts Tropical Luau Hula Skirt for Adults Women Men Hawaiian Party Costume Beach,N/A,$36.99,,3.7,434.0,False,https://m.media-amazon.com/images/I/91mtMion7dL._AC_UL320_.jpg,https://m.media-amazon.com/images/I/91mtMion7dL._AC_SL1500_.jpg,,2026-04-23T12:06:33.305147,
54,3,Organic,,142.0,B0GKG7M8VG,"24PCS Hawaiian Party Decorations, Hawaiian Cardboard Glasses Bulk, Luau Party Sunglasses Frame Tropical Dress Pool Props Accessories, Hawaii Carnival Summer Pool Party Decorations for Women Men",N/A,$14.99,,4.7,22.0,False,https://m.media-amazon.com/images/I/91mMAZ6XzEL._AC_UL320_.jpg,https://m.media-amazon.com/images/I/91mMAZ6XzEL._AC_SL1500_.jpg,,2026-04-23T12:06:33.308732,
55,3,Organic,,143.0,B0F9Y9SJNZ,"50 Counts Hawaiian Leis Bulk Decorations, Leis for Luau Party Hawaiian Colorful Tropical Flower Lays for Adults Hawaii Summer Beach Luau Party Favors Birthday Party Supplies",N/A,$19.99,,4.8,41.0,False,https://m.media-amazon.com/images/I/81QW9MLaIaL._AC_UL320_.jpg,https://m.media-amazon.com/images/I/81QW9MLaIaL._AC_SL1500_.jpg,,2026-04-23T12:06:33.313727,
56,3,Organic,,144.0,B0CY8QPXXG,"Tropical Napkins, Hawaiian Tropical Decoration 40pcs Luau Paper Floral Hibiscus Hawaiian Napkins For Summer Luau Party Supplies",N/A,$9.99,,4.1,67.0,False,https://m.media-amazon.com/images/I/81Es+QSvYsL._AC_UL320_.jpg,https://m.media-amazon.com/images/I/81Es+QSvYsL._AC_SL1500_.jpg,,2026-04-23T12:06:33.317330,
58,3,Title,,,,Debug info copied.SponsoredBaquler 24 Pcs Hawaiian Luau Party Decoration Tiki Totem Box Decor with L,,,,,,False,,,,2026-04-23T12:06:33.318175,
59,3,Title,,,,Related searchesluau party suppliesluau party favorsleis for luau partyhawaiian themed party decorat,,,,,,False,,,,2026-04-23T12:06:33.319029,
60,3,Title,,,,Previous1234...7Next,,,,,,False,,,,2026-04-23T12:06:33.319372,
61,3,SB,3.0,,,N/A,https://aax-us-east-retail-direct.amazon.com/x/c/JMGRWCOOMVqs43pWZ_yNGHUAAAGduISeLwEAAAH2AQBvbm9fdHhuX2JpZDMgICBvbm9fdHhuX2ltcDEgICBoP1wM/clv1c_ek-YBAfWUsbaHX0mJsprB16WtD5hrqCqvMehQxyzKzAtjLteQUdV81bbccgXyj-EUyxUZBoqFzDkdhdvRPYoUACOoAwT9h_uF3Avj62BVO0-jXT1Hlww_Ll44PIUlhPxa-mXR89bHhiTIcLBsu4x79RLodiA_pXqu2WySzS-9havGOiUhQ_mnpuNq1GuCwXr2rbwkENAPRvQpb0tNsmt4OMREV0lngyUT5Kf6W3i37T7RBUuKn66kD8lVGWpCS6GAydL_vDa_rrUyjjzKWAo9Q5pnWdzs_7CaiygziPfYnyZE-HDyyyAqf61PrloXghc2Z6lBD01tvtAI03Hsc2fJHS9Y13Dysndg_m1J2REzOT4lKJNCtOIK0HKAfE2cb0H3XgniToMT-smnVu322rHHlj3-WkVhcnZ-lRFv3rTJ1BWZkiZsyFSYQiu-1TYVrxceGdS1Gq4NiHoDOHg_nzjBcIJtcklK-dLo4MvIyCMcheFv7IvUiSQ8jl4jGo-GPXdn1TaMhW3SPSOKt1TCjdeXYmZVVW-rF7G1YA6nPXdAb3g0dwty_z9mK30Ynnj0CZrAKKPd397F-h6jDQn8NjuxkPIrtc6Qh8M1Vz8_6yGLBiLYU5InZ7JYlYA5gZSZ3-ka98lIAkGp9wbi5I-5Cr3i0wE3e5MBCI9lGVNTVgYJ8oDImveEZuAu7Rw7-w9LTrAuMlrhPUBUYB2WkfSPjpMmKB2K1Oe-QFKSkSsZXlneuQfm6YcIbdtote9ihkSZpYk2evynZc3RG5YWnJswXaoTNhuKjAHVTpMLq4jj5pYv-MTTbGF1YCevi8JGozX8wYdWs1OoXST-62b4vncq2iktKKPq-QTLzRGcfhRcHHB2MwT1bf9TkJGSEYzXXzUAmN42H_4Oe0qschz8bJ6vFC93ZY9epWREN0286Ftt9Rg9Ql5-aWImjIK5zALRc8KzAy94VxrEKXikOSzt4YBTk5UanBUULMDYTWovwkkVdGN4uJwmnW-Dbi4IfEEty0CzSBY7Wgwv_FKO54AfBDVjIENMQ0zH4VS8yHIAIlqJQQygcRqfSCItwuH4GFG74zmMnVBEBlc1s-Yg9WYKhA7hjPNVOhuQlAfovTsnB6RahvsfmWzKuIVZAtTazU52cUEKEsDW5Y1N-nWvHFBBkyjyT7NivIEJzgiJj6NtrQfXKpoiLjgyLPsiHyVcqL1Hd6AG6tXtBOu_uNgGhGYoFpUpnCnhQqCpRkIi2w_sbrQuK5tfTlixZQcFmmiArh0AcaMmPMhyJvfHZm9Gf_tFT74Z7vi7KK_RVZuxyDxHoyDY_tJg4t9nOG7KADNTCuwtueNM2rMAq7AvU3NlSDqinKCwiVGFhFu3n1SfhgdZP9wSN5GzAdPIHmZ8AxsgpWalL3E8cu_3PCcjqIS4-7E_uBGp5rT-h_klULbJgSTEdNeE9-ZBqZJps2YnzeovZvRRNiRtnRQlV_XH8idLq102OOsKfHB6-9uBISPzlEfWCGX1YQ9EhUw--v4_w6pxEAmeno6SRbIF-pDBiu6b9BI6Vr5qa-lOVaLdyPxhUI239ZCnEGkz3CxOtGMo3ajWFizbesMDHEp6NuAuvgxFWPI-fKwg8RwkPie_XB-GJZBKCb1_BVEgNPmdt35HruwqEpWJPw/https://www.amazon.com/stores/page/C2BD9D6C-9291-4DC0-A53D-F4D8A85AD55B/?_encoding=UTF8&store_ref=SB_A0999774353PCQ5Z5KWBD-A0564794FFF599S4ZH47&pd_rd_plhdr=t&aaxitk=58223d45b813006745ff0d9f14a9234c&hsa_cr_id=0&lp_asins=B07QS3Q5NQ%2CB0B2523KN7%2CB0C7KZ4K6V&lp_query=luau%20party%20decorations&lp_slot=desktop-hsa-3psl&ref_=sbx_be_s_3psl_mbd_mb0_bkgd&pd_rd_w=5GOWP&content-id=amzn1.sym.cd7c548b-a599-426f-9ffe-daa1aa803c87%3Aamzn1.sym.cd7c548b-a599-426f-9ffe-daa1aa803c87&pf_rd_p=cd7c548b-a599-426f-9ffe-daa1aa803c87&pf_rd_r=CQVEEA9Y14D9SMXKWE60&pd_rd_wg=ret1t&pd_rd_r=c6da817a-7d26-47a1-bb5e-21957ca092e5,,,,,False,,,N/A,2026-04-23T12:06:33.323458,
62,3,Title,,,,Need help?Visit the help sectionorcontact us,,,,,,False,,,,2026-04-23T12:06:33.324262,
0,4,SB_Video,4.0,,,N/A,N/A,,,,,False,,,,2026-04-23T12:06:49.435550,1.0
1,4,Title,,,,ResultsCheck each product page for other buying options. Price and other details may vary based on p,,,,,,False,,,,2026-04-23T12:06:49.436369,
3,4,Organic,,145.0,B0FGD1WK4K,"60Pcs Hawaiian Flowers,Tropical Decor Tropical Flowers Include Hibiscus Flowers Artificial and Palm Leaves,Hawaiian Decorations Luau Table Decorations for Jungle Beach Theme Birthday Party",N/A,$9.90,,3.9,16.0,False,https://m.media-amazon.com/images/I/81n32EtXgbL._AC_UL320_.jpg,https://m.media-amazon.com/images/I/81n32EtXgbL._AC_SL1500_.jpg,,2026-04-23T12:06:49.439788,
4,4,Organic,,146.0,B09ZTW6YG5,Frienda Hawaiian Photo Prop Banner Tropical Luau Couple Photo Door Banner Hawaiian Party Decor Aloha Tiki Banners Beach Prop Tiki Backdrop for Summer Luau Party Get-together Supply(Funny Style),N/A,$11.99,,4.7,493.0,False,https://m.media-amazon.com/images/I/81rX7YWM49L._AC_UL320_.jpg,https://m.media-amazon.com/images/I/81rX7YWM49L._AC_SL1500_.jpg,,2026-04-23T12:06:49.443307,
5,4,Organic,,147.0,B0DT1LH41Z,"Atonofun 60 Counts Leis for Luau Party, Hawaiian Leis Bulk Decorations Colorful Tropical Flower Necklace Hawaiian Garland for Kids Adults Hawaiian Beach Luau Party Favors Supplies",N/A,$21.99,,4.8,77.0,False,https://m.media-amazon.com/images/I/81p6bCYa3PL._AC_UL320_.jpg,https://m.media-amazon.com/images/I/81p6bCYa3PL._AC_SL1500_.jpg,,2026-04-23T12:06:49.446864,
6,4,Title,,,,"Jenaai 9.5 ft Giant Inflatable Palm Tree, LED Blow up Palm Tree Arch for Party, Luau Hawaiian Tropic",,,,,,False,,,,2026-04-23T12:06:49.447777,
7,4,Title,,,,More results,,,,,,False,,,,2026-04-23T12:06:49.447909,
8,4,Organic,,148.0,B0CNPHS47B,4 Pack Hawaiian Luau Tablecloths Tropical Palm Leaves Table Cloth Hawaiian Luau Table Cover Palm Leaves Table Cloth Baby Birthday Birthday Party Summer Pool Tropical Party Decorations 86 x 51 IN,N/A,$7.79,,4.7,1375.0,False,https://m.media-amazon.com/images/I/814mvhYaeaL._AC_UL320_.jpg,https://m.media-amazon.com/images/I/814mvhYaeaL._AC_SL1500_.jpg,,2026-04-23T12:06:49.453173,
9,4,Organic,,149.0,B094FWNW67,"30 Pieces Tropical Birds Decorations, Tropical Hawaiian Toucan Parrot Party Hanging Swirl Foil Ceiling Decor for Summer Luau Hawaiian Beach Pool Tiki Wedding Birthday Party Supplies",N/A,$9.49,,4.4,655.0,False,https://m.media-amazon.com/images/I/81Pz5cUv4tS._AC_UL320_.jpg,https://m.media-amazon.com/images/I/81Pz5cUv4tS._AC_SL1500_.jpg,,2026-04-23T12:06:49.456076,
10,4,Organic,,150.0,B0DRJKZJZH,Hawaiian Leis Flower Crown - Artificial Tropical Flower Headpiece Hawaii Floral Headband with Ribbon Lei Luau Dress Up Hair Accessories for Luau Party Costume Beach Pool Vacation Decorations,N/A,$13.99,,4.4,137.0,False,https://m.media-amazon.com/images/I/81zSbZrq8kL._AC_UL320_.jpg,https://m.media-amazon.com/images/I/81zSbZrq8kL._AC_SL1500_.jpg,,2026-04-23T12:06:49.459804,
11,4,Organic,,151.0,B0G9LMDG2C,"63'' Inflatable Palm Tree Cooler, Pool Party Decorations, Inflatable Cooler for Hawaiian Luau Tropical Summer Party Supplies, Beach Theme Party Decoration",N/A,$19.99,,4.6,8.0,False,https://m.media-amazon.com/images/I/81RVsKnqx8L._AC_UL320_.jpg,https://m.media-amazon.com/images/I/81RVsKnqx8L._AC_SL1500_.jpg,,2026-04-23T12:06:49.462914,
12,4,Organic,,152.0,B0CR6RXWT1,"100pcs Luau Party Decorations, Silk Hawaiian Leis Tropical Flower Necklaces, Colorful Hula Dance Bulk Leis Decor, Flower Hawaiian Leis for Summer Beach Pool Theme Party Decorations Favors Supplies",N/A,$35.99,,4.5,2717.0,False,https://m.media-amazon.com/images/I/91Qb2mxWFxL._AC_UL320_.jpg,https://m.media-amazon.com/images/I/91Qb2mxWFxL._AC_SL1500_.jpg,,2026-04-23T12:06:49.467285,
13,4,Organic,,153.0,B0FT8TRL9V,"RainMeadow Premium Luau Birthday Party Decorations Set for 25 guests - Hawaiian Theme with Aloha Banner, Balloons, Flamingo, Tableware - Tropical Luau Party Supplies",N/A,$30.99,,4.7,178.0,False,https://m.media-amazon.com/images/I/91dcWz5xPZL._AC_UL320_.jpg,https://m.media-amazon.com/images/I/91dcWz5xPZL._AC_SL1500_.jpg,,2026-04-23T12:06:49.470772,
14,4,Title,,,,Luau memories made easy – snap & smile!Sponsored|Shop FriendaShop nowPrevious pageFrienda Hawaiian P,,,,,,False,,,,2026-04-23T12:06:49.472579,
15,4,Title,,,,More results,,,,,,False,,,,2026-04-23T12:06:49.472716,
16,4,Organic,,154.0,B07TPM16SN,"100Pcs Palm Leaves Artificial Tropical Monstera Plant Fake Leaves Safari Birthday Decorations,Jungle Theme Party Supplies,Faux Green Leaf for Hawaiian Luau Tiki Aloha Beach BBQ Table Decoration 3 Size",N/A,$14.99,,4.8,1754.0,False,https://m.media-amazon.com/images/I/71DhBZx+OZL._AC_UL320_.jpg,https://m.media-amazon.com/images/I/71DhBZx+OZL._AC_SL1500_.jpg,,2026-04-23T12:06:49.475754,
17,4,Organic,,155.0,B0836KTCNM,"Camlinbo 15 Pcs Inflatable Flamingo Pool Toys Ring Toss Pool Game, Flamingos Luau Party Decor Hawaiian Beach Toys Carnival Outdoor Luau Party Games Supplies for Adults Family",N/A,$12.99,,4.3,915.0,False,https://m.media-amazon.com/images/I/71GzZVqbSEL._AC_UL320_.jpg,https://m.media-amazon.com/images/I/71GzZVqbSEL._AC_SL1500_.jpg,,2026-04-23T12:06:49.479272,
18,4,Organic,,156.0,B0GKG7M8VG,"24PCS Hawaiian Party Decorations, Hawaiian Cardboard Glasses Bulk, Luau Party Sunglasses Frame Tropical Dress Pool Props Accessories, Hawaii Carnival Summer Pool Party Decorations for Women Men",N/A,$14.99,,4.7,22.0,False,https://m.media-amazon.com/images/I/91mMAZ6XzEL._AC_UL320_.jpg,https://m.media-amazon.com/images/I/91mMAZ6XzEL._AC_SL1500_.jpg,,2026-04-23T12:06:49.483253,
19,4,Organic,,157.0,B0GLM9VN94,"16Pcs Hawaiian Luau Party Decorations, Tiki Totem Box Decor with Lights for Tropical Birthday, 7.9"" Lighted Tiki Bar Decor for Outdoor Patio Porch, Survivor Themed Party Supplies Aloha Party",N/A,$29.99,,4.0,1.0,False,https://m.media-amazon.com/images/I/81WQnuppc1L._AC_UL320_.jpg,https://m.media-amazon.com/images/I/81WQnuppc1L._AC_SL1500_.jpg,,2026-04-23T12:06:49.486765,
20,4,Organic,,158.0,B0D2TQF1SQ,"JCFIRE Summer Pool Beach Party Favors Kids Tattoos, 102 Styles Larger Tropical Hawaiian Luau Themed Temporary Tattoos for Kids Teens Adult, Waterproof Summer Stickers Party Decorations Supplies",N/A,$5.99,,4.7,953.0,False,https://m.media-amazon.com/images/I/71KUi4pTJkL._AC_UL320_.jpg,https://m.media-amazon.com/images/I/71KUi4pTJkL._AC_SL1500_.jpg,,2026-04-23T12:06:49.490907,
21,4,Organic,,159.0,B0DSK4R6JC,50 PCS Hawaiian Luau Cups 12 oz Plastic Tropical Cups Hawaii Party Clear Cup Disposable Palm Leaves Flamingo Hibiscus Drinking Cup for Summer Hawaiian Luau Tiki Birthday Party Supplies,N/A,$15.99,,4.7,43.0,False,https://m.media-amazon.com/images/I/81cvxoMJcxL._AC_UL320_.jpg,https://m.media-amazon.com/images/I/81cvxoMJcxL._AC_SL1500_.jpg,,2026-04-23T12:06:49.494877,
22,4,Organic,,160.0,B0FD3STT9P,"3 Tier Hawaiian Cupcake Stand,Luau Cardboard Cupcake Stands,Tropical Birthday Party Decorations,Hawaiian Luau Party Supplies Halloween Decors Boys Girls Baby Shower",N/A,$7.99,,4.6,17.0,False,https://m.media-amazon.com/images/I/81K2H6MHShL._AC_UL320_.jpg,https://m.media-amazon.com/images/I/81K2H6MHShL._AC_SL1500_.jpg,,2026-04-23T12:06:49.499353,
23,4,Organic,,161.0,B0CY8QPXXG,"Tropical Napkins, Hawaiian Tropical Decoration 40pcs Luau Paper Floral Hibiscus Hawaiian Napkins For Summer Luau Party Supplies",N/A,$9.99,,4.1,67.0,False,https://m.media-amazon.com/images/I/81Es+QSvYsL._AC_UL320_.jpg,https://m.media-amazon.com/images/I/81Es+QSvYsL._AC_SL1500_.jpg,,2026-04-23T12:06:49.505729,
24,4,Organic,,162.0,B0DYSQ3PXL,Honoson 5 Pcs Hawaiian Luau Aloha Party Decoration Aloha Letter LED Pineapple Lights Sign Summer Tropical Table Decorations Tropical Hawaiian Summer Beach Pool Party Supplies,N/A,$20.99,,4.6,138.0,False,https://m.media-amazon.com/images/I/814+C6VXh0L._AC_UL320_.jpg,https://m.media-amazon.com/images/I/814+C6VXh0L._AC_SL1500_.jpg,,2026-04-23T12:06:49.509118,
25,4,Organic,,163.0,B094LZ2VGR,"4E's Novelty 48 Packs Tropical Party Cups with Parasol Straws - Disposable Plastic Cups 16oz BPA free, for Hawaiian Luau Party and Pool Parties, Beach Theme Birthday Decorations for Kids & Adults",N/A,$17.99,,4.7,444.0,False,https://m.media-amazon.com/images/I/61HGwRd92VL._AC_UL320_.jpg,https://m.media-amazon.com/images/I/61HGwRd92VL._AC_SL1500_.jpg,,2026-04-23T12:06:49.514328,
26,4,Organic,,164.0,B0G4W6NB1L,Suncalla 26 Pack Hawaiian Leis Luau Party Decoration Set Include 24 Pcs Hawaiian Leis 1 Pcs Wreath Stand ( Adjustable Base) 1 Pack Luau Party Welcome Wooden Signs for Summer Tropical Flower Lei Shows,N/A,$17.99,,5.0,2.0,False,https://m.media-amazon.com/images/I/81oGO4wv-BL._AC_UL320_.jpg,https://m.media-amazon.com/images/I/81oGO4wv-BL._AC_SL1500_.jpg,,2026-04-23T12:06:49.518193,
27,4,Organic,,165.0,B0GGZSPLL8,"Hawaiian Birthday Party Decorations, 99Pcs Hawaiian Plates and Napkins-Serve 24 With Birthday Banner Tablecloth Disposable Luau Plates for Luau Birthdays Tropical Summer BBQ Party Decorations",N/A,$19.99,,4.7,95.0,False,https://m.media-amazon.com/images/I/81tA-WSRwOL._AC_UL320_.jpg,https://m.media-amazon.com/images/I/81tA-WSRwOL._AC_SL1500_.jpg,,2026-04-23T12:06:49.524237,
28,4,Organic,,166.0,B0F3VKDVCK,"3-Tier Cupcake Stand - Palm Tree Party Decor for Luau, Hawaiian & Tropical Themed Events - Multi-Colored Cardboard Tiered Tray for Beach & Pool Party Decorations",N/A,$12.99,,4.3,59.0,False,https://m.media-amazon.com/images/I/71-14fBPMEL._AC_UL320_.jpg,https://m.media-amazon.com/images/I/71-14fBPMEL._AC_SL1500_.jpg,,2026-04-23T12:06:49.529736,
29,4,Organic,,167.0,B0BY4BHXVZ,"60 Pcs Hawaiian Luau Hula Skirts Decorations, Hawaiian Grass Skirts Leis Necklaces Bracelets for Tropical Beach Holiday Decorations Tropical Themed Dance",N/A,$23.86,,4.5,185.0,False,https://m.media-amazon.com/images/I/91bZUuPj29L._AC_UL320_.jpg,https://m.media-amazon.com/images/I/91bZUuPj29L._AC_SL1500_.jpg,,2026-04-23T12:06:49.535329,
30,4,Organic,,168.0,B0BWH3MK77,12 Pcs Luau Party Decorations Tiki Totem Pole Decor Column Card Stock 68.8 Inch Height Three Dimensional for Hawaiian Luau Birthday Party Home Outdoor Indoor Tropical Theme Decor (4 Sides),N/A,$22.99,,3.3,27.0,False,https://m.media-amazon.com/images/I/81KvW1a07kL._AC_UL320_.jpg,https://m.media-amazon.com/images/I/81KvW1a07kL._AC_SL1500_.jpg,,2026-04-23T12:06:49.538737,
31,4,Organic,,169.0,B08SJ3F3XH,"25 Count Hawaiian Leis Set Bulk for Kids & AdultsTropical Luau Flower Lei, Multicolor Party Favors for Hawaii Decor Birthday, Beach Wedding, Easter Parties & Holiday Decorations",N/A,$9.95,,4.5,2462.0,False,https://m.media-amazon.com/images/I/81Wn7vs-LGL._AC_UL320_.jpg,https://m.media-amazon.com/images/I/81Wn7vs-LGL._AC_SL1500_.jpg,,2026-04-23T12:06:49.543127,
