data_index,page,ad_type,ad_rank,organic_rank,asin,title,url,price_current,price_list,rating_stars,rating_count,is_prime,image_small,image_large,brand_name,scraped_at,inner_products_count
58,2,SB,3.0,,,N/A,https://aax-us-east-retail-direct.amazon.com/x/c/JHge4ba-sBxU0-LDv0an2OgAAAGduBZW0QEAAAH2AQBvbm9fdHhuX2JpZDEgICBvbm9fdHhuX2ltcDIgICDFERSi/clv1c_ek-wxPf3VcbWTPWXjyXvh-iWmpCpkoAotaCve4pazd7EeDz1wRNTmQLa1cstc9bFo81lqzPlVP-StXy0i9NQumUdIs5XVc689pslTBrmws8Gm3ItqS7dN9rispl1olQ9T-DSmlSEJB53LRy7ZUucjdrCxF0dkkHa0nwg7_Wrxp8XgcvcalmlQEBv8qBBKAKkEXOLpRfDM1_YNCR9fMrOxgbcSCoyAGqSicG20KPwd5rN8uplRZPFf7Jc6VoFhh_5PsvL2x252r60hE706XoS_iICeDplcSHwxlr6rplxRgD2NcdLnY_BTQ320iAb43vdWP1-wAObp_CRh5FvP5_DwJm0ase4F_IU7xA-85Ir5-a2rUN2wNpIP4oQyiJB32oHMcOPssY-dohp38QquUFHG06F92X0Y-e76R3ttP8KcjhzSyKVcCMwelNdeOureF7rN0Dk7yI8fJJ7HeAOmp_6hQ_MlbpCy3ChYMtUdEHsMXVAWALsntgZYuN4w6ILPDv2iF6vUP7nSVqQMvTvt1Ex42OA7A5-xk0BmCvcr7LZhQtctth6-1Rcfdt2iU0oAEjRxHOfqTzdf-doq8RWzg9aCPPeeiLEPMlg9zcPw7QYvgWlAT60fnCu5FduIM52GvUeA7zxlF_W0Tiyu00w8x9wXmcuGvm0gnPA7Q4hshswi5FpYgGAEqHS3naeW8BfuBZ6Vn1C8ozcEOsj613bFhyI9qNuGKE5IyLZxCqCXPY7co9aCgKVsvwa-7cNw7kN3zWNjlE8wzAem12RCDMPS6LaR1QrupSM3G-XvtOiX8lkZNHVLHuNXegF3H6nHGm-kKyt-M5Ve_ttoioCwHyGEaHRozZ0l7viKlq-acewmCIA0nLlMlX1-oQdIN-Jirrpe6iW6Q3FEwqpsXyc6R7e2fi_I_JlU4CDiutvsq2oOfjdq44T0bO6BtHUaBd_kd3gUL-BjDMZHo_9DlpwGTH0wvGtj-RWBv1-19HjE2RrHESkjGoU80eby-gfIp8BTSQ3qUwjU86oF-F4_momr17WX2TE5psVrGfjl0qUlsxr1O2bZLwAyfgRKit6v9MU4dE6kzjO_Kc_Qve9FYnqYe2PizCgW_T3ityKIqWHjsBaIEZpkUpBaNoPHFtJAIOOyTm87ag6AOwISKd5FNV92TR8yF4e2bwGm6ht6Wxfz_4ey3grRcPBA_dG7g_US39OnnSVmmPNYOauhi7AfX2t3few7X8VoN28Te1LC25VmwCGWxp4hYwUIQQDjXADA3t8yUu49Hw4qCybuO6hWgiLGDV688bQzKQJbaT6_-z9bLyVypQDjhSJjMTmO0Nry3DvdVMQUtbMMrUMLT7_xODQSowInzRsIqcyqjebLJ1oIy7lvOv5TEB5kTHHtRJBbbgdvy0w0pPj35DHo57SupGm3b64CNX8rAbRR-DAWZ0BmV38MOjkvs3vgX53zh3IH3Ov9Zf14aFoJI2KudQMIeCSWQmNzyOyP9YK_UmUu_p0nAF9thRZkHvC9Y-ycrCfjSn6kurFvWU0Qknls1UiTrJoqXrPeRaKxp0GkGaK64iqvY8NmjYOi-l7ztHhZT8ai61LSWfKJ7QLm0q3rdHuCkNtSaaikZiPGQrSc1pmlRXyDEAEUHVrzG9n2oG6saD-lkBFqMb2pKgqG5QXI-HmwGHeBwft7we9363XsNkE/https://www.amazon.com/stores/page/0B0C1EB9-336F-4F93-B0CA-59C445464C4F/?_encoding=UTF8&store_ref=SB_A06303003LVMCBZMKJ2HC-A00797492ITZPWA9N99RQ&pd_rd_plhdr=t&aaxitk=054d493563f702ff9d0434ac047dad87&hsa_cr_id=0&lp_asins=B0G6VPZL5H%2CB0G6VX3M83%2CB0G6W14GFH&lp_query=nurses%20week%20party%20decorations&lp_slot=desktop-hsa-3psl&ref_=sbx_be_s_3psl_mbd_mb0_bkgd&pd_rd_w=eQhPp&content-id=amzn1.sym.cd7c548b-a599-426f-9ffe-daa1aa803c87%3Aamzn1.sym.cd7c548b-a599-426f-9ffe-daa1aa803c87&pf_rd_p=cd7c548b-a599-426f-9ffe-daa1aa803c87&pf_rd_r=TZ8EV9F6BTWXX2DWB5M8&pd_rd_wg=VLIpb&pd_rd_r=be167858-1486-4310-b083-fff7aef4ef34,,,,,False,,,N/A,2026-04-23T10:06:09.040134,
59,2,Title,,,,Need help?Visit the help sectionorcontact us,,,,,,False,,,,2026-04-23T10:06:09.041172,
0,3,SB_Video,2.0,,,N/A,N/A,,,,,False,,,,2026-04-23T10:06:24.745459,1.0
1,3,Title,,,,ResultsCheck each product page for other buying options. Price and other details may vary based on p,,,,,,False,,,,2026-04-23T10:06:24.747084,
3,3,Organic,,97.0,B0CS6PCGSK,"Thank You Nurses Backdrop Nurses Week Decorations,72.8 X 43.3 Fabric Backdrop Banner for National Nurse Day Photo Background Medical Doctor Nurse Appreciation Graduation Party Decorations",N/A,$9.99,,5.0,6.0,False,https://m.media-amazon.com/images/I/81ZQiOnRnNL._AC_UL320_.jpg,https://m.media-amazon.com/images/I/81ZQiOnRnNL._AC_SL1500_.jpg,,2026-04-23T10:06:24.751956,
4,3,Organic,,98.0,B0CV3XCF13,"Thank You Nurse Banner and Hanging Swirl Set, Hanging Swirl Banner for Nurses Week Nurse Day Decoration Doctor Medical Themed Party Nurse Appreciation RN Graduation Party Decorations(Red)",N/A,$12.99,,5.0,1.0,False,https://m.media-amazon.com/images/I/81xH5cbaYIL._AC_UL320_.jpg,https://m.media-amazon.com/images/I/81xH5cbaYIL._AC_SL1500_.jpg,,2026-04-23T10:06:24.757775,
5,3,Organic,,99.0,B0GD75YJD4,"Mindsoft 3 Pcs Thank You Nurses Week Tablecloth, 2026 Nurse Graduation Party Decorations, 54 x 108 Inch Plastic Nurse Appreciation Week Table Covers Party Decoration Supplies (Red)",N/A,$9.99,,5.0,9.0,False,https://m.media-amazon.com/images/I/71fFsxT7KIL._AC_UL320_.jpg,https://m.media-amazon.com/images/I/71fFsxT7KIL._AC_SL1500_.jpg,,2026-04-23T10:06:24.762386,
7,3,Title,,,,Recently bought and ratedSponsored| 4+ stars and rising in past 90 daysFrienda 24 Pack Nurse Week Gi,,,,,,False,,,,2026-04-23T10:06:24.766707,
8,3,Title,,,,More results,,,,,,False,,,,2026-04-23T10:06:24.766994,
9,3,Organic,,100.0,B0GRZGMRM3,"3 Pcs Nurse Graduation Party Tablecloth, Thank You Nurses Week Plastic Table Covers for 2026 Nurse Graduation Party Supplies, 54 x 108 Inch",N/A,$7.99,,4.8,39.0,False,https://m.media-amazon.com/images/I/81NULDQeejL._AC_UL320_.jpg,https://m.media-amazon.com/images/I/81NULDQeejL._AC_SL1500_.jpg,,2026-04-23T10:06:24.771065,
10,3,Organic,,101.0,B0BXPT871D,"Katchon, Nurse Cupcake Toppers 2026 - Pack Of 30 | Nurse Party Decorations | Medical Cake Decorations | nurse themed Party Decorations | 2026 Graduation Decorations",N/A,$9.99,,4.5,43.0,False,https://m.media-amazon.com/images/I/81sxV7mBBKL._AC_UL320_.jpg,https://m.media-amazon.com/images/I/81sxV7mBBKL._AC_SL1500_.jpg,,2026-04-23T10:06:24.775034,
11,3,Organic,,102.0,B09TT62WYS,Blulu Thank You Nurses Banner Fabric Nurse Appreciation Week Banner Nurse Party Decoration Backdrop for 2026 National Nursing Day Photo Background Medical Doctor Nursing Party Decoration Supplies,N/A,$8.49,,4.9,55.0,False,https://m.media-amazon.com/images/I/81qoAjYizRL._AC_UL320_.jpg,https://m.media-amazon.com/images/I/81qoAjYizRL._AC_SL1500_.jpg,,2026-04-23T10:06:24.779045,
12,3,Organic,,103.0,B09TQXJLMT,"Thank You Nurses Backdrop Decorations, Large Fabric Nurse Appreciation Backdrop Banner, Week Sign Photo Booth Background for Nurse Week Party Indoor Outdoor Decor Supplies, 73 x 43 Inches (Red)",N/A,$9.99,,4.8,68.0,False,https://m.media-amazon.com/images/I/81qYUXLnzqL._AC_UL320_.jpg,https://m.media-amazon.com/images/I/81qYUXLnzqL._AC_SL1500_.jpg,,2026-04-23T10:06:24.783815,
13,3,Organic,,104.0,B0GF1MPN2Y,"Nurse Confetti, 200Pcs Glitter Confetti for Nursing Graduation Party Decorations, Metallic Foil Sequins Table Decor for Nursing Medical School Graduation Nurse Week Decor Retirement RN Party Supplies",N/A,$8.99,,5.0,3.0,False,https://m.media-amazon.com/images/I/81gntuaabeL._AC_UL320_.jpg,https://m.media-amazon.com/images/I/81gntuaabeL._AC_SL1500_.jpg,,2026-04-23T10:06:24.788262,
14,3,Organic,,105.0,B0DQK9DGJG,36Pcs Nurse Theme Cupcake Toppers Heartbeat Curve Cupcake Toppers Nurse Week Party Decorations Red Glitter Congrats Nurse Cake Decorations for Nurse Day Birthday Graduation Retirement Party Supplies,N/A,$12.99,,,,False,https://m.media-amazon.com/images/I/71ljqJezA5L._AC_UL320_.jpg,https://m.media-amazon.com/images/I/71ljqJezA5L._AC_SL1500_.jpg,,2026-04-23T10:06:24.791802,
15,3,Title,,,,Supervitae 40 Pcs Nurse Gift Bags 5.5x2.4x4.7 Inch Small Thank You Nurse Paper Gift Bags with Handle,,,,,,False,,,,2026-04-23T10:06:24.792666,
16,3,Title,,,,Nurse Keychains Nurses Week Gifts Nursing StudentsSponsored|Shop HicarerShop nowPrevious pageHicarer,,,,,,False,,,,2026-04-23T10:06:24.793762,
17,3,Title,,,,More results,,,,,,False,,,,2026-04-23T10:06:24.793895,
18,3,Organic,,106.0,B0BVVYCLXG,Lallisa 24 Pcs Nurse Gifts Box Nurse Party Paper Box Thank You Nurse Ever Candy Treat Boxes Medical Nursing RN Graduation Box for Healthcare Worker Nurse Appreciation Gift School Office Party(Brown),N/A,$9.99,,4.1,38.0,False,https://m.media-amazon.com/images/I/81uPY8XRHOL._AC_UL320_.jpg,https://m.media-amazon.com/images/I/81uPY8XRHOL._AC_SL1500_.jpg,,2026-04-23T10:06:24.797740,
19,3,Organic,,107.0,B0F24CH3WF,"Thank You Nurses Banner Backdrop for Nurses Appreciation Week Decorations, Thank You Nurses Decorations, Nurses Appreciation Week Banner Party Supplies",N/A,$10.99,,5.0,6.0,False,https://m.media-amazon.com/images/I/71aov1WrcVL._AC_UL320_.jpg,https://m.media-amazon.com/images/I/71aov1WrcVL._AC_SL1500_.jpg,,2026-04-23T10:06:24.802991,
20,3,Organic,,108.0,B0BVZLLHJ7,"Thank You Nurses Backdrop Decoration,Large Fabric 2026 Nurses Week Backdrop Banner National Nurse Day Photo Booth Background for Medical Doctor Nurses Rn Graduation Party Supply 73 x 43 Inch",N/A,$9.99,,4.9,19.0,False,https://m.media-amazon.com/images/I/81Guv8JR-hL._AC_UL320_.jpg,https://m.media-amazon.com/images/I/81Guv8JR-hL._AC_SL1500_.jpg,,2026-04-23T10:06:24.808931,
21,3,Organic,,109.0,B0F249QVZ6,"Large Thank You Nurses Banner Backdrop Decorations, National Nurses Appreciation Week Backdrop Banner Decorations, Nurse Appreciation Week Party Indoor Outdoor Decor Supplies",N/A,$9.99,,4.5,7.0,False,https://m.media-amazon.com/images/I/81aqHSTwXFL._AC_UL320_.jpg,https://m.media-amazon.com/images/I/81aqHSTwXFL._AC_SL1500_.jpg,,2026-04-23T10:06:24.813590,
22,3,Organic,,110.0,B0DRCK8WP8,AIBIIN Thank You Nurses Banner Happy Nurses Week Welcome Backdrop Hanging Banner Nurse Day Porch Sign for School RN Party Decoration Photo Booth Background 70.8 x 43.3 inch,N/A,$7.59,,4.5,6.0,False,https://m.media-amazon.com/images/I/71PA-SWIySL._AC_UL320_.jpg,https://m.media-amazon.com/images/I/71PA-SWIySL._AC_SL1500_.jpg,,2026-04-23T10:06:24.820585,
23,3,Organic,,111.0,B0CX1V5D1H,"6 Pcs Nurses Week Table Centerpieces Wooden Thank You Nurse Table Signs Wood Nurses Appreciation Week Table Toppers Happy Nurse Appreciation Gifts for Nurse Day Decor (Base Style,Large Size)",N/A,$11.99,,4.4,24.0,False,https://m.media-amazon.com/images/I/81ufi99eccL._AC_UL320_.jpg,https://m.media-amazon.com/images/I/81ufi99eccL._AC_SL1500_.jpg,,2026-04-23T10:06:24.824775,
24,3,Organic,,112.0,B0BVRDK4HG,3 Pcs Thank You Nurses Door Banners Vertical Nurses Appreciation Week Hanging Door Banners Thank You Nurse Party Decorations Nurse Day Polyester Porch Sign for Indoor Outdoor School Rn Party Wall,N/A,$8.99,,4.0,19.0,False,https://m.media-amazon.com/images/I/71SxDW4mkdL._AC_UL320_.jpg,https://m.media-amazon.com/images/I/71SxDW4mkdL._AC_SL1500_.jpg,,2026-04-23T10:06:24.831539,
25,3,Organic,,113.0,B0GKVXLYZC,"113PCS Class of 2026 Graduation Party Decorations Nurse Balloons Kits,Congrats Nurse Week Balloons Arch for Nursing School Nurse Week CNA RN NP LPN Themed Party Supplies",N/A,$15.99,,5.0,2.0,False,https://m.media-amazon.com/images/I/71LbJUuCA9L._AC_UL320_.jpg,https://m.media-amazon.com/images/I/71LbJUuCA9L._AC_SL1500_.jpg,,2026-04-23T10:06:24.836062,
26,3,Organic,,114.0,B0GHN58S45,Pajean 32 Pcs Nursing Party Decorations Nurse Appreciation Week Theme Eyeglasses Thank You Nurses Week Paper Glasses Frame Photo Booth Props for Nursing School Graduation Party Supplies,N/A,$9.99,,,,False,https://m.media-amazon.com/images/I/71FwoNSm1GL._AC_UL320_.jpg,https://m.media-amazon.com/images/I/71FwoNSm1GL._AC_SL1500_.jpg,,2026-04-23T10:06:24.840310,
27,3,Organic,,115.0,B0F9FL19NY,SmoothNovelty 3 Pcs Happy Emergency Nurses Week Banner We Appreciate Thank You for All You Do Backdrop ER ED Nurse Week Party Decor for Healthcare Workers Nurse Appreciation Gifts Hospital Retirement,N/A,$14.99,,4.8,103.0,False,https://m.media-amazon.com/images/I/616j8ePJeDL._AC_UL320_.jpg,https://m.media-amazon.com/images/I/616j8ePJeDL._AC_SL1500_.jpg,,2026-04-23T10:06:24.845145,
28,3,Organic,,116.0,B0CW9391QR,"Thank You Nurses Week Banner, Nurses Appreciation Week Banner Party Decorations, Internation Nurses Week Banner Backdrop for Home Office Decor",N/A,$9.99,,4.9,15.0,False,https://m.media-amazon.com/images/I/71pqkiuuq2L._AC_UL320_.jpg,https://m.media-amazon.com/images/I/71pqkiuuq2L._AC_SL1500_.jpg,,2026-04-23T10:06:24.849246,
29,3,Organic,,117.0,B0DXSV2849,Thank You Nurses Photo Booth Props Frame 2025 Nurse Week Selfie Photobooth Props Creative Photography Nurse Week Party Decorations Supplies,N/A,$8.99,,,,False,https://m.media-amazon.com/images/I/61UnZ+VgvhL._AC_UL320_.jpg,https://m.media-amazon.com/images/I/61UnZ+VgvhL._AC_SL1500_.jpg,,2026-04-23T10:06:24.853155,
30,3,Organic,,118.0,B0CXJ2NZ2V,"Thank You Nurses Banner Party Decorations Red and Blue, Nurse Appreciation Week Banner Decorations, Nurse Appreciation Gifts Bulk for Nurses Week Home Office School Hospital Décor",N/A,$9.99,,5.0,5.0,False,https://m.media-amazon.com/images/I/814g2FgIZlL._AC_UL320_.jpg,https://m.media-amazon.com/images/I/814g2FgIZlL._AC_SL1500_.jpg,,2026-04-23T10:06:24.859182,
31,3,Organic,,119.0,B0BXKFKJFL,"Nurses Week Decorations, HAPPY NURSES WEEK Banner & Thank You Nurses Hanging Backpack, Nurses Week Appreciation RN Graduation Banner, Nurses Decor for Nurse Graduation Party Photo Supplies",N/A,$12.99,,4.9,38.0,False,https://m.media-amazon.com/images/I/81MxZil-wFL._AC_UL320_.jpg,https://m.media-amazon.com/images/I/81MxZil-wFL._AC_SL1500_.jpg,,2026-04-23T10:06:24.865994,
32,3,Organic,,120.0,B0DY1FDHD1,"Nurse Appreciation Week Decorations Banner 72"" x 48"" Backdrop Thank You Nurses We Appreciate You Medical Heart Photography Background for Indoor Outdoor Hospital Doctor Nurse Party Supplies",N/A,$9.99,,5.0,7.0,False,https://m.media-amazon.com/images/I/718kDieHslL._AC_UL320_.jpg,https://m.media-amazon.com/images/I/718kDieHslL._AC_SL1500_.jpg,,2026-04-23T10:06:24.871440,
33,3,Organic,,121.0,B0CT5K2GDY,"Ragnhild 66Pcs Thank You Nurse Hanging Swirl, Nurses Week Decorations Nurse Day Hanging Swirl Streamers for Doctor Medical Themed Party Nurse Appreciation Nurse School RN Graduation Party Decorations",N/A,$11.99,,4.8,8.0,False,https://m.media-amazon.com/images/I/81ImtuznJJL._AC_UL320_.jpg,https://m.media-amazon.com/images/I/81ImtuznJJL._AC_SL1500_.jpg,,2026-04-23T10:06:24.876305,
34,3,Organic,,122.0,B0F191C94K,Happy Nurses Week Banner Thank You Nurses We Appreciate You Party Decoration for Doctor Medical Hospital Office Nursing School Grad Party Supplies(Black),N/A,$9.99,,5.0,5.0,False,https://m.media-amazon.com/images/I/71wtR+rouBL._AC_UL320_.jpg,https://m.media-amazon.com/images/I/71wtR+rouBL._AC_SL1500_.jpg,,2026-04-23T10:06:24.881858,
35,3,Organic,,123.0,B0CWH63W6D,Thank You Nurses Banner Happy Nurses Week Nurses Party Decorations for Doctor Medical Nursing School Office Celebrate Nurse Appreciation Week Party Supplies (Gold),N/A,$9.99,,5.0,4.0,False,https://m.media-amazon.com/images/I/71NsCTY-P-L._AC_UL320_.jpg,https://m.media-amazon.com/images/I/71NsCTY-P-L._AC_SL1500_.jpg,,2026-04-23T10:06:24.886576,
36,3,Organic,,124.0,B0F24DY8TX,"Happy Nurses Week Backdrop Banner Decorations - Thank You Nurses Backdrop Decorations, Nurses Week Sign Photo Booth Background for Medical Doctor Nursing Graduation Party Supplies",N/A,$10.99,,5.0,2.0,False,https://m.media-amazon.com/images/I/71stPxXGvaL._AC_UL320_.jpg,https://m.media-amazon.com/images/I/71stPxXGvaL._AC_SL1500_.jpg,,2026-04-23T10:06:24.891167,
37,3,Organic,,125.0,B0BXSXHSQ3,"Henoyso 72 Pcs Nurse Graduation Gifts 2026, Nursing Keychain Bulk for Women Medical Party Favors, Nurse Week Appreciation Set",N/A,$22.99,,4.7,92.0,False,https://m.media-amazon.com/images/I/81OgM4EcheL._AC_UL320_.jpg,https://m.media-amazon.com/images/I/81OgM4EcheL._AC_SL1500_.jpg,,2026-04-23T10:06:24.895447,
38,3,Organic,,126.0,B0CTGBS857,"Nurses Week Banner Decorations, Happy Nurses Week Banner, Thank You Nurses Banner Party Decorations for National Nurses Day",N/A,$8.99,,4.2,11.0,False,https://m.media-amazon.com/images/I/71VOlF6XW1L._AC_UL320_.jpg,https://m.media-amazon.com/images/I/71VOlF6XW1L._AC_SL1500_.jpg,,2026-04-23T10:06:24.900098,
39,3,Organic,,127.0,B0GLWRSS6T,"National Nurse Week Decorations - Thank You Nurses Backdrop Party Decor, Large Nurse Appreciation Week Party Banner Supplies for Hospital Home Office Indoor Outdoor, 71"" X 43""",N/A,$7.99,,4.8,28.0,False,https://m.media-amazon.com/images/I/81-NMIh-IlL._AC_UL320_.jpg,https://m.media-amazon.com/images/I/81-NMIh-IlL._AC_SL1500_.jpg,,2026-04-23T10:06:24.903520,
40,3,Organic,,128.0,B0DSVX7QNR,Thank You Nurses Backdrop 2026 Nurse Appreciation Week Banner 7x5FT Nurses Day Decorations Background for Nurse Graduation Party Supplies Photo Props,N/A,$9.33,,5.0,5.0,False,https://m.media-amazon.com/images/I/71gtRCTsnJL._AC_UL320_.jpg,https://m.media-amazon.com/images/I/71gtRCTsnJL._AC_SL1500_.jpg,,2026-04-23T10:06:24.908034,
41,3,Organic,,129.0,B0GS9CZ1PH,"Nurses Appreciation Week Decorations Door Cover, Thank You Nurses Banner Backdrop for RN Party Supplies Indoor Outdoor Medical Staff Decor",N/A,$10.99,,4.0,1.0,False,https://m.media-amazon.com/images/I/81rahz3EAtL._AC_UL320_.jpg,https://m.media-amazon.com/images/I/81rahz3EAtL._AC_SL1500_.jpg,,2026-04-23T10:06:24.911641,
42,3,Organic,,130.0,B0F1D2WRT2,"Happy Nurse Week Banner - Happy Nurses Day Decor, Nurses Week Appreciation Party Decorations Black Red",N/A,$8.99,,,,False,https://m.media-amazon.com/images/I/61oSEy3NWdL._AC_UL320_.jpg,https://m.media-amazon.com/images/I/61oSEy3NWdL._AC_SL1500_.jpg,,2026-04-23T10:06:24.914864,
43,3,Organic,,131.0,B0GSW76YNY,Nurses Week Decorations 2026 Glitter Thank You Nurses We Appreciate You Banner Nurses Party Hanging Swirls Decorations Nurse Appreciation Gifts Bulk for Nursing Graduation Party Supplies,N/A,$9.99,,,,False,https://m.media-amazon.com/images/I/71qx3KzJvoL._AC_UL320_.jpg,https://m.media-amazon.com/images/I/71qx3KzJvoL._AC_SL1500_.jpg,,2026-04-23T10:06:24.918350,
44,3,Organic,,132.0,B0GJT8K176,16 Pairs Nurse Cupcake Socks for Women Men Novelty Crew Socks Gift Bulk for Nurse Week Cna Week Emt Rn Lpn MA Gift,N/A,$26.99,,4.6,7.0,False,https://m.media-amazon.com/images/I/81FOpiQgTxL._AC_UL320_.jpg,https://m.media-amazon.com/images/I/81FOpiQgTxL._AC_SL1500_.jpg,,2026-04-23T10:06:24.922008,
45,3,Organic,,133.0,B0CXT38G5M,Thank You Nurses Backdrop - Nurses Week Banner Decorations 2025 National Nurses Day Photography Background Nurses Appreciation Week Party Large Banner Decorations Supplies 71 X 45 Inch,N/A,$7.99,,4.6,24.0,False,https://m.media-amazon.com/images/I/71mWxDmvxHL._AC_UL320_.jpg,https://m.media-amazon.com/images/I/71mWxDmvxHL._AC_SL1500_.jpg,,2026-04-23T10:06:24.925506,
46,3,Organic,,134.0,B0BWR7YMJD,"Black & Red Glitter Happy Nurses Week Banner, Nurses Appreciation Week Decorations Banner, Thank You Nurses Party Decorations, Happy CNA Week Party Decorations Supplies",N/A,$9.59,,5.0,3.0,False,https://m.media-amazon.com/images/I/61iNxa5WxPL._AC_UL320_.jpg,https://m.media-amazon.com/images/I/61iNxa5WxPL._AC_SL1500_.jpg,,2026-04-23T10:06:24.929437,
47,3,Organic,,135.0,B0DRK5YH8Z,Sureio 24 Pcs Nurses Week Appreciation Gifts Bulk 2026 Nurses Beaded Wristlet Keychain Medical Staff for Healthcare (White),N/A,$31.99,,3.6,5.0,False,https://m.media-amazon.com/images/I/819TrkVRKQL._AC_UL320_.jpg,https://m.media-amazon.com/images/I/819TrkVRKQL._AC_SL1500_.jpg,,2026-04-23T10:06:24.933160,
48,3,Organic,,136.0,B0GH25JCWH,Thank You Nurse We Appreciate You Banner Nurses Week Party Decorations CNA Week & Nursing Assistants Week Party Decor Pink Glitter,N/A,$9.99,,,,False,https://m.media-amazon.com/images/I/71+J+1WL1eL._AC_UL320_.jpg,https://m.media-amazon.com/images/I/71+J+1WL1eL._AC_SL1500_.jpg,,2026-04-23T10:06:24.936660,
49,3,Organic,,137.0,B0C4KJH1VR,"Henoyso 72 Pcs Nurse Graduation Gifts 2026, Nursing Keychain Bulk for Women Medical Party Favors, Nurse Week Appreciation Set",N/A,$22.99,,4.7,92.0,False,https://m.media-amazon.com/images/I/81B2dLFQIsL._AC_UL320_.jpg,https://m.media-amazon.com/images/I/81B2dLFQIsL._AC_SL1500_.jpg,,2026-04-23T10:06:24.940282,
50,3,Organic,,138.0,B0CSND43F6,Thank You Nurses Decorations Banner for Nurse Appreciation Week Themed Party Supplies Decorations Thanks Nurse Backdrop Banner for Nursing School Party Decorations,N/A,$7.68,,5.0,1.0,False,https://m.media-amazon.com/images/I/61f6vM2RVQL._AC_UL320_.jpg,https://m.media-amazon.com/images/I/61f6vM2RVQL._AC_SL1500_.jpg,,2026-04-23T10:06:24.943710,
51,3,Organic,,139.0,B0F28WKCZT,42 PCS Valentines Nursing Baseball Mom Shoe Decorations Cute PVC Shoe Accessories for Boys Girls Women,N/A,$7.99,,4.8,152.0,False,https://m.media-amazon.com/images/I/81PPAv+YhZL._AC_UL320_.jpg,https://m.media-amazon.com/images/I/81PPAv+YhZL._AC_SL1500_.jpg,,2026-04-23T10:06:24.948356,
52,3,Organic,,140.0,B0D7C65MBH,"Nurses Week 2025 Balloons Banner Party Decorations, Inernational Nurse Day 2025 Banner Medical RN BSN Theme Party Decorations (NURSES WEEK 2025 Blue)",N/A,$6.98,,4.2,10.0,False,https://m.media-amazon.com/images/I/61fnhv53B5L._AC_UL320_.jpg,https://m.media-amazon.com/images/I/61fnhv53B5L._AC_SL1500_.jpg,,2026-04-23T10:06:24.951876,
53,3,Organic,,141.0,B0CDWLTLBL,Sureio 36 Pcs Nurse Keychain Bulk Keychain Gifts Graduation Party Favors Decoration for Nurse Doctor,N/A,$14.99,,4.6,54.0,False,https://m.media-amazon.com/images/I/71The0l53lL._AC_UL320_.jpg,https://m.media-amazon.com/images/I/71The0l53lL._AC_SL1500_.jpg,,2026-04-23T10:06:24.955761,
54,3,Organic,,142.0,B0BWN19PG3,"Qpout Nurse Appreciation Week Banner - Thank You Nurse Background Banner 72x43 inches with 10m Rope,Happy National Nurses Week Nurses Day Decorations Nursing Graduation Party Supplies",N/A,$9.99,,4.9,27.0,False,https://m.media-amazon.com/images/I/81SvHPPx7UL._AC_UL320_.jpg,https://m.media-amazon.com/images/I/81SvHPPx7UL._AC_SL1500_.jpg,,2026-04-23T10:06:24.959690,
55,3,Organic,,143.0,B0CJYFPTVC,"Henoyso 72 Pcs Nurse Graduation Gifts 2026, Nursing Keychain Bulk for Women Medical Party Favors, Nurse Week Appreciation Set",N/A,$21.99,,4.7,92.0,False,https://m.media-amazon.com/images/I/71P7S2Ry+QL._AC_UL320_.jpg,https://m.media-amazon.com/images/I/71P7S2Ry+QL._AC_SL1500_.jpg,,2026-04-23T10:06:24.963112,
56,3,Organic,,144.0,B0GRVR4CXD,"2026 Nurse Appreciation Week Decorations, Thank You Nurses Heart Backdrop Banner for Hospital Decorations, Large Happy Nurses Week for Nursing RN Graduation Party Decorations Supplies",N/A,$6.99,,,,False,https://m.media-amazon.com/images/I/71mrm3GMHOL._AC_UL320_.jpg,https://m.media-amazon.com/images/I/71mrm3GMHOL._AC_SL1500_.jpg,,2026-04-23T10:06:24.968712,
58,3,Title,,,,Debug info copied.SponsoredKolldenn 50 Pcs Nurse Gift Bags Bulk Reusable Treat Nursing Candy Bags St,,,,,,False,,,,2026-04-23T10:06:24.970012,
59,3,Title,,,,Previous1234...7Next,,,,,,False,,,,2026-04-23T10:06:24.970398,
60,3,SB,4.0,,,N/A,https://aax-us-east-retail-direct.amazon.com/x/c/JFc_Xks83TWMWzRRUuNBEtQAAAGduBaUrwEAAAH2AQBvbm9fdHhuX2JpZDUgICBvbm9fdHhuX2ltcDIgICDYHR5L/clv1c_ek-wBPHXFbbWzjK3YoscrxfcOWxCnjqP7-1SB031t4GiBM723tgfByw74wBhAHm5LnJ-_0PlTP8K1_EjHokttWX1_aK7iO6AH2glLuak1O-6e0cDsgvwh23pyDnU5PTDkirRg-0TtMmEoob3SfYqURnZocGMFtfpFkf82TE6VAZc2mX4FKxm2U7WuvQC_90dAdA0hgpOFAT6mfLZF-hZ1vi5HtSxqt6fic3YWJOSiqrfv-L5070ySLYt1MaWc2fxiSnKmW23QtSBTyCGsNCyKf6xpFy_IVF3eRAYbUq9zAV7RhdrP3gKUQpjsBsS2E0mZU8T6CGptytXCWaqlKDwq9sKKx7wipw5qyoolwsI0ddpStU-sBhmUGqdZdE56yNHC3pPjmtWIvKs8SUdvQMoHgzf11VSk2De2lgA-O50Dt2TuTVBT15eAABCkUgbTTDRDTcLnKQ96IZSlR9kIpsq4y-nJY9kbHrq3eRcuTyscoeOy0JmRcQChLh4jG5Gm8xVGRWUAhW7SAwDGKC2FxnvX4mZVVnPWXbuQOxEaRId9-1I-2AWtenJT2WTsZ2DTwx6J98g2YnUaORp-wO4aXdqOhCHk6xJazRZnsv-FyrogupqBCN6DEehyfpvxbMQHgPm4l6JmxvPjHjAi8S69z03F3y6tr14fpkRYIrjHG6TdmzgFzVnxAyCtDGBLC2H1_sNSRpsm1jisGUKD0pcz1QTMYilLOh5l8hZupOwwGYrW3giZwnrADZL-FVJzixjexLn77lDbqBFzU7H1lgfgAr_kIfK42yo9AJ8QamZnAncyWGOO2l7EC6BEhVl155hqLtZRIamcVy8mgo2asJ_1KmvywwOrmbL-BZFUTwRYqr1SMXdgbmjZ9dXGSMf5BJ2RUC6mbqHHrq4GJH1Dq5keECZ9UTfs2z_IbesXI35BfQPyvjB84qtvr5X59phh85JbzyaFYuidd11lQsb17hXS6VjHZvmH1AXNdIL8c7QnByw1Kzuk0wcQ-kMs5FgTFUly0HKr4UnRajzZUO0lfRQ4PCUhjK5TiLKswioV8tvxlkIGPb1Epl2Z39sr7AJQ_VB-YHNF9cQPk35jOkPHX1xbiyWYW-9PASxQOolKqyj5VLKF37tsU8zVwWQ3QvfH9Ms8q0jHK6MK05xaLqPZb7vhZFqYqgPMyL9EcZTSa9uWPvHVG7cVQbpv1suZLS_VtsgksdLQSWB5Bhr0aVdCa1g463QjslZ-nh3Et1o41l56lhfmg913yVApOskau_rT9bNTnIzCDaQWCgov7JQnBRY1HN7gngGqo8sMJmxaEX-G5eeLIscZbaPqBoTaNHHXBfjdFTmhQf5oSF3k18seBK7RG6GdRe74V4890nrHgWfHkKYArWBLva0cgNsL-4UKHpygXCjXfixV5733BKsAR1IjWGSHZA5dAOgQYgWJhgjRmzuU48qzf4GA5ve7iKCjs9zl0EFSvGIFqMIt4z5Y8afdTnEbSfH9SC-GcSu9DgPUMX9Wn5ZaKtWHm7KP8BWAN4ANgw1A-PQ-QfBYZ-e0g0v90XA7q0yIQM1bruGLUx4Bl8eLkaaKQsvqlKtomvYkfJyNQdWj5tMzuRybRQBI9tXT7eF72UpE8UIBhmT22ds7USXHAwhq_ofOjy-wAXEHoZxLvfjTjA5XVcFIgpAu9INz38glRQv/https://www.amazon.com/stores/page/34E678B7-4D15-4AFC-85CE-A7BA402C1040/?_encoding=UTF8&store_ref=SB_A03872841U2OFHRDIB6UQ-A05160982HGWW6HIVK7BP&pd_rd_plhdr=t&aaxitk=254300269dc252ac8a7b34234d2ea6f6&hsa_cr_id=0&lp_asins=B0DNYDMF73%2CB0G529SKD1%2CB0G52H541K&lp_query=nurses%20week%20party%20decorations&lp_slot=desktop-hsa-3psl&ref_=sbx_be_s_3psl_mbd_mb0_bkgd&pd_rd_w=7VEmA&content-id=amzn1.sym.cd7c548b-a599-426f-9ffe-daa1aa803c87%3Aamzn1.sym.cd7c548b-a599-426f-9ffe-daa1aa803c87&pf_rd_p=cd7c548b-a599-426f-9ffe-daa1aa803c87&pf_rd_r=PND11WVC15BZQKC5669R&pd_rd_wg=G9R9D&pd_rd_r=1a9484ae-eeb9-4f4e-a377-35a9a31e3b0a,,,,,False,,,N/A,2026-04-23T10:06:24.974562,
61,3,Title,,,,Need help?Visit the help sectionorcontact us,,,,,,False,,,,2026-04-23T10:06:24.975193,
0,4,SB_Video,3.0,,,N/A,N/A,,,,,False,,,,2026-04-23T10:06:38.612596,1.0
1,4,Title,,,,ResultsCheck each product page for other buying options. Price and other details may vary based on p,,,,,,False,,,,2026-04-23T10:06:38.613903,
3,4,Organic,,145.0,B0BV9XMLN1,"3pcs Thank You Nurses Banner, Pre-assembled 2025 Nurse Week Day Party Decorations Appreciation Supplies for Mantle Fireplace Home Office Wall Nursing Graduation Favors",N/A,$8.99,,4.5,33.0,False,https://m.media-amazon.com/images/I/71QHEWb16SL._AC_UL320_.jpg,https://m.media-amazon.com/images/I/71QHEWb16SL._AC_SL1500_.jpg,,2026-04-23T10:06:38.620032,
4,4,Organic,,146.0,B0CTGBS857,"Nurses Week Banner Decorations, Happy Nurses Week Banner, Thank You Nurses Banner Party Decorations for National Nurses Day",N/A,$8.99,,4.2,11.0,False,https://m.media-amazon.com/images/I/71VOlF6XW1L._AC_UL320_.jpg,https://m.media-amazon.com/images/I/71VOlF6XW1L._AC_SL1500_.jpg,,2026-04-23T10:06:38.623717,
5,4,Organic,,147.0,B0DRCK8WP8,AIBIIN Thank You Nurses Banner Happy Nurses Week Welcome Backdrop Hanging Banner Nurse Day Porch Sign for School RN Party Decoration Photo Booth Background 70.8 x 43.3 inch,N/A,$7.59,,4.5,6.0,False,https://m.media-amazon.com/images/I/71PA-SWIySL._AC_UL320_.jpg,https://m.media-amazon.com/images/I/71PA-SWIySL._AC_SL1500_.jpg,,2026-04-23T10:06:38.628414,
