data_index,page,ad_type,ad_rank,organic_rank,asin,title,url,price_current,price_list,rating_stars,rating_count,is_prime,image_small,image_large,brand_name,scraped_at,inner_products_count
0,1,SB,1.0,,,Onyx Inflatable USCGA Approved Life Jackets,https://aax-us-east-retail-direct.amazon.com/x/c/JH_0xhWBlAhvxOhrtMdQPosAAAGduAONHAEAAAH2AQBvbm9fdHhuX2JpZDMgICBvbm9fdHhuX2ltcDIgICDvnAR8/clv1c_ek-wBAXWFbbezjI3YptcKUShqhZWsVyrlQ2G73qyiz3oZ02IiAaC3URW0xuSfEv15FacBggUSQH95F7QMhj6mMibMJhA7k47Oi5njN3h2I4WD2HAQgBC7Ob56-O0xjCwzR4363ymZggdr2xpkj9aWRTfudU8FlT-gvLSty_qboQZRF-1btzf2vG57YdGr2m6z4aAwPyAz8cLVeZuvloQIienQwq_Qw_nncrNC3WHjg6dpLmzsmkUHJNfiqyGF-OjCC6Y1rC728Fqxz5VEZv5PAnBCIMZrQtPKr_wlIR7ccTsiw0lLRA6Tg844_kLN81kcePVN074ceiV2uRvCyE9cj0IcEP8a4Fs5QCXIynz6GJ-0lwGOJ_f0vTJQdPpL5u0TE-krNuLDObQwqi2DWY4YUEi0EvIG_wdVDRJheWnhLTrL68iFd3hUA_QM4Tfdj-4OjEgD96qafDvjvHnCkRypsrUjTG1QKeNOpekggiNMDH_Mi0bjnpwJ8VFJ07KLtyKiLxoWxZtZaWig1wT5E7fCwE7cFEhVeVGpH7efMo8EHL4Pkkb2zywNgMbST_Bn6nOAo6gqJiNhV06LD2TKP05s6U1d3sAGfT3EDd9_TtygKl_xc5cLE-nXiONLWL-Ux_B4aszRK8b2XFjKh8oJSzmTiByDtuIl_E7gIhFLA2s6dy6KGcD0rkvozmWVrPPzh8gbZ3H3qycEIl4ChZ_Hp_-LPPofqj4FuAFRuGmely5dOeSGQsRrzKRN3Ya-BLHXhJtk3JGawzyYe0ysG2FaLf0quMs-O46e9Cq_XnuPKmVnJx5AN4d4f-ULHTPdJnZ9XMcVylTZnPwnjte-23aqyS_SfqExI3thjC7yUkax0NuMslaS1Cd91_v-Jaws-u4Pgl9Pbr8dbgim9o9szPozc313gi3IkAmdLKYVeIBYEMOwWjaZjd6Y1OR3DAJtA0IJjbmi7Cg8dl9YnGQbwRQFBu3knA9O5z67fqVAcVtrOC5Zp-FJ0f80eJ7CGuMlgNBiMIyFqUlw-F12gIOfLvG72CIYw4-l_C4Kc3DlQjFbenD-GPTfYCG9H3sW8MuGLMUclnkcxQUZvPM4E30ftj9UIZGknM7DYJYGTqX0s-uZf-22uHYlFq_2zf6n2FplfXb938ct7LpAhxK8Y8jaJTqd9JaQrlbHdfmX_jn3fDMlt21w0hOG-OVH5CFVn5lAiJOfMS-T2RC27xS-T4aNCg3aCzisNdfUluIOJwlhzHgZNEcpaePuKGfTYbhz-js1TR3iI973w10fi_BC5zjQ03TRqnFzQcMsi9SaN9l54XKCQ2Bq95wu_oY6Mt6Yi7Bb_DhcY6SruvRNWExOjl47pQ_-x26I5_p8cvLeBLnCih6CEbFPtKcF3wUs0Da_B2XqbY4p7_9lXH_w-WhscRt8_3BZnZnjuKXFovMhfhhkFjbzjzqHMp2dIWNHEGjhuanhfhdZcIs5VtTqnExY5shXi-Csfx3dQYIdvE1I1r4k6OSJIhfUML8DdXqyBA62xZNGvIz1cHfQbenU2X74AD89VbxKWTh_K_oj9aZdkQHlV-EyYkJAEE32RsHp4Wp_px2vVMtY-8w9_S-anlQVeLTaGnv0f_gnrnOcj-isu6Qg21GagClShDAW_xtfHIz1aL2fCr4lBtasY90KjReSQzB5iS9cN4D7WdLaIwa0vcRt6y4DgQ/https://www.amazon.com/stores/page/718D7203-E8F8-405B-BE32-1D81A1A3F85F/?_encoding=UTF8&store_ref=SB_A05998372W35JMQBPHEVL-A02351353POBX66QD89D1&pd_rd_plhdr=t&aaxitk=627b0a3f3064230272382d16428a1e44&hsa_cr_id=0&lp_asins=B07HPWN2S4%2CB0CGZ38DBN%2CB00NXVUM60&lp_query=pool%20floaties&lp_slot=auto-sparkle-hsa-tetris&ref_=sbx_s_sparkle_sbtcd_bkgd&pd_rd_w=liVub&content-id=amzn1.sym.2fb72bc8-96ef-420d-b08f-c04b69f36507%3Aamzn1.sym.2fb72bc8-96ef-420d-b08f-c04b69f36507&pf_rd_p=2fb72bc8-96ef-420d-b08f-c04b69f36507&pf_rd_r=MZRS4TVX6K1FJQ7MV52W&pd_rd_wg=DnrCB&pd_rd_r=9c9c1aa4-9712-4475-af3e-44c39f8e207e,,,,,False,"https://m.media-amazon.com/images/S/al-na-9d5791cf-3faf/42245b49-6735-4506-8f29-f81c7daba14f._CR0,0,1864,650_AC_SX130_SY60_CB1169409_QL70_.jpg",,Onyx Inflatable USCGA Approved Life Jackets,2026-04-23T09:45:38.027817,3.0
1,1,Title,,,,ResultsCheck each product page for other buying options. Price and other details may vary based on p,,,,,,False,,,,2026-04-23T09:45:38.028759,
3,1,Organic,,1.0,B0C946BBSW,"JUXIAO 5 Pack Upgrated XL Water Pool Floats, 4-in-1 (Hammock, Saddle, Lounge Chair, Drifter) Multi-Purpose Water Pool Float, Non-Stick PVC Material",N/A,$18.99,,4.4,1824.0,False,https://m.media-amazon.com/images/I/81yjIffjrOL._AC_UL320_.jpg,https://m.media-amazon.com/images/I/81yjIffjrOL._AC_SL1500_.jpg,,2026-04-23T09:45:38.034872,
4,1,Organic,,2.0,B0BRB6XJQL,Inflatable Unicorn Flamingo Pool Floats - Jasonwell 2 Pack Pool Floaties Inflatables Rafts for Swimming Pool Tubes for Floating Lake Beach Floaty Swim Rings Pool Party Toys for Adults Kids,N/A,$24.97,,4.6,2353.0,False,https://m.media-amazon.com/images/I/61CCCFzdKAL._AC_UL320_.jpg,https://m.media-amazon.com/images/I/61CCCFzdKAL._AC_SL1500_.jpg,,2026-04-23T09:45:38.043702,
5,1,Organic,,3.0,B0GT9B673M,"FUNBOY Orange & White Cabana Striped Mesh Pool Lounger Water Hammock with Built-in Pillow 70"" Pool Float for Adults Swimming Pool Accessories & Tanning Pool for Pool Party & Summer",N/A,$35.00,,,,False,https://m.media-amazon.com/images/I/71os-wReezL._AC_UL320_.jpg,https://m.media-amazon.com/images/I/71os-wReezL._AC_SL1500_.jpg,,2026-04-23T09:45:38.048423,
7,1,Title,,,,Debug info copied.SponsoredSLOOSH Pool Toys Games Set - Pong Toss Game Water Toys for Adults Kids Fa,,,,,,False,,,,2026-04-23T09:45:38.049446,
8,1,Title,,,,"Float in Style, Soak in Fun!Sponsored|Top 10 best-selling brand in this category|Shop FUNBOYShop now",,,,,,False,,,,2026-04-23T09:45:38.050650,
9,1,Title,,,,More results,,,,,,False,,,,2026-04-23T09:45:38.050780,
10,1,Organic,,4.0,B0BKTLNSLG,"SLOOSH Inflatable Pool Floats Adult,2 Packs Floating Lounge Chairs,Blow up Pool Noodles for Adult Heavy Duty,Floating Chair for Party Summer Water Beach Lake Fun",N/A,$29.98,,4.3,4694.0,False,https://m.media-amazon.com/images/I/91bpiQBEqyL._AC_UL320_.jpg,https://m.media-amazon.com/images/I/91bpiQBEqyL._AC_SL1500_.jpg,,2026-04-23T09:45:38.054491,
11,1,Organic,,5.0,B000OV0X4S,"INTEX 58859EP Sit 'N Float Inflatable Pool Float: Pool Lounge with Built-in Cup Holders – Heavy-Duty Handles – 220lb Weight Capacity – 58"" x 39"" – Colors May Vary",N/A,$14.90,,4.0,13609.0,False,https://m.media-amazon.com/images/I/710iUI8W+6L._AC_UL320_.jpg,https://m.media-amazon.com/images/I/710iUI8W+6L._AC_SL1500_.jpg,,2026-04-23T09:45:38.058656,
12,1,Organic,,6.0,B00SEYOWIA,"Intex, 43227-2120 Pack of 3: 30"" Transparent Tubes, Colors May Vary, Multi",N/A,$12.98,,4.2,4231.0,False,https://m.media-amazon.com/images/I/61YqCHefYpL._AC_UL320_.jpg,https://m.media-amazon.com/images/I/61YqCHefYpL._AC_SL1500_.jpg,,2026-04-23T09:45:38.062384,
13,1,Organic,,7.0,B0GGBS5F7V,Jasonwell Inflatable Pool Floats Adult - Fabric Pool Hammock Floaties Water Hammock Lake Beach Floating Lounger Chair Swimming Pool Noodles Mesh Party Floaty Toys Fun for Adults Heavy Duty,N/A,$14.99,,5.0,8.0,False,https://m.media-amazon.com/images/I/719Zt3hB3YL._AC_UL320_.jpg,https://m.media-amazon.com/images/I/719Zt3hB3YL._AC_SL1500_.jpg,,2026-04-23T09:45:38.067697,
14,1,Organic,,8.0,B0721468V1,"JOYIN Inflatable Swim Tube Raft (3 pack) with Summer Fruits Painting, Pool Toys for Swimming Pool Party Decorations",N/A,$16.99,,4.6,8373.0,False,https://m.media-amazon.com/images/I/71cpqrIteIL._AC_UL320_.jpg,https://m.media-amazon.com/images/I/71cpqrIteIL._AC_SL1500_.jpg,,2026-04-23T09:45:38.071207,
15,1,Organic,,9.0,B01KGS6022,INTEX Inflatable Pool Float: Pool Toy for Kids,N/A,$24.58,,4.5,23890.0,False,https://m.media-amazon.com/images/I/61VCVlYDzOL._AC_UL320_.jpg,https://m.media-amazon.com/images/I/61VCVlYDzOL._AC_SL1500_.jpg,,2026-04-23T09:45:38.074960,
16,1,Organic,,10.0,B0D68VRKS2,"Aqua 4-in-1 Monterey Hammock Pool Float & Water Hammock, Multi-Purpose, Inflatable Pool Floats for Adults, Patented Thick, Non-Stick PVC Material, One Light Blue & One Navy/White Stripe, 2-Pack",N/A,$25.89,,4.5,69349.0,False,https://m.media-amazon.com/images/I/814LFWjSmbL._AC_UL320_.jpg,https://m.media-amazon.com/images/I/814LFWjSmbL._AC_SL1500_.jpg,,2026-04-23T09:45:38.079707,
17,1,Organic,,11.0,B000030000,INTEX Inflatable Pool Float: Pool Toy for Kids,N/A,$24.04,,4.5,23890.0,False,https://m.media-amazon.com/images/I/81cNOujV5nL._AC_UL320_.jpg,https://m.media-amazon.com/images/I/81cNOujV5nL._AC_SL1500_.jpg,,2026-04-23T09:45:38.083631,
18,1,Organic,,12.0,B06W5WP5KL,"Intex, 43234-2327 3 Pack 59220EP - Animal Head Split Ring Pool Floats Bundle Includes Frog, Duck, Penguin, Giraffe, Frog, Penguin (Style May Vary)",N/A,$13.23,,4.5,3676.0,False,https://m.media-amazon.com/images/I/41PCBVHqTWL._AC_UL320_.jpg,https://m.media-amazon.com/images/I/41PCBVHqTWL._AC_SL1500_.jpg,,2026-04-23T09:45:38.087709,
19,1,Organic,,13.0,B0CCW5Y1D3,"SwimWays Spring Float Premium Hammock Pool Lounger, Inflatable Pool Floats Adult with Fast Inflation for Ages 15 & Up",N/A,$15.29,,4.6,824.0,False,https://m.media-amazon.com/images/I/8198vA2FJYL._AC_UL320_.jpg,https://m.media-amazon.com/images/I/8198vA2FJYL._AC_SL1500_.jpg,,2026-04-23T09:45:38.091783,
20,1,Organic,,14.0,B0DNK2ZYHB,"MoKo Inflatable Swimming Ring, Cute Pool Float Tube Decorations Swim Tubes Outdoor Pool Beach Water Floats Party Supplies Floaties",N/A,$9.99,,4.4,950.0,False,https://m.media-amazon.com/images/I/81N8uBCnySL._AC_UL320_.jpg,https://m.media-amazon.com/images/I/81N8uBCnySL._AC_SL1500_.jpg,,2026-04-23T09:45:38.095414,
21,1,Organic,,15.0,B07NX2V91X,"JOYIN 2-Pack Flamingo Unicorn Pool Float - Fun Floaties Inflatable Swimming Pool Tubes Toys Party Decorations, Summer Vacation Lake Beach Floaty Swim Rings Raft Lounger for Adults & Kids",N/A,$22.99,,4.4,3221.0,False,https://m.media-amazon.com/images/I/81U1c+sU5FL._AC_UL320_.jpg,https://m.media-amazon.com/images/I/81U1c+sU5FL._AC_SL1500_.jpg,,2026-04-23T09:45:38.098506,
22,1,Title,,,,More results,,,,,,False,,,,2026-04-23T09:45:38.098949,
23,1,Organic,,16.0,B0DC13QBNZ,"Giant Pop-Tarts Extra Large Inflatable Pool Float for Pool Playing, Over 5.5 Feet Long, Lounging and Party",N/A,$14.96,,4.5,169.0,False,https://m.media-amazon.com/images/I/81lyoKLlb1L._AC_UL320_.jpg,https://m.media-amazon.com/images/I/81lyoKLlb1L._AC_SL1500_.jpg,,2026-04-23T09:45:38.102274,
24,1,Organic,,17.0,B0BRNJSSV7,Jasonwell Inflatable Pool Float Adult - Pool Floaties Lounger Floats Floating Chair Raft with Adjustable Backrest Cup Holders Water Floaty Lake Lounge Tanning Floats Beach Party Toys for Adults,N/A,$21.99,,4.4,1973.0,False,https://m.media-amazon.com/images/I/81Yty2EW3PL._AC_UL320_.jpg,https://m.media-amazon.com/images/I/81Yty2EW3PL._AC_SL1500_.jpg,,2026-04-23T09:45:38.110087,
25,1,Organic,,18.0,B0BWYM8LB5,"Jasonwell Inflatable Tank Swimming Pool Floaties with Water Cannon Gun Swim Floaty Rafts for Lake, Beach & Pool Party Toys for Boys, Girls, Kids & Adults- Green",N/A,$35.99,,4.3,1559.0,False,https://m.media-amazon.com/images/I/814lFySmUsL._AC_UL320_.jpg,https://m.media-amazon.com/images/I/814lFySmUsL._AC_SL1500_.jpg,,2026-04-23T09:45:38.119392,
26,1,Organic,,19.0,B0DJ278M42,"2-Pack Swimming Pool Float Hammock, Multi-Purpose Inflatable Hammock Pool Hammock (Saddle, Lounge Chair, Hammock, Drifter), Water Hammock Lounge",N/A,$15.99,,4.4,3258.0,False,https://m.media-amazon.com/images/I/81ecQWJUHLL._AC_UL320_.jpg,https://m.media-amazon.com/images/I/81ecQWJUHLL._AC_SL1500_.jpg,,2026-04-23T09:45:38.122790,
27,1,Organic,,20.0,B0CCW6WLJ9,"SwimWays Spring Float Premium Recliner Pool Lounger, Inflatable Pool Floats Adult with Fast Inflation for Ages 15 & Up, Sky Blue",N/A,$39.99,,4.5,13262.0,False,https://m.media-amazon.com/images/I/81n68B7MJuL._AC_UL320_.jpg,https://m.media-amazon.com/images/I/81n68B7MJuL._AC_SL1500_.jpg,,2026-04-23T09:45:38.127423,
28,1,Organic,,21.0,B073WMYP6M,"Aqua Original 4-in-1 Monterey Hammock Pool Float & Water Hammock – Multi-Purpose, Inflatable Pool Floats for Adults – Patented Thick, Non-Stick PVC Material – Navy",N/A,$14.99,,4.5,69349.0,False,https://m.media-amazon.com/images/I/81o1FlIFlPL._AC_UL320_.jpg,https://m.media-amazon.com/images/I/81o1FlIFlPL._AC_SL1500_.jpg,,2026-04-23T09:45:38.131207,
29,1,Organic,,22.0,B0BRN8WHJQ,Jasonwell Inflatable Pool Float Lounge - 2 Pack Floaties Rafts for Adults Floating Lounger Sun Tanning Floats Cool Water Floaty Swimming Lake Beach Party Toys,N/A,$23.99,,4.4,1486.0,False,https://m.media-amazon.com/images/I/81vk1ujoGhL._AC_UL320_.jpg,https://m.media-amazon.com/images/I/81vk1ujoGhL._AC_SL1500_.jpg,,2026-04-23T09:45:38.139305,
30,1,Organic,,23.0,B08R7Z55GK,"Inflatable Donuts - (Pack of 4) 24 Inch Donut Pool Float for Kids Ages 2-6 Pool Tube, Assorted Swim Rings with Sprinkles for Pool Floaties, Party Decorations",N/A,$14.99,,4.0,1207.0,False,https://m.media-amazon.com/images/I/91U6O2UiRFL._AC_UL320_.jpg,https://m.media-amazon.com/images/I/91U6O2UiRFL._AC_SL1500_.jpg,,2026-04-23T09:45:38.145718,
31,1,Organic,,24.0,B09VTDW2FC,"Stonful 2 Pack Inflatable Pool Float Mat, Giant Pool Floats Adult Size with Headrest, Lake Float Raft Water Lounger, Multi-Purpose Swimming Pool Floats for Pool Party, Summertime Beach, Outdoor",N/A,$23.99,,4.5,2171.0,False,https://m.media-amazon.com/images/I/910yMWj5u5L._AC_UL320_.jpg,https://m.media-amazon.com/images/I/910yMWj5u5L._AC_SL1500_.jpg,,2026-04-23T09:45:38.150089,
32,1,Organic,,25.0,B0CQYFJN2Z,"8 Pack Inflatable Pool Floats Kids, 4 Pcs Fruit Swim Tubes Rings and 4 Pcs Beach Balls, Pool Floaties Summer Hawaiian Beach Toys Swimming Luau Party Floats for Kids Adults Water Fun",N/A,$18.99,,3.9,210.0,False,https://m.media-amazon.com/images/I/81bzpPXMBlL._AC_UL320_.jpg,https://m.media-amazon.com/images/I/81bzpPXMBlL._AC_SL1500_.jpg,,2026-04-23T09:45:38.153599,
33,1,Organic,,26.0,B09NVFT7HP,Inflatable Tanning Pool Lounger Float - Jasonwell 4 in 1 Sun Tan Tub Sunbathing Pool Lounge Raft Floatie Toys Water Filled Tanning Bed Mat Pad for Adult Blow Up Kiddie Pool Kids Ball Pit Pool (L),N/A,$28.97,,4.3,8384.0,False,https://m.media-amazon.com/images/I/71pFZe7z2hL._AC_UL320_.jpg,https://m.media-amazon.com/images/I/71pFZe7z2hL._AC_SL1500_.jpg,,2026-04-23T09:45:38.164752,
34,1,Organic,,27.0,B0CCW5FW43,"SwimWays Baby Spring Float with Adjustable Canopy and UPF Sun Protection, Blue Lobster",N/A,$27.49,,4.6,16082.0,False,https://m.media-amazon.com/images/I/81ATK60-w8L._AC_UL320_.jpg,https://m.media-amazon.com/images/I/81ATK60-w8L._AC_SL1500_.jpg,,2026-04-23T09:45:38.169680,
35,1,Organic,,28.0,B0GGZCL9KX,"Pool Floats Adult, 3Pack/2Pack/1Pack Adjustable Heavy Duty Inflatable Pool Floats Chair, Portable Pool Float Lounger for Adults & Kids, Pool Floaties for Summer Pool Beach Lake Party Fun",N/A,$39.99,,4.8,11.0,False,https://m.media-amazon.com/images/I/81D41GeNV8L._AC_UL320_.jpg,https://m.media-amazon.com/images/I/81D41GeNV8L._AC_SL1500_.jpg,,2026-04-23T09:45:38.174449,
36,1,Organic,,29.0,B00OHMOH9M,Set of 2 Intex MAT Relax-a-mat Float Water Swim Pool Lake Raft Tube Flotation,N/A,$13.49,,3.6,2565.0,False,https://m.media-amazon.com/images/I/61BSLElOIPL._AC_UL320_.jpg,https://m.media-amazon.com/images/I/61BSLElOIPL._AC_SL1500_.jpg,,2026-04-23T09:45:38.179070,
37,1,Organic,,30.0,B0BR5NLF9P,"Jasonwell 4 in 1 Inflatable Tanning Pool Lounger Float - Sunbathing Lounge Floatie Raft Toys, Water Filled Tanning Bed Mat Pad Blow Up Kiddie Pool with Ball Pit for Adult, Kids (L)",N/A,$29.97,,4.3,8384.0,False,https://m.media-amazon.com/images/I/71goaDpLYxL._AC_UL320_.jpg,https://m.media-amazon.com/images/I/71goaDpLYxL._AC_SL1500_.jpg,,2026-04-23T09:45:38.192711,
38,1,Organic,,31.0,B083B979JB,"JOYIN Donut Pool Float with Glitters 32.5” (3 Pack), Funny Tube Toys for Swimming Pool Party and Donut Party Supplies",N/A,$18.99,,4.6,8373.0,False,https://m.media-amazon.com/images/I/81FyoqB99pL._AC_UL320_.jpg,https://m.media-amazon.com/images/I/81FyoqB99pL._AC_SL1500_.jpg,,2026-04-23T09:45:38.197879,
39,1,Organic,,32.0,B00HIWL37M,"GoPong Pool Lounge Beer Pong Inflatable with Social Floating, White",N/A,$31.99,,4.6,4920.0,False,https://m.media-amazon.com/images/I/71rmRKZuuCL._AC_UL320_.jpg,https://m.media-amazon.com/images/I/71rmRKZuuCL._AC_SL1500_.jpg,,2026-04-23T09:45:38.209299,
40,1,Organic,,33.0,B09CJL9MMV,"Waterlife 4-in-1 Pool Hammock 2-3-4 Packs, Inflatable Pool Chair Float, Water Hammock (Saddle, Lounge Chair, Hammock, Drifter), Multiple Colors",N/A,$34.82,,4.5,3626.0,False,https://m.media-amazon.com/images/I/61v2LFgOSgL._AC_UL320_.jpg,https://m.media-amazon.com/images/I/61v2LFgOSgL._AC_SL1500_.jpg,,2026-04-23T09:45:38.214784,
41,1,Organic,,34.0,B0DRFGKFVW,Jasonwell Inflatable Pool Float Chair - 2Pack Floating Pool Chair Lounge Floats for Swimming Pool Water Chair Pool Lounger with Cup Holder Pool Toy Party Floaties for Adults (BG-L),N/A,$24.99,,4.3,3764.0,False,https://m.media-amazon.com/images/I/91Ijv-3Bh6L._AC_UL320_.jpg,https://m.media-amazon.com/images/I/91Ijv-3Bh6L._AC_SL1500_.jpg,,2026-04-23T09:45:38.226079,
42,1,Organic,,35.0,B0DSPWPH4C,"4 Pack Inflatable Pool Floats, OKSUWATER 4-in-1 Water Hammock, Pool Floats Adult Size for Swimming Pool Party Summer Lake Water Fun",N/A,$19.99,,4.7,553.0,False,https://m.media-amazon.com/images/I/81Kk-xDIdeL._AC_UL320_.jpg,https://m.media-amazon.com/images/I/81Kk-xDIdeL._AC_SL1500_.jpg,,2026-04-23T09:45:38.230188,
43,1,Organic,,36.0,B0DR8LZ4MK,"AEOCOO Puddle Float Jumper 20-30-50-60-70 Pounds, Toddler Swim Vest for 1-3-5-6-9 Years Old, Pool Floats with Swimming Arm Floaties Swim Jacket & Water Wings for Kids Swimmies, Boys, Girls, Niños",N/A,$24.62,,4.7,697.0,False,https://m.media-amazon.com/images/I/71OK+0lrzbL._AC_UL320_.jpg,https://m.media-amazon.com/images/I/71OK+0lrzbL._AC_SL1500_.jpg,,2026-04-23T09:45:38.234778,
44,1,Organic,,37.0,B0DC12L24R,"Giant Cheez-It Pool Float – Extra Large Inflatable Snack Shaped Floatie for Pool, Beach & Lake, Durable Vinyl, Over 4.5 Feet, Perfect for Lounging, Summer Parties, 4th of July Pool Party",N/A,$23.49,,4.5,171.0,False,https://m.media-amazon.com/images/I/81XCL0bMkLL._AC_UL320_.jpg,https://m.media-amazon.com/images/I/81XCL0bMkLL._AC_SL1500_.jpg,,2026-04-23T09:45:38.238669,
45,1,Organic,,38.0,B08V52LJV1,"Sloosh 4 Pack Inflatable Pool Floats, Pool Tube Rings, Swim Tubes, Floaties Toys, Beach Swimming Party Toys for Kids and Adults",N/A,$21.99,,4.6,2477.0,False,https://m.media-amazon.com/images/I/91aIykErXJL._AC_UL320_.jpg,https://m.media-amazon.com/images/I/91aIykErXJL._AC_SL1500_.jpg,,2026-04-23T09:45:38.241850,
46,1,Organic,,39.0,B09QLR9HKM,"LAYCOL Baby Pool Float with Canopy UPF50+, 120°Adjustable Sun Protection and Anti-Tip Safety Seat, Inflatable Toddler Floaties Infant Pool Float with Animal Pool Toys, Baby Beach Essentials for 6-36M",N/A,$25.98,,4.6,2312.0,False,https://m.media-amazon.com/images/I/61RkKkTzBvL._AC_UL320_.jpg,https://m.media-amazon.com/images/I/61RkKkTzBvL._AC_SL1500_.jpg,,2026-04-23T09:45:38.246556,
47,1,Organic,,40.0,B000KHZ044,"Intex Inflatable Lounge Pool Recliner Lounger Chair with Cup Holders - Heavy-Duty Float Raft for Adults, 220 Lb Capacity Large Floating Tanning Chair",N/A,$25.99,,4.4,19591.0,False,https://m.media-amazon.com/images/I/61XJ+fF0I7L._AC_UL320_.jpg,https://m.media-amazon.com/images/I/61XJ+fF0I7L._AC_SL1500_.jpg,,2026-04-23T09:45:38.250172,
48,1,Organic,,41.0,B0BRV88TXF,"EZIGO Baby Pool Float with Canopy UPF50+ Sun Protection, Inflatable Kids Pool Floats with Ocean Animal Toys for Baby 6-36 Months, Infant Swimming Float with Adjustable Safety Seat for Boys Girls",N/A,$25.99,,4.7,1159.0,False,https://m.media-amazon.com/images/I/71fM7yprGhL._AC_UL320_.jpg,https://m.media-amazon.com/images/I/71fM7yprGhL._AC_SL1500_.jpg,,2026-04-23T09:45:38.253175,
49,1,Organic,,42.0,B0CCW4TKHB,"SwimWays Spring Float Premium Hammock Pool Lounger, Inflatable Pool Floats Adult with Fast Inflation for Ages 15 & Up, Sky Blue",N/A,$15.29,,4.6,1429.0,False,https://m.media-amazon.com/images/I/81XF00bl+7L._AC_UL320_.jpg,https://m.media-amazon.com/images/I/81XF00bl+7L._AC_SL1500_.jpg,,2026-04-23T09:45:38.257515,
50,1,Organic,,43.0,B0CQY8WY2G,"6 Pack Pool Floats Kids, 3 Pcs Inflatable Fruits Swim Tubes Rings & 3 Pcs Rainbow Beach Ball Bulk, Summer Pool Floaties for Kids Adults Swimming Float Toy Hawaiian Party Beach Water Fun Game",N/A,$13.49,,4.2,132.0,False,https://m.media-amazon.com/images/I/71SCUuCJ+FL._AC_UL320_.jpg,https://m.media-amazon.com/images/I/71SCUuCJ+FL._AC_SL1500_.jpg,,2026-04-23T09:45:38.265337,
51,1,Organic,,44.0,B076H9CX6D,"JOYIN Giant Inflatable Pizza Slice Pool Float, Fun Pool Floaties, Swim Party Toy, Summer Pool Raft (1 Pack), Extra Large with Cup Holders",N/A,$29.99,,4.5,1875.0,False,https://m.media-amazon.com/images/I/81IKLCCWhOL._AC_UL320_.jpg,https://m.media-amazon.com/images/I/81IKLCCWhOL._AC_SL1500_.jpg,,2026-04-23T09:45:38.269748,
52,1,Title,,,,More results,,,,,,False,,,,2026-04-23T09:45:38.270270,
53,1,Organic,,45.0,B0BY29WRGR,"4 Pack Upgrated XL Water Pool Floats, 4-in-1 (Hammock, Saddle, Lounge Chair, Drifter) Multi-Purpose Water Pool Float, Non-Stick PVC Material",N/A,$16.99,,4.6,1589.0,False,https://m.media-amazon.com/images/I/81gUjtxHV3L._AC_UL320_.jpg,https://m.media-amazon.com/images/I/81gUjtxHV3L._AC_SL1500_.jpg,,2026-04-23T09:45:38.275213,
54,1,Organic,,46.0,B002V1H0W2,"Intex 56508EP Inflatable Floating Swimming Pool Toys Volleyball Game, Green",N/A,$10.99,,4.2,19725.0,False,https://m.media-amazon.com/images/I/61BD7zML5mL._AC_UL320_.jpg,https://m.media-amazon.com/images/I/61BD7zML5mL._AC_SL1500_.jpg,,2026-04-23T09:45:38.281152,
55,1,Organic,,47.0,B0DSPWP99T,"5 Pack Inflatable Pool Floats, OKSUWATER 4-in-1 Water Hammock, Pool Floats Adult Size for Swimming Pool Party Summer Lake Water Fun (5 Pack-Multicolor)",N/A,$21.98,,4.7,421.0,False,https://m.media-amazon.com/images/I/819XdTCgKcL._AC_UL320_.jpg,https://m.media-amazon.com/images/I/819XdTCgKcL._AC_SL1500_.jpg,,2026-04-23T09:45:38.286201,
56,1,Organic,,48.0,B0CWQVQSN3,"90shine 7-Pack Luau Pool Floats: Inflatable Floaties Rings and Beach Balls, Floating Tubes & Toys for Kids Adults, Swimming Beach Pool Party Decorations",N/A,$21.99,,4.4,2821.0,False,https://m.media-amazon.com/images/I/81IwuBI1LOL._AC_UL320_.jpg,https://m.media-amazon.com/images/I/81IwuBI1LOL._AC_SL1500_.jpg,,2026-04-23T09:45:38.290892,
58,1,Title,,,,"Debug info copied.SponsoredFunscape Kids Fun Pool Floating Water Toys, Inflatable Tic-Tac-Toe Dart B",,,,,,False,,,,2026-04-23T09:45:38.291874,
59,1,Title,,,,Related searchespool floaties for adultspool arm floatiespool toyspool floatspool floaties for kidsp,,,,,,False,,,,2026-04-23T09:45:38.293129,
60,1,Title,,,,Previous123...7Next,,,,,,False,,,,2026-04-23T09:45:38.293702,
61,1,SB,2.0,,,N/A,https://aax-us-east-retail-direct.amazon.com/x/c/JJoBPH2cb7_hKK9ZIdTFMn4AAAGduAONFQEAAAH2AQBvbm9fdHhuX2JpZDMgICBvbm9fdHhuX2ltcDEgICDAS2Kp/clv1c_ek-wBHHWLcTSXU6htl9b_VZOmETDGFzEbcT8RF3w3cLx7jMkslmf65JLhf4fiu1B__stSfy7L67S3yJG9W_oaKf2SNVoTbsaQ70Bt4KznHRwiBcBQuLULSz75pVc9rv6c5FI_ihNCf_TsyUelv2myJHesrX8llZ-EcT-yWcCjMYYWsEcQeC9aW4Aeor-DXcZ3qca7kRGAwvg5X1tNs0uWkDFHlYmHcGV4JqLi9MB7_HU7DElMvCHoIH4Bb-rGR6WhGCX1X_Vjm2zayWa-FUhuA12tpu-r_MXSdAbcybE9Sg8d5ZHmLgjkEo4jrXvCpqgu8vVLLSwefMu54QnrVb0rDeSe_K1XUPQ4LMpepYhfztAGR75WCh9Bvf9nll5FkIbiAwOa6_tZEcAAmc_VKl6C3eoXqw7T4l0t1Ru0boelFBksKsZUjAyCowtUGcXy1hKrR6PkzsKZ5cvDEnPDIxttXVxUsqOwXp-mq-a4CULzGzuY6yoeU4EHH89l_94KXyDgwRSi5oDKkNgWK54b1GeANIr3fpLVPLgIQX_AAbe6ZeqrwLj7A7B2fId2rI8I85SsBOZ7Wtaf_JUJEfLmRS-ByLTa8g_xODWdzqowdyNojjkXXMzhrCPiF6b6jN9t5rNQuRgOpc95WbDlxucyYIePqhm91utOLpzXYYNsXX0yFtGNrR7FkXzRJa_ccq6DMD6MFGoSxgUIMdrAOVmNVH13q-lTxkYQtE-02M1d5_Yp8jh-Ev-ESyMMDiMeZdHxjmnErk0XOLcIzv5NyGbEpDaemOsKsdOJGcSDmuyMZgR6SkpKD1uq4ZAKHc19s0NITvOmqi6W4zHSCoZIxZDHCwlsBGa2CQ9e8jnjsDiwE_uebfuGTjSDsDy5Tp64jkEPQF5nRweJe7gUxEGo_BL5ZGxcwAJtbbFqY2L-4NCxxYzTdiBchLb80PKdWqA3wcGJmaV_OE7h8Y2eGV4xxGiBsT0uLezPNlQqW1GKEJh-H2dy58kFg6iNONM0vYo23JM4WBF9_om7VT61Y85JrBlsbhOtomkIl6_J_24hfLyGGQNFFjJGYuZPsumSr9LPX7V2b5Aw4Kav--ys3mjLuioz1EbFFlwnhMuHG4NZAhVoMmv7U5HVRt7E3yPLvjlmR1mEjutET-39y3yF-C989hHc0BdEeHTSTopne6O9qHyyEGcfhs29ZUjAhUfbBAeqeb3F0gHrYcEmWx8UmeLXEz1PzrpS7SRRpZihUfY7SejdAOPsgP8MLJYzdA-fAZ4PiLYIT_OJpH5ukxAlIMsTP9j82WPbf7blDsckUoQEloxnb1_rJ0BE_OZcMlULh68Gh-T-HIGLW9JIPgD6piDqDhYSXehnco0NewDK_5bLL1YFAWl3tIS9IkSFuoGrrblPdlMj-F0nHsD96bVGa642L4srjpiOR-Q6kVsbHXwJzhOnM_pKjeyBiBKk7sEKe1fPiwrohVYUMTnSk1pIq0wcu2m9-_ISKFoAi_fSo1H7dlEbzWpTQFXTk2WxZnxuj5cF4HASFZtTfITAdLiU_5GvhTcvjiUlWRsG5-H7sKxV_Yfko2gTn5NEyta9H34-qJDZDHsZ1zvQSE1_7bCQGb6Qa9l1rgJ30sYshIYvIw11bLyCvJYEY9Bfkhc1lxvxoNKJsm9SBDVBgv8BbpSnn9fmaU_awNS1c2jH88/https://www.amazon.com/stores/page/50ABEE87-0CCA-4217-AA34-C052EA3AD808/?_encoding=UTF8&store_ref=SB_A0601221B9OD9IBKZZ3T-A0095637NN3FLEBHH01J&pd_rd_plhdr=t&aaxitk=f65070c5bb33310904ad9a21e7b3df81&hsa_cr_id=0&lp_asins=B0CXVB1ZTS%2CB0DYGYPHR5%2CB0DYHJW7Q1&lp_query=pool%20floaties&lp_slot=desktop-hsa-3psl&ref_=sbx_be_s_3psl_mbd_mb0_bkgd&pd_rd_w=EZbxB&content-id=amzn1.sym.cd7c548b-a599-426f-9ffe-daa1aa803c87%3Aamzn1.sym.cd7c548b-a599-426f-9ffe-daa1aa803c87&pf_rd_p=cd7c548b-a599-426f-9ffe-daa1aa803c87&pf_rd_r=MZRS4TVX6K1FJQ7MV52W&pd_rd_wg=0Cy0d&pd_rd_r=86a783ef-0c0d-49c2-9333-293a8dfe152a,,,,,False,,,N/A,2026-04-23T09:45:38.298690,
62,1,Title,,,,Need help?Visit the help sectionorcontact us,,,,,,False,,,,2026-04-23T09:45:38.299443,
0,2,SB_Video,1.0,,,N/A,N/A,,,,,False,,,,2026-04-23T09:45:52.640967,1.0
1,2,Title,,,,ResultsCheck each product page for other buying options. Price and other details may vary based on p,,,,,,False,,,,2026-04-23T09:45:52.642276,
3,2,Organic,,49.0,B07WDM32ZC,Aqua Campania Ultimate 2-in-1 Pool Float Lounge – Extra Large – Inflatable Pool Floats for Adults with Adjustable Backrest & Cupholder Caddy,N/A,$47.99,,4.4,13440.0,False,https://m.media-amazon.com/images/I/91yqwgkFJxL._AC_UL320_.jpg,https://m.media-amazon.com/images/I/91yqwgkFJxL._AC_SL1500_.jpg,,2026-04-23T09:45:52.648672,
4,2,Organic,,50.0,B0BRCZX2W5,Jasonwell Inflatable Pool Toys Floats for Swimming Pool Party Lake Beach Kids Adults - 4 Pack Floaties Pool Tubes Swim Rings Fruit Water Floaty Watermelon Kiwi Orange Grape,N/A,$19.99,,4.4,2068.0,False,https://m.media-amazon.com/images/I/71yvLYDshOL._AC_UL320_.jpg,https://m.media-amazon.com/images/I/71yvLYDshOL._AC_SL1500_.jpg,,2026-04-23T09:45:52.657810,
5,2,Organic,,51.0,B00AY2KDS8,"Intex King Kool Inflatable Lounge, 63"" X 33.5"", 1 Pack (Colors May Vary)",N/A,$26.25,,4.5,15977.0,False,https://m.media-amazon.com/images/I/61WoeQD14ML._AC_UL320_.jpg,https://m.media-amazon.com/images/I/61WoeQD14ML._AC_SL1500_.jpg,,2026-04-23T09:45:52.662476,
6,2,Title,,,,Swim Tube for AdultSponsored|Shop VertintongShop nowPrevious pageVertintong 6 Pcs Inflatable Pool Fl,,,,,,False,,,,2026-04-23T09:45:52.664458,
7,2,Title,,,,More results,,,,,,False,,,,2026-04-23T09:45:52.664614,
8,2,Organic,,52.0,B0CCW6DZB5,"SwimWays Spring Float Premium Papasan Pool Lounger, Inflatable Pool Floats Adult with Fast Inflation for Ages 15 & Up",N/A,$16.99,,4.6,6926.0,False,https://m.media-amazon.com/images/I/811YdJACngL._AC_UL320_.jpg,https://m.media-amazon.com/images/I/811YdJACngL._AC_SL1500_.jpg,,2026-04-23T09:45:52.668373,
